Job Title,Company,Location,Salary,Description,Link
Data Analyst,The Greentree Group,"Tallahassee, FL",Full-time,"Profile insightsFind out how your skills align with the job descriptionSkillsDo you have experience in Scrum?YesNoEducationDo you have a Master's degree?YesNo&nbsp;Job detailsHere’s how the job details align with your profile.Job typeFull-time&nbsp;BenefitsPulled from the full job description401(k)401(k) matchingAD&D insuranceDental insuranceDisability insuranceFlexible scheduleFlexible spending accountShow morechevron down&nbsp;Full job description

Data Analyst



Are you a tech enthusiast who loves solving complex problems?
Do you have a keen eye for detail and excellent analytical skills?
Would your friends describe you as a self-starter who takes pride in your work and enjoys collaborating with others?


   If so, we have an exciting opportunity for you at The Greentree Group!
  


WHO WE ARE


   The Greentree Group is a dynamic, innovative, and thriving company that specializes in delivering advanced technology solutions to federal, state, and commercial clients. With a team of highly skilled professionals, we provide cutting-edge services and are always pushing the boundaries of what’s possible.
  


   What sets us apart is our commitment to excellence and our passion for the work we do. At The Greentree Group, we are driven by a shared sense of purpose and a desire to make a difference in the lives of people around us. Whether it's helping our clients achieve their goals, developing innovative solutions to complex problems, or giving back to the community, we are dedicated to making a positive impact.
  


   We also believe in investing in our people and providing them with opportunities for growth, development, and advancement. We offer a dynamic and supportive work environment, a culture of continuous learning, and a wide range of benefits and perks that promote work-life balance and personal well-being.
  


   Whether you're a seasoned expert or just starting out in your career, if you're passionate about technology, committed to excellence, and eager to take on new challenges, we want to hear from you!
  


ABOUT THE OPPORTUNITY


   As a potential Data Analyst, you will have the opportunity to work with cutting-edge technologies and collaborate with a talented team of professionals in support of a client in the Tallahassee, FL area. This potential role will serve as the principal line of communication for the project team in a state-wide implementation effort. Join us and be part of our mission to make a difference!
  


SOME RESPONSIBILITIES INCLUDE BUT ARE NOT LIMITED TO:


Implement data modeling and design techniques to build scalable and efficient data structures to meet the Departments accounting and budgeting reporting needs.
Design and create data dashboards, visualizations, and reports using Power BI, providing critical insights to stakeholders.
Troubleshoot any issues that arise in the data warehouse and implement solutions.
Collaborate with other team members, stakeholders, and data users to ensure the new data warehouse meets the needs of the Department.
Continuously monitor, refine, and report on the performance and capacity of the data warehouse.
Configure and administer data warehouse security settings. Work closely with the Information Security team to ensure the best practices are in place.
Stay up to date on new data warehousing technologies and approaches.
Train and mentor less experienced team members.
Coordinate with other IT teams to ensure smooth data warehouse operations.
Handle incident management and problem resolution for data warehouse issues.
Developing data mining models to identify trends and patterns within large datasets.
Ensuring that data is accurate and clean, using statistical methods such as data profiling and data quality analysis to identify potential problems with data quality before using it in reports or analyses.
Developing and thoroughly documenting the processes and procedures for the warehouse’s day-to-day operations, including creating backup plans for disaster recovery in case of equipment failure or data loss.
Designing and implementing data warehouse solutions that meet the Department’s needs while ensuring compliance with industry regulations regarding security of sensitive data.
Work collaboratively with stakeholders’ teams to compile audience profiles, insights, and measurement plans.
Create simple, easy-to-follow reports and dashboards that key department heads will utilize on a regular basis to make informed business decisions.
Work with multiple Project Managers to deliver capabilities/projects/data sets/reports that have been prioritized by the Business Product Owners.
Works with the Manager of the Department’s Research & Data Team and other stakeholders to accurately integrate collected data into the data warehouse. Using descriptive analytics, researches and performs statistical analysis to identify actionable insights.
Ensures that reporting and key institutional metrics are regularly updated, available, and accurate.
Provides expertise to the Data Governance team.
Create ad-hoc reports as needed.
Stays current of technology and best practices. Regularly attends training and proactively conducts research when available.
Assist in overseeing the work of several other individuals.
Must be able to motivate team members, delegate tasks, perform knowledge transfer and mentor staff.
Must be able to handle all duties and information in a confidential manner.
Must have the ability to simplify information systems and make sound business decisions.
Perform other job-related duties as assigned.



MINIMUM QUALIFICATIONS:


Master’s or Bachelor's Degree, from an accredited college/university, in Computer Science, Information Systems, or other related field, or four (4) years of equivalent work experience.
Seven (7) or more years’ experience in a Business Intelligence (BI), Data Engineer, or Extract, Transform, and Load (ETL) role.
Proven experience working with SQL databases and Microsoft Structured Query Language (SQL) Server.
Proven track record of successful data warehouse implementations.
Proven experience in data warehouse design and development.
Proven experience in ETL tools and processes, and in data migration projects.
Proficient understanding of data warehousing methodologies.
Proven proficiency with Microsoft Power BI for creating dashboards and reports.
Proven experience with data modeling, data architecture, and data quality concepts.
Proven proficiency in SQL and other data languages.
Excellent troubleshooting and problem-solving abilities.
Strong communication skills, capable of explaining complex concepts to non-technical stakeholders.
Must be able to clearly convey information and ideas in both written and verbal forms to share information and ideas and resolve issues.
Strong written and verbal communication skills required.
Ability to communicate/interact professionally and tactfully with people of different levels of education, cultural backgrounds, and life experiences, and to exhibit respect to others.
Organizational skills with strong attention to detail including the ability to adequately establish time frames and deadlines, to meet deadlines, and to follow through on tasks and assignments.
Candidates must successfully complete a Level II Background Check.



DESIRED QUALIFICATIONS:


Experience working in the corrections or public safety sector.
Experience working with financial systems.
Previous involvement in public sector IT projects.
Experience working with large datasets and data lakes.
Experience with other data visualization tools.
Familiarity with Databricks SQL.
Experience with Big Data technologies.
Familiarity with Machine Learning and Artificial Intelligence concepts and their application in data analysis.
Experience in implementing ML and AI solutions in data warehouse environments.
Experience with security technologies around cloud solutions, preferably Azure.
Experience managing projects using Scrum and Kanban.
Preferred Licensing or Certifications, such as: 
    
ASCM Warehousing Certification
Data Warehousing and BI Certification Training
Data Warehousing for Business Intelligence Specialization
BI Foundations with SQL, ETL and Data Warehousing Specialization
Enterprise Data Management




   We believe in fostering a positive, inclusive culture that values diversity, teamwork, and personal growth. With opportunities for advancement and a supportive community of colleagues, The Greentree Group is the perfect place to build your career. Learn more about us at www.greentreegroup.com. Please note that this role may require a National Agency Check (NAC) and/or background check, and relocation assistance is not available at this time.
  


Greentree is an Equal Opportunity Employer and does not discriminate based on race, color, religion, sex, national origin, age, sexual orientation, gender identity, genetic information, or status as a qualified individual with a disability or protected veteran.



Compensation / Salary Range: Greentree adheres to federal, state, and local regulations. This is a Full-Time, Salary, Exempt position. The following salary range is what we reasonably expect to pay but is contingent and subject to a variety of factors, including but not limited to years of experience, education, certification(s), training, specialized skills, responsibilities, etc.
  


Bonuses: Greentree has an employee referral bonus, as well as employee bonuses based on employee contributions and Greentree’s yearly performance.
  


Top Benefits


Core Benefits 100% paid by Greentree: Employee Medical Premium on the High Deductible Health Plan (HDHP), Basic Life Insurance and AD&D, Short-Term Disability (STD), Long-Term Disability (LTD), Health Reimbursement Account (HRA), 401(k) Match, Job-Related Certifications, and Training Programs
  


Elected Benefits: Medical, Dental, Vision, HSA, FSA, Voluntary Term Life, 401(k) (Roth and Pretax available)
  


Time Off: PTO, Flexible Schedules, Holidays and Paid Parental Leave: Work-life balance is important – we all enjoy some time off for rest and relaxation! Employees receive a very generous amount of PTO which is granted on start date, plus the ability for quick escalation to the next tier. Flexible/hybrid working schedules and 11 paid holidays, in addition to paid parental leave round out the work-life balance benefits.
  


Paid Training and Development: We encourage and support ongoing employee learning and development, consistent with needs of the company, its clients, and markets. Greentree is committed to paying the cost for job-related certifications and/or training programs. In conjunction with management/employee communication and discussions regarding performance and goals, employees are expected to seek out and pursue development opportunities to meet emerging organizational skill requirements in combination with their own personal growth needs. Greentree also makes job-related tuition reimbursement contributions for those in higher-level education programs.
  

&nbsp;",https://www.indeed.com/rc/clk?jk=137de3b6f4adf99a&bb=JoBQYBPrytZmVoqVRQJ7YNNKg2ZI1iPsFQV-6s_N1OjdV-vccUrJ6qre94kkbiqf7Yk9EgtRBYU__4mIh4c6Hbec4w-GEnhic5cXJ2xe3yaDXcX_P5_da4xVVZN743Sx&xkcb=SoBt67M36vQc5AARI70LbzkdCdPP&fccid=196f7a1219e0ab35&vjs=3
Business & Data Analyst,Intellyk INC,"Atlanta, GA 30339","$90,000 a year -  Full-time","Profile insightsFind out how your skills align with the job descriptionSkillsDo you have experience in Text mining?YesNoEducationDo you have a Master's degree?YesNo&nbsp;Job detailsHere’s how the job details align with your profile.Pay$90,000 a yearJob typeFull-time&nbsp;Full job description
Job Description
 Title : Business & Data Analyst Location : Atlanta, GA Duration : Fulltime Client : NCR Corporation Rate : $90k / Annum  Job Description 2-7 years’ experience in business and data analytics  Bachelor’s/Master’s degree in Statistics, Math, Engineering, Economics or related field; Advanced degree preferred  Proficient with SQL (experience in Hive and Teradata utilities preferred)  Proficiency with multiple analytics tools required; Python or R strongly preferred  Hands on experience with BI tools; Tableau, power BI etc.  Excellent written and verbal communication skills  Must be comfortable in ambiguity and constantly evolving environment  Thorough understanding of business metrics for customer experience improvement and product performance metrics.   Preferred Qualifications:  Degree in computer science, information systems, or other technology-related field  Prior work experience with Incident analytics projects  Exposure to advanced analytics concepts such as predictive analytics and/or machine learning  Predictive modeling experience  Understanding of Linux systems and automation of jobs  Exposure to Hadoop, MapReduce, Spark or other Big Data Platforms  Practical knowledge in NLP and text mining 
Regards,
 Sai Kumar
 Senior Recruiter

Work: 732-399-9510 Ext: 104
Fax: 732-399-9513
Adr: #450, 15 Corporate Pl S
Piscataway , NJ , 08857 Additional Information
 All your information will be kept confidential according to EEO guidelines.
&nbsp;",https://www.indeed.com/rc/clk?jk=f05f42dc12e2a560&bb=JoBQYBPrytZmVoqVRQJ7YN6UF65A-Eou258IZpQRh-I7zIRIgPICvK6FGfjBVaN3zL0pjH1FVWpDoEHE4f4DI_TAP97Y4DpeIEffa9KmhREaU-i0mBLFEzyIk4pD2xDt&xkcb=SoDZ67M36vQc5AARI70KbzkdCdPP&fccid=2b7240ede30e9949&vjs=3
Senior Data Analyst - Human Resources Administration,Children's National Hospital,"1 Inventa Place, Silver Spring, MD 20910","$78,707.20 - $131,185.60 a year -  Full-time","Profile insightsFind out how your skills align with the job descriptionSkillsDo you have experience in Software development?YesNoEducationDo you have a Bachelor's degree?YesNo&nbsp;Job detailsHere’s how the job details align with your profile.Pay$78,707.20 - $131,185.60 a yearJob typeFull-timeShift and schedule8 hour shiftDay shift&nbsp;Full job description


Description

 Integrates, conforms, profiles and maps complex data and provides quality assurance oversight (data error detection and correction) on business processes where data is collected, stored, transformed, or used. Examines more complex data to optimize the efficiency and quality of the data being collected, resolves complex data quality problems and collaborates with the business and ETL database developers to improve systems and database design.
  



 Qualifications

 Minimum Education Bachelor's Degree A Bachelor’s degree in a quantitative or business field (e.g., Statistics, Mathematics, Engineering, Computer Science) (Required)  Minimum Work Experience 6 years Requires deep functional knowledge with 4 – 6 years of related experience. Or equivalent experience acquired through accomplishments of applicable knowledge, duties, scope and skill reflective of the level of this position. (Required)  Required Skills/Knowledge Experience with Big Data; Data Processing. Experience with Data Manipulation; Data Mining Experience with C# (Programing Language); Java (Programing Language); Programing Concepts; Programing Tools; Python (Programing Language); SQL (Programing Language) Experience with Agile Software Development Optional: Experience in the healthcare field Experience with healthcare data policies Microsoft certifications in Azure Experience with Microsoft Fabric  Functional Accountabilities Core areas of responsibility that fall under this role include:

Interprets and analyzes complex data from multiple sources, including patient, provider, encounters data, etc. Proactively identifies and assesses the business impact of trends.


Develops, executes, maintains, and troubleshoots of complex scripts and reports developed using SQL, Microsoft Excel, or other analytics tools.


Identifies and performs root-cause analysis of data irregularities and presents findings and proposed solutions to leadership and/or customers.


Manages multiple complex and variable tasks and data review processes with no supervision within targeted timelines and provides leadership in a demanding, quick changing environment.


Delivers business solution architecture and implementation validation.


Engages in data profiling and source to target mapping.


Works on complex data integration from disparate sources.


Applies senior level expertise in quantitative analysis, data mining, and the presentation of data to see beyond the numbers and understand how customers interact with analytic products.


Supports multiple functions and levels of the organization and effectively both verbally and visually, communicates findings and insights to non-technical business partners.


Engages with customers and business partners to gather requirements and validate results.


Presents data-driven insights and recommendations to both internal and external stakeholders, soliciting and incorporating feedback when required.


Performs other duties as assigned.


Complies with all policies and standards.
To be successful at this role you will need:

Seeks to acquire knowledge in area of specialty.


Ability to identify basic problems and procedural irregularities, collect data, establish facts, and draw valid conclusions.


Ability to work independently.


Demonstrated analytical skills.


Demonstrated project management skills.


Demonstrates a high level of accuracy, even under pressure.


Demonstrates excellent judgment and decision-making skills.


Great verbal and written communication skills, communicate complex findings in a clear and understandable manner


Great facilitation ability to host sessions and elicit ideas from others, understanding their issues and encourage group participation


Attention to detail.


Communicate complex findings in a clear and understandable manner


Collaborate effectively with cross-functional teams


Adapt to changing priorities and thrive in a dynamic environmen
 Organizational Accountabilities Organizational Accountabilities (Staff) Organizational Commitment/Identification 

Anticipate and responds to customer needs; follows up until needs are met
 Teamwork/Communication 
  
Demonstrate collaborative and respectful behavior


Partner with all team members to achieve goals


Receptive to others’ ideas and opinions
 Performance Improvement/Problem-solving 
  
Contribute to a positive work environment


Demonstrate flexibility and willingness to change


Identify opportunities to improve clinical and administrative processes


Make appropriate decisions, using sound judgment
 Cost Management/Financial Responsibility 
  
Use resources efficiently


Search for less costly ways of doing things
 Safety 
  
Speak up when team members appear to exhibit unsafe behavior or performance


Continuously validate and verify information needed for decision making or documentation


Stop in the face of uncertainty and takes time to resolve the situation


Demonstrate accurate, clear and timely verbal and written communication


Actively promote safety for patients, families, visitors and co-workers


Attend carefully to important details - practicing Stop, Think, Act and Review in order to self-check behavior and performance





 Primary Location: Maryland-Silver Spring
 

 Work Locations: Inventa Towers 1 Inventa Place Silver Spring 20910
 

 Job: Information Technology
 

 Organization: People
 

 Position Status: R (Regular) - FT - Full-Time
 

 Shift: Day
 

 Work Schedule: 8 - 4:30
 

 Job Posting: Oct 15, 2024, 3:56:48 PM
 

 Full-Time Salary Range: 78707.2 - 131185.6
 
&nbsp;",https://www.indeed.com/rc/clk?jk=340cd1e7cbe59e89&bb=JoBQYBPrytZmVoqVRQJ7YF7BoN3UKNoteaqzYyui1ULjhdIrfjjr8XMchESvIhA0hVzG5DovwtP7lN9g9JbX5q3L8K-pmY-PiNqlUXEu75CAiPTn6M6s6A%3D%3D&xkcb=SoBE67M36vQc5AARI70JbzkdCdPP&fccid=462240b6ade3ccad&vjs=3
Data Analyst,Evoke Research And Cons,"45 L Street NE, Washington, DC 20002","$100,000 - $120,000 a year","Profile insightsFind out how your skills align with the job descriptionCertificationsDo you have a valid AWS Certification certification?YesNoSkillsDo you have experience in Sybase?YesNoEducationDo you have a Bachelor's degree?YesNo&nbsp;Job detailsHere’s how the job details align with your profile.Pay$100,000 - $120,000 a year&nbsp;Location45 L Street NE, Washington, DC 20002&nbsp;BenefitsPulled from the full job description401(k) matchingBereavement leaveDental insuranceDisability insuranceFlexible spending accountHealth insuranceHealth savings accountShow morechevron down&nbsp;Full job description

  Evoke Consulting is a Federal Management Consulting firm specializing in strategic business and technology services areas across the federal market. We provide solutions to agencies and entities including Veterans Affairs, Department of Energy, Department of Agriculture, Department of Defense, and more. We defy the standard employee experience in government contracting with a commitment to providing a wide range of opportunities for our employees to grow professionally and socially by investing more than our competition in training our team and rewarding high performance. Evokers are hard-working, team-oriented, and come from diverse backgrounds and experience levels. We value our employees’ ideas and act on suggestions for change and development as a firm.
 


 Evoke is seeking a Data Analyst to join our team!
 


 Responsibilities:


Analyze and interpret complex data sets from various sources (SQL Server, PostgreSQL, Oracle, Sybase, AWS) to identify trends, patterns, and insights.
Develop and maintain reports and dashboards using PowerBI to provide data-driven insights for business decisions.
Collaborate with the database team to design, implement, and optimize ETL processes for data integration and transformation.
Ensure data accuracy and consistency across multiple databases and data pipelines.
Work closely with stakeholders to gather data requirements and deliver data analysis to support operational and strategic initiatives.
Create and maintain documentation for database structures, data processes, and reporting workflows.
Participate in database performance tuning and optimization efforts in collaboration with database administrators and engineers.
Conduct data quality audits and provide recommendations for improvements in data management processes.






Professional Experience and Skills:


Advanced experience in creating interactive dashboards and visual report with PowerBI and more.
Proficiency with ETL processes and tools for extracting, transforming, and loading data.
Strong experience working with databases such as SQL Server, PostgreSQL, Oracle, Sybase, and cloud-based solutions (e.g., AWS RDS).
Advanced SQL skills, including writing complex queries, optimizing database performance, and troubleshooting data issues.
Experience in building and maintaining data warehouses and ensuring data integrity across various systems.
Ability to interpret and communicate complex data findings to non-technical stakeholders.
Strong troubleshooting skills, with a proactive approach to identifying and resolving data issues.
Experience working in cross-functional teams, particularly with database administrators and engineers.
Meticulous in ensuring the accuracy and completeness of data analysis and reports.






Education and Years of Experience:


Bachelor’s degree in Computer Science, Information Systems, Data Analytics, or a related field.
6+ years of professional experience in data analysis, reporting, or a similar role.
Experience working in environments with complex data systems, such as SQL Server, PostgreSQL, Oracle, and cloud infrastructure like AWS, is highly preferred.
Certifications in PowerBI, AWS, or SQL Database Management.
Experience with big data tools and frameworks (e.g., Hadoop, Spark) is a plus.






Security Clearance


Applicants selected must be eligible to work in the United States, be subject to a government security investigation, and meet eligibility requirements for access to protected information.


 


Work Location


Washington, DC (100% on-site)


 


Benefits Offered:


This position is paid a base salary based on job family, experience and skill level.
Health benefits include medical, prescription, dental, and vision plans.
Company paid Life Insurance coverage, Short-term and Long-term Disability coverage.
Health Savings Account or Flexible spending accounts.
401(k) with discretionary company match.
Paid time off (PTO) program and eleven (11) paid holidays.
Additional time off benefits include parental leave, bereavement leave, volunteer hours.
And more







  Evoke is an equal opportunity employer and all qualified applicants will receive consideration for employment without regard to race, color, sex, citizenship, national origin, ancestry sexual oriented, gender identity, age, religion, creed, physical or mental disability, marital status, veteran status, political affiliation, or any additional factors protected by local, state, or federal law.
 
&nbsp;",https://www.indeed.com/rc/clk?jk=9de248c7430751d8&bb=JoBQYBPrytZmVoqVRQJ7YEIBMiUSK1E3BO58Bak9DzX8H86FqG6e1Wc-p6Ta_CRY_w0NOfmMLq3dbJq7LDPww7yY3mgaNis_bekeFwaMVVqHzHT3-DAaxzQxaW5rFwQV&xkcb=SoDw67M36vQc5AARI70IbzkdCdPP&fccid=4aa9366c14f6cdf4&vjs=3
