Job Title,Company,Location,Salary,Description,Link
Data Analyst,Booz Allen,"Eglin AFB, FL","$75,600 - $172,000 a year -  Full-time","Profile insightsFind out how your skills align with the job descriptionLicensesDo you have a valid Top Secret Clearance license?YesNoSkillsDo you have experience in Tableau?YesNoEducationDo you have a Bachelor's degree?YesNo&nbsp;Job detailsHere’s how the job details align with your profile.Pay$75,600 - $172,000 a yearJob typeFull-time&nbsp;BenefitsPulled from the full job descriptionFlexible spending accountHealth insuranceRetirement planTuition reimbursement&nbsp;Full job description
 Data Analyst
  The Opportunity: As a data analyst, you love diving into data and turning it into meaningful insights. With the abundance of structured and unstructured data, you understand the importance of transforming complex data sets into useful information to solve challenges. As a data analyst at Booz Allen, you can use your skills and experience to support a mission and use data for good.

As a client-facing data analyst, you’ll work closely with your clients to understand their questions and needs and then dig into their data-rich environments to find the pieces of their information puzzle. Not only will you provide a deep understanding of their data, but you’ll also advise your client on what the information means and how it can be used to make an impact.

 How You’ll Contribute: As a data analyst on our team, you’ll:

Use your data analytics expertise to support client and stakeholder relationships.
Research, develop, and test data methodologies, and generate cross-functional solutions through analysis of large data sets.
Contribute to impactful work and guide decision-making across multiple organizations.
Apply consulting skills and data analytics expertise by simplifying technical requirements and trends, based on audience.
Present data findings and recommendations to clients and stakeholders using your knowledge of databases, scripting languages such as SQL, Python, and R, and Microsoft Office Suite, including Power BI.
Establish quantitative and qualitative metrics and key performance indicators to drive technical outcomes.
Apply data visualization through different formats, such as dashboards, graphs, tables, and PowerPoint slides.
Grow your communication and technical skills by merging consulting and big data to create data-centric solutions.


Work with us to drive large-scale business and process decisions through data insights.

Join us. The world can’t wait.

 You Have:

5+ years of experience with data visualization techniques and tools, including Tableau or Power BI
4+ years of experience working with Python and SQL
Knowledge of building data pipelines and ETL tools
Knowledge of the DoD Acquisitions Lifecycle and Program Management, including earned value management, cost-benefit, what-if, project performance, and business project analysis
Knowledge of statistical analysis techniques and how to apply them to large datasets
Ability to develop and maintain interactive dashboards and visualizations in Power BI to communicate data insights to business stakeholders
Ability to work independently and collaboratively in a team environment
Secret clearance
Bachelor's degree


 Nice If You Have:

Ability to be self-motivated and detail-oriented
Possession of strong analytical, problem-solving, and critical thinking skills
Possession of strong written and verbal communication skills, including to present complex information in a clear and concise manner, and translate data into actionable insights
Top Secret clearance

 Clearance: Applicants selected will be subject to a security investigation and may need to meet eligibility requirements for access to classified information; Secret clearance is required.

 Compensation
At Booz Allen, we celebrate your contributions, provide you with opportunities and choices, and support your total well-being. Our offerings include health, life, disability, financial, and retirement benefits, as well as paid leave, professional development, tuition assistance, work-life programs, and dependent care. Our recognition awards program acknowledges employees for exceptional performance and superior demonstration of our values. Full-time and part-time employees working at least 20 hours a week on a regular basis are eligible to participate in Booz Allen’s benefit programs. Individuals that do not meet the threshold are only eligible for select offerings, not inclusive of health benefits. We encourage you to learn more about our total benefits by visiting the Resource page on our Careers site and reviewing Our Employee Benefits page.
 Salary at Booz Allen is determined by various factors, including but not limited to location, the individual’s particular combination of education, knowledge, skills, competencies, and experience, as well as contract-specific affordability and organizational requirements. The projected compensation range for this position is $75,600.00 to $172,000.00 (annualized USD). The estimate displayed represents the typical salary range for this position and is just one component of Booz Allen’s total compensation package for employees. This posting will close within 90 days from the Posting Date.
 
 Identity Statement
As part of the application process, you are expected to be on camera during interviews and assessments. We reserve the right to take your picture to verify your identity and prevent fraud.

 Work Model Our people-first culture prioritizes the benefits of flexibility and collaboration, whether that happens in person or remotely.

If this position is listed as remote or hybrid, you’ll periodically work from a Booz Allen or client site facility.
If this position is listed as onsite, you’ll work with colleagues and clients in person, as needed for the specific role.


 EEO Commitment
We’re an equal employment opportunity/affirmative action employer that empowers our people to fearlessly drive change – no matter their race, color, ethnicity, religion, sex (including pregnancy, childbirth, lactation, or related medical conditions), national origin, ancestry, age, marital status, sexual orientation, gender identity and expression, disability, veteran status, military or uniformed service member status, genetic information, or any other status protected by applicable federal, state, local, or international law.

&nbsp;",https://www.indeed.com/rc/clk?jk=f35c28faef4c86cc&bb=aPp8rrU1zeMLfD4Tc-cakk48r0NpY9ZUEOwr7625RyI5VCiM8TUAYoflFIGxjFNip9SDE1pmNsLa4iMbG-p0Efw5xDF1o7x0m1R73kPrwEkYaIoO1Re8acoD47yvAQPC&xkcb=SoDs67M36vd1vWyEBx0LbzkdCdPP&fccid=4e041af1d0af1bc8&vjs=3
Data Analyst,Snappyhires,"Snappyhires in Jackson, MS 39202",$65 - $70 an hour -  Contract,"Profile insightsFind out how your skills align with the job descriptionSkillsDo you have experience in SharePoint?YesNoEducationDo you have a Master's degree?YesNo&nbsp;Job detailsHere’s how the job details align with your profile.Pay$65 - $70 an hourJob typeContract&nbsp;Full job descriptionProject Description:
Job Description: 
Processing Data and Public Records Requests:
Receiving Requests:
· Receive and log incoming data and public records requests from non-media parties.
· Ensure requests are properly documented and tracked for timely processing.
· Legal Review and Redaction:
· Assist in legal review of requested documents to determine necessary redactions to protect sensitive information before release as public records.
· Ensure compliance with legal requirements and agency policies regarding public records disclosures.
· Data Retrieval and Compilation:
· Coordinate with relevant departments or personnel to retrieve requested data and compile necessary documents for disclosure.
· Ensure completeness and accuracy of information provided in response to requests.
Response Preparation:
· Prepare responses to data and public records requests in accordance with established timelines and legal requirements.
· Draft correspondence and documentation ensuring clarity and completeness in responses.
.
Communication and Follow-up:
· Communicate with requesters to clarify requests, provide updates on processing status, and coordinate delivery of requested information.
· Maintain records of communications and actions taken related to each request.
· Microsoft Purview Oversight:
· Serve as the primary compliance contact for the implementation and oversight of the agency’s Microsoft Purview application. Microsoft Purview is a data governance tool that helps organizations map, manage, and govern their data across various sources.
· Data types to be brought under Purview oversight and management include: data/files within enterprise Microsoft 365 applications (Outlook, SharePoint, OneDrive, Teams, Exchange, etc.) and other on-premises, multicloud, and software as a service (SaaS) data. Data cover a range of public health subject matters such as: disease surveillance and reporting, environmental health (water supply, wastewater, food protection, etc.), vital records and statistics, and professional and healthcare facility licensure, just to name a few.
Key Purview duties and responsibilities include:
o Data Cataloging: Organizing and indexing data assets for easy discovery and understanding.
o Data Classification: Applying labels and tags to data based on sensitivity and regulatory requirements.
o Data Lineage: Tracking the origins, movements, and transformations of data throughout its lifecycle.
o Data Insights: Providing analytical capabilities to derive insights and enhance decision-making.
o Data Compliance: Ensuring data usage complies with regulatory standards and internal policies.
Policy Development and Compliance:
· Collaborate with the Director of Data Governance to develop and revise policies, Standard Operating Procedures (SOPs), and guidelines related to data management and governance.
· Ensure that policies align with federal and state data laws, regulations, and organizational objectives.
· Monitor and interpret federal and state data protection laws, regulations (such as HIPAA), and industry standards.
· Develop training materials and conduct sessions to educate agency staff on data governance policies, procedures, and regulatory requirements.
· Foster a culture of compliance and data stewardship across the organization.
Data Management and Systems Development:
· Collaborate with the Director of Data Governance in developing and designing data management applications and systems. Aim to improve the agency’s data capabilities for public health purposes.
· Provide general support to the agency in its projects funded under the CDC Public Health Infrastructure Grant (PHIG) specifically under Strategy A3: Data Modernization. Projects include:
· Cataloging and organization of agency data resources with the ultimate goal of creating a public facing agency-wide data catalog,
· Assisting with the selection and implementation of an updated process for managing external requests for data and public records
· Supporting the creation and implementation of project timelines
· Consistent and effective communication with agency staff supporting the projects, and maintaining focus on project goals and meeting deadlines
Assist with the collecting, organizing and leveraging large amounts of data across multiple subject matters to enable more accessible utilization and analysis of the data using data lakes, warehouses, lakehouses, catalogs, etc.
Job Type: Contract
Pay: $65.00 - $70.00 per hour
Ability to Commute:

Jackson, MS 39202 (Preferred)

Ability to Relocate:

Jackson, MS 39202: Relocate before starting work (Preferred)

Work Location: In person&nbsp;",https://www.indeed.com/rc/clk?jk=fce63a0b5d92c058&bb=aPp8rrU1zeMLfD4Tc-cakvvVb7MHoL8wuLmpvy9U48Owp442nzA8IrWpAEcDsijor1yX3htVwk-PTTRBsN62qzMun1SgpLJecKqFlSUIhyyoX4UsRuws3ohDct31X3-i&xkcb=SoBY67M36vd1vWyEBx0KbzkdCdPP&fccid=8a43b98ada17ca49&cmp=Snappyhires&ti=Data+Analyst&vjs=3
Data Analyst,MindPetal Software Solutions,"200 Constitution Avenue NW, Washington, DC 20210","$93,376.88 - $112,453.88 a year -  Full-time","Profile insightsFind out how your skills align with the job descriptionCertificationsDo you have a valid AWS Certified Cloud Practitioner – Foundational certification?YesNoSkillsDo you have experience in Software development?YesNoEducationDo you have a Bachelor's degree?YesNo&nbsp;Job detailsHere’s how the job details align with your profile.Pay$93,376.88 - $112,453.88 a yearJob typeFull-timeShift and scheduleMonday to Friday&nbsp;Location200 Constitution Avenue NW, Washington, DC 20210&nbsp;Full job descriptionAs a Data and Systems Analyst, you will play a key role in ensuring the quality and reliability of our software products and work directly with customers to identify functional and technical requirements. The candidate should have a strong background and work experience in data migration projects, experience in insurance claims and processing, have excellent analytical and problem-solving skills, and be able to communicate technical concepts to non-technical project team members. Experience working in software modernization projects is a plus. The candidate will work closely with cross-functional teams, including senior developers, project managers, product managers, and customers, to use software development best practices, understand requirements and develop technical and functional requirements to modernize existing applications to a new technology platform.
Roles & Responsibilities:

Analyze and document the technical requirements for data migration. Analyze current database schema, data structures, data models and the target system’s data needs. Document the technical requirements to enable the technical team to migrate the current data to a new application hosted in AWS
Analyze business workflows, analyze data and data flows and document the data requirements of the target system. Perform process mapping from the current system (source) to the proposed target system.
Analyze the supporting services and data processing services used in the business processes and the current system, such as document management, email notifications, integrations with other systems. Document the functional and technical requirements for the backend support services required by the system.
Work with Agile project teams to identify and document the business requirements as user stories (in Jira) and conduct testing, such as functional and regression testing.
Interpret business requirements for simplified analysis and decision-making.
Develop test plans, test cases, and testing procedures to conduct testing throughout the entire software development lifecycle.
Participate in the Agile/Scrum development process.
Collaborate with architects to develop and document architecture diagrams,
Develop and update system documentation.

Qualifications:

A bachelor’s degree in computer science, mathematics, or other related technical fields is required.
4+ years of experience in software development projects with data migration activities and/or system migration to the Cloud.
Expertise in big data, cloud and other new technologies
Experience using RDBMS such as Oracle 12c, MS SQL Server, DB2 etc
Understanding of AWS and other cloud technologies.
Expertise in Agile methodologies for effective application development.
Ability to communicate clearly, both verbal and written.
Ability to work effectively in a fast-paced, agile environment.
Experience in QA related to data migration and/or system migration to the cloud is a plus.
AWS Cloud practitioner certification is a plus
Insurance and claims experience is a plus.

Job Type: Full-time
Pay: $93,376.88 - $112,453.88 per year
Schedule:

Monday to Friday

Work Location: Hybrid remote in Washington, DC 20210&nbsp;",https://www.indeed.com/rc/clk?jk=7f13d27f85edd148&bb=aPp8rrU1zeMLfD4Tc-caklHTVX8p0UOmgJWRt-_Cp4_C3KPa-W5q_QK8ER0gjVizoyXKcWZjNsRd3ObMnVMpIkU2vIn7E3rsQjB_mivVT1rVmgX3zGh0beBWLEP6rgF2&xkcb=SoDF67M36vd1vWyEBx0JbzkdCdPP&fccid=22e579717b870249&cmp=MindPetal-Software-Solutions&ti=Data+Analyst&vjs=3
"Sr. Analyst, Data Analytics & Business Intelligence",Comcast Corporation,"Philadelphia, PA 19103","$62,698.24 - $146,949.00 a year -  Full-time","Profile insightsFind out how your skills align with the job descriptionSkillsDo you have experience in Windows?YesNoEducationDo you have a Bachelor's degree?YesNo&nbsp;Job detailsHere’s how the job details align with your profile.Pay$62,698.24 - $146,949.00 a yearJob typeFull-timeShift and scheduleWeekends as needed&nbsp;LocationPhiladelphia, PA 19103&nbsp;Full job description
 Comcast brings together the best in media and technology. We drive innovation to create the world's best entertainment and online experiences. As a Fortune 50 leader, we set the pace in a variety of innovative and fascinating businesses and create career opportunities across a wide range of locations and disciplines. We are at the forefront of change and move at an amazing pace, thanks to our remarkable people, who bring cutting-edge products and services to life for millions of customers every day. If you share in our passion for teamwork, our vision to revolutionize industries and our goal to lead the future in media and technology, we want you to fast-forward your career at Comcast.
  Job Summary Responsible for working cross-functionally to collect data and develop models to determine trends utilizing a variety of data sources. Retrieves, analyzes and summarizes business, operations, employee, customer and/or economic data to develop business intelligence, optimize effectiveness, predict business outcomes and decision-making purposes. Involved with numerous key business decisions by conducting the analyses that inform our business strategy. This may include: impact measurement of new products or features via normalization techniques, optimization of business processes through robust A/B testing, clustering or segmentation of customers to identify opportunities of differentiated treatment, deep dive analyses to understand drivers of key business trends, identification of customer sentiment drivers through natural language processing (NLP) of verbatim responses to Net Promotor System (NPS) surveys and development of frameworks to drive upsell strategy for existing customers by balancing business priorities with customer activity. Has in-depth experience, knowledge and skills in own discipline. Usually determines own work priorities. Acts as resource for colleagues with less experience.
  Job Description
 Core Responsibilities:

Works with business leaders and stakeholders to understand data and analysis needs and develop technical requirements.
Determines relevancy of data and identifies alternative data sources as needed to ensure analytics requested by business stakeholders can be completed.
Analyzes large, complex data to determine actionable business insights using self-service analytics and reporting tools.
Queries disparate big data platforms such as Teradata, Snowflake, SQL Server, Hadoop, and AWS.
Combines data as needed from disparate data sources to complete analysis.
Identifies key business drivers and insights by conducting exploratory data analysis and hypothesis testing.
Develops forecasting models to predict sales, demand and other key business metrics.
Analyzes the results of campaigns, offers or initiatives to measure their effectiveness and identifies opportunities for improvement.
Communicates findings clearly and concisely through narrative-driven presentations and effective data visualizations to Company executives and decisionmakers.
Promotes and evangelizes a culture of excellence, data driven discussions, healthy skepticism, intellectual curiosity, knowledge sharing, and teamwork.
Stays current with emerging trends in analytics, statistics, and machine learning and applies them to business challenges.
Consistent exercise of independent judgment and discretion in matters of significance. Regular, consistent and punctual attendance. Must be able to work nights and weekends, variable schedule(s) as necessary.
Other duties and responsibilities as assigned.


 Required:

Advanced SQL skills (Aggregation, Partitioning, Pivoting, ETL, CTE, Data Quality/EDA, etc.)
Experience with Data-Driven decision making, process optimization and operational excellence approaches (BADIR, Lean, Six Sigma (DMAIC))
Big Data Visualization (Tableau, PowerBI, Looker) Experience
Ad Hoc Data Analytics
Experience in communicating complex stories and solutions through data to all levels of employees including executives


 Desired:

Experience within Teradata, Snowflake, Azure Cloud Experience
Python or other programming language experience or familiarity
Statistics experience or background
Ability to map complex business problems to data & AI solutions
Familiarity with customer service interactions and frontline operations
Growth Mindset and open to continuously learning new approaches, competitors and AI capabilities

 Employees at all levels are expected to:

Understand our Operating Principles; make them the guidelines for how you do your job.
Own the customer experience - think and act in ways that put our customers first, give them seamless digital options at every touchpoint, and make them promoters of our products and services.
Know your stuff - be enthusiastic learners, users and advocates of our game-changing technology, products and services, especially our digital tools and experiences.
Win as a team - make big things happen by working together and being open to new ideas.
Be an active part of the Net Promoter System - a way of working that brings more employee and customer feedback into the company - by joining huddles, making call backs and helping us elevate opportunities to do better for our customers.
Drive results and growth.
Respect and promote inclusion & diversity.
Do what's right for each other, our customers, investors and our communities.


 Disclaimer:

This information has been designed to indicate the general nature and level of work performed by employees in this role. It is not designed to contain or be interpreted as a comprehensive inventory of all duties, responsibilities and qualifications.

Comcast is proud to be an equal opportunity workplace. We will consider all qualified applicants for employment without regard to race, color, religion, age, sex, sexual orientation, gender identity, national origin, disability, veteran status, genetic information, or any other basis protected by applicable law. Comcast will consider for employment qualified applicants with criminal histories in a manner consistent with the requirements of applicable law, including the Los Angeles Fair Chance Initiative for Hiring Ordinance and the San Francisco Fair Chance Ordinance.
 Skills:
Advanced SQL; Data Visualization; Extract Transform Load (ETL); Data Storytelling; Data Driven Approach; Tableau Desktop
 Salary:
National Pay Range: $62,698.24 USD-$146,949.00 USD
Comcast intends to offer the selected candidate base pay within this range, dependent on job-related, non-discriminatory factors such as experience. The application window is 30 days from the date job is posted, unless the number of applicants requires it to close sooner or later. The application window is 30 days from the date job is posted, unless the number of applicants requires it to close sooner or later.
  Base pay is one part of the Total Rewards that Comcast provides to compensate and recognize employees for their work. Most sales positions are eligible for a Commission under the terms of an applicable plan, while most non-sales positions are eligible for a Bonus. Additionally, Comcast provides best-in-class Benefits to eligible employees. We believe that benefits should connect you to the support you need when it matters most, and should help you care for those who matter most. That’s why we provide an array of options, expert guidance and always-on tools, that are personalized to meet the needs of your reality – to help support you physically, financially and emotionally through the big milestones and in your everyday life. Please visit the compensation and benefits summary on our careers site for more details.
 Education
Bachelor's Degree
While possessing the stated degree is preferred, Comcast also may consider applicants who hold some combination of coursework and experience, or who have extensive related professional experience.
 Relevant Work Experience
5-7 Years
&nbsp;",https://www.indeed.com/rc/clk?jk=ad7edd0cd0b0aab8&bb=aPp8rrU1zeMLfD4Tc-caks7uCcdbWhO0yQiwFbiXeWPqYfUNc_I1KQWMoAvC3I5XjY7H9dB_YtupEbg5wn6qydiRbGKhMMyXm5Hk4Ut0Trr2PayBwxhuPw%3D%3D&xkcb=SoBx67M36vd1vWyEBx0IbzkdCdPP&fccid=ea25315ee9da22e5&vjs=3
