Job Title,Company,Location,Salary,Description,Link
Business Systems Analyst with PM Experience,Farallon Medical Alliance,California,"$100,000 - $130,000 a year -  Full-time","Profile insightsFind out how your skills align with the job descriptionSkillsDo you have experience in System administration?YesNoEducationDo you have a Bachelor's degree?YesNo&nbsp;Job detailsHere’s how the job details align with your profile.Pay$100,000 - $130,000 a yearJob typeFull-timeShift and scheduleMonday to Friday&nbsp;BenefitsPulled from the full job description401(k)401(k) matchingDental insuranceEmployee assistance programFlexible spending accountHealth insuranceHealth savings accountShow morechevron down&nbsp;Full job descriptionWho We Are:
Farallon Medical Alliance (FMA) is a small, but dynamic management services and medical billing organization providing support to independent medical groups across a variety of specialties. These groups currently contract with hospitals and skilled nursing facilities across the Bay Area. FMA provides critical support needed for running these medical groups, including accounting/payroll, human resources, administrative, clinical front desk, scribe support, and medical billing. Our employees are critical to our success, and we value their contributions. FMA offers a competitive compensation and benefits package to our employees, as well as a unique opportunity to grow and develop your career in an environment that values employee ideas and diversity.
About the Role:
We are seeking a skilled and experienced Business Systems Analyst with strong Project Management capabilities and Systems Administration expertise to join our team. In this role, you will support the ongoing operation and enhancement of our proprietary data lake assist with the migration of legacy systems, and help drive the development of a new, next-generation platform. This position also includes responsibility for system administration tasks such as account provisioning, de-provisioning, and platform maintenance.
Key Responsibilities:

Data Lake Support: Provide system support for our proprietary data lake platform, ensuring stability, performance, and continuous improvements.
New Platform Development: Collaborate with cross-functional teams to help design, develop, and implement a new data platform, ensuring alignment with business needs and technology trends.
Legacy System Migration: Assist in planning and executing the migration of data and processes from legacy platforms to new systems, minimizing downtime and ensuring data integrity.

Project Management:

Lead and manage technology projects related to platform development, upgrades, and migrations.
Develop and maintain project plans, timelines, and status reports.
Coordinate with stakeholders to define project scope, objectives, and deliverables.
Stakeholder Communication: Act as the liaison between leadership, business units, and external vendors, ensuring smooth communication and project execution.
Continuous Improvement: Identify and implement process improvements to optimize the performance of platforms and related business processes.

Systems Administration:

Perform user account provisioning, de-provisioning, and access management across systems. Ensure system security and compliance by managing user roles, permissions, and periodic access reviews.
Provide technical support for platform issues, including troubleshooting and resolving system performance and operational problems.
Assist with system configuration, software updates, and patch management to maintain optimal performance where applicable.

Business Analysis:

Analyze business requirements and translate them into technical specifications for system enhancements.
Work closely with business users to gather and document requirements for both current systems and future platform developments.

Qualifications:

Education: Bachelor’s degree in Computer Science, Information Systems, Business, or related field.

Experience:

3+ years of experience in business systems analysis.
2+ years of project management experience, preferably in technology or platform development.
Experience with data platforms, cloud technologies, and system migrations.
Experience with systems administration tasks, including account provisioning, deprovisioning, and access control.

Technical Skills:

Familiarity with data lake architecture and big data technologies.
Strong understanding of systems integration, software development life cycle (SDLC), and database management.
Proficient in project management tools (e.g., MS Project, Jira, etc.).
Experience with system access management and security best practices.

Soft Skills:

Excellent analytical and problem-solving skills.
Strong communication and interpersonal skills, with the ability to work across teams and functions.
Ability to manage multiple projects and priorities in a fast-paced environment.

Benefits:

Competitive salary and benefits package.
Opportunities for professional growth and development.
Collaborative work environment with a focus on innovation.

Job Type: Full-time
Pay: $100,000.00 - $130,000.00 per year
Benefits:

401(k)
401(k) matching
Dental insurance
Employee assistance program
Flexible spending account
Health insurance
Health savings account
Life insurance
Paid time off
Retirement plan
Vision insurance

Compensation Package:

Bonus opportunities
Yearly pay

Schedule:

Monday to Friday

Location:

California (Preferred)

Work Location: Remote&nbsp;",https://www.indeed.com/rc/clk?jk=42c70dc55ad39ca6&bb=1RGOqixboJgQNQ4uto0OX1y2c3yJliuXHdZDJ-_ilogCeDWT6xRjsgWuCqQj7Ij6LhTb_TzWY8pZVA2aJNNOQhEU0Tovcr8XzSAblVk6AcHmUPoW7ArKcr1Z6f9b2c3v&xkcb=SoCC67M36vRdtqS8S50PbzkdCdPP&fccid=596c02f590620dbe&cmp=Farallon-Medical-Alliance&ti=Business+Systems+Analyst&vjs=3
"Senior Business Analyst - C63369 5.6 Charlotte, NC",CapB InfoteK,"Charlotte, NC",$56 an hour,"Profile insightsFind out how your skills align with the job descriptionSkillsDo you have experience in SQL?YesNoEducationDo you have a Bachelor's degree?YesNo&nbsp;Job detailsHere’s how the job details align with your profile.Pay$56 an hour&nbsp;LocationCharlotte, NC&nbsp;Full job descriptionCandidate should have strong Capital Market (Derivatives and Fixed Income) functional knowledge and SQL writing skills along with BA experience. Be a self-motivated, hands-on Business Data Analyst with experience in creating/refining business and functional requirements, data analysis, and documentation of Capital Markets middleoffice and backoffice systems and processes. The candidate will closely work with the business processes and associated data needs and provide guidance for the technical solution.  Responsibilities: Document business and functional requirements, including data flow, business rules, and use cases/ stories. Must be able to run SQL and perform data analysis on complex use cases for product wise data conformance across various asset classes (including FX/SWAPS Design and review ongoing data model changes based on data requirements for consolidated risk and exposure needs Coordinate with business and Technology SMEs to drive solution development. Develop relationships across the organization to know whose input is needed Assess the impact of changes on existing business and technology processes, as well as other interfacing systems and associated data needs Guide development and QA teams to resolve questions on the requirements and the intentions and business purpose underlying them Analyze data to support or refute assumptions and answer questions for either new requirements or ongoing support purposes Work with geographically dispersed teams (US, India) Mandatory Skills Required 7+ years of experience as a Business Analyst, Data Analyst, or related role 7+ years of experience working in the capital markets domain area or an investment bank Excellent communication and presentation skills: ability to communicate in a clear and concise manner; individually or in front of a group Outstanding relationship management, communication, teamwork, and influence skills Hands-on SQL experience (Intermediate to advance) with strong understanding of a large data warehouse for a large financial services institution Familiar with the Capital Markets middle office and back office functions, processes and technology with deep understanding of various asset classes, products and end to end trade lifecycle Prior experience in enterprise data management group within Capital Markets domain and understanding of data acquisition or enterprise warehouse Project experience in Calypso technology Strong relational database and data modeling expertise Strong understanding of Business Analysis concepts, Agile methodologies and Operating models with ability to gather requirements, document BRD/FRD, and drive the BA workflow Exposure to JIRA or other ALM tools to create a productive, high quality development environment Expertise in using MS Office Tool Suite (including Outlook, Word, PowerPoint & Excel) Working experience with centralized data warehouse to support risk, exposure, surveillance and compliance business functions of an investment bank or a large financial services institution  Good to Have Skills: Experience working on BASEL III or CCAR program Project experience in Big Data technologies&nbsp;",https://www.indeed.com/rc/clk?jk=ff0918ee4bd8e6f6&bb=1RGOqixboJgQNQ4uto0OX-uQm4hNsQhFCVf5r48HPgAmQe_01dkAw8jklnsRqWMlD6LTHgP3wn4nnO4bV-aeN1vD-7GN9F_UTUGztqkhIlrNK0a8TvuWBqlYeQdzVobH&xkcb=SoA267M36vRdtqS8S50ObzkdCdPP&fccid=5033463af3c58699&vjs=3
Manager of SHWB Data Informatics/Systems Analyst,Johns Hopkins University,"3400 N Charles St, Mason Hall, Baltimore, MD 21218","$73,300 - $128,300 a year -  Full-time","Profile insightsFind out how your skills align with the job descriptionSkillsDo you have experience in Statistics?YesNoEducationDo you have a Master's degree?YesNo&nbsp;Job detailsHere’s how the job details align with your profile.Pay$73,300 - $128,300 a yearJob typeFull-timeShift and scheduleMonday to Friday&nbsp;Location3400 N Charles St, Mason Hall, Baltimore, MD 21218&nbsp;Full job description
Reporting to the Director of Student Health & Well-Being Systems, Data and Reporting Strategy. We are seeking a Manager of SHWB Data Informatics/Systems Analyst.

 The Johns Hopkins University Student Health & Well-Being (SHWB) Practice Group provides holistic services that are accessible, inclusive, equitable, and high quality to foster a proactive, supportive culture and enhance students' and trainees' experience at Johns Hopkins University while preparing them to lead fulfilling personal and professional lives. Our integrated service delivery model provides dynamic health promotion and well-being support and programming, student disability services including guidance and resources, and in-person primary and mental health care options at our clinics as well as remote support through phone and online resources to JHU students and learners across all nine schools within the University.

 We define well-being as an optimal and dynamic state that allows people and communities to achieve their full potential. By focusing on the whole - the whole person, the entire educational experience, the whole institution, the whole community - well-being becomes a multifaceted goal and a shared responsibility for the entire institution.
This position is a full-time position in the East Baltimore/ Homewood/ District of Columbia office with a requirement for availability to travel to other Baltimore area campuses and the DC campus for program delivery and in-person meetings when necessary. This position's central office will be at the Homewood campus and has a hybrid option (at least three days in-person, which may vary during the year and cycle of work).

 Specific Duties & Responsibilities

 Optimization & Reporting - 40%

Mine and analyze data from multiple sources and systems to provide insights for optimizing and improving SHWB services, programs, and operations.
Generate reports and data visualizations that offer insights to help senior staff and unit managers make decisions, budget, and forecast trends.
Create and maintain functional internal and external facing dashboards for monitoring key performance indicators, outcomes, and other metrics.
Construct and maintain a dictionary/ library and a system of organizing reports to improve efficiency and eliminate duplications.
Review reports generated to ensure accuracy. Serve as a liaison between technical staff, administrators, clinicians/ providers/ coordinators.
Mine and analyze data from multiple sources and systems to provide insights for optimizing and improving SHWB services, programs, and operations.
Generate reports and data visualizations that offer insights to help senior staff and unit managers make decisions, budget, and forecast trends.
Create and maintain functional internal and external facing dashboards for monitoring key performance indicators, outcomes, and other metrics.
Construct and maintain a dictionary/ library and a system of organizing reports to improve efficiency and eliminate duplications.
Review reports generated to ensure accuracy.
Serve as a liaison between technical staff, administrators, clinicians/ providers/ coordinators.


 Data Analysis - 30%

Supervise program evaluation and research of SHWB initiatives that cut across departments within the SHWB division.
Construct studies from beginning to end, including a review of relevant literature.
Formulate relevant research and program evaluation questions.
Collect and monitor data; conduct appropriate quantitative and qualitative analysis.
Interpret results; create evaluation reports and presentations for the appropriate audience.
Serve as liaison and resource for department-specific evaluation and research.


 Technology - 30%


Information: Good working knowledge of Electronic Medical Records, healthcare IT systems, and related workflows.
Deep understanding of healthcare integration and data exchange between EMR and other applications.
Coordinate support for SHWB systems, including liaising with University Student Services (USS) IT Services and Central IT and EPIC Team.
Collaborate closely with the EPIC Team to facilitate interfaces and updates to systems adapted to SHWB staff workflows, optimizing productivity and reducing errors.
Become an expert on the EMR (Point and Click), the SDS Accommodations Information Management System (AIM), and other SHWB systems training and helping users maximize their functions.
Monitor compliance on new joiners and ongoing training across departments and centers.
Deep understanding of data privacy regulations and practices, including HIPAA regulations.


 Special Knowledge, Skills, & Abilities

Demonstrated commitment to leadership in Diversity, Equity, and Inclusion (DEI).
Analytical and critical thinking skills, including generating organized reporting tools and statistics.
Knowledge of data mining/ management and data collection instruction processes.
Expert with big data technologies and cloud platforms, preferably in health-related fields.
Excellent verbal and written communication skills, specifically in presenting complex data to various audiences.
Ability to work independently, assess situations, and respond appropriately and with team collaboration.
Requires a willingness to accept change and demonstrate flexibility.
  Minimum Qualifications

Bachelor's Degree.
Seven years of experience.
Additional education (Master's level) may substitute for required experience to the extent permitted by the JHU equivalency formula.
  Preferred Qualifications

Master's Degree preferred in information technology, informatics, data and computer science, public health, health sciences, or closely related fields.
Three to five years of experience in reporting, data management and analysis and must include data warehouse design and knowledge in project and information management within a health system preferred.
Experience working in a highly complex, decentralized, diverse environment.



Classified Title: Data Analytics Manager Job Posting Title (Working Title): Manager of SHWB Data Informatics/Systems Analyst Role/Level/Range: ATP/04/PE Starting Salary Range: $73,300 - $128,300 Annually ($100,000 targeted; Commensurate with experience) Employee group: Full Time Schedule: MONDAY-FRIDAY, 8:30am-5:00pm Exempt Status: Exempt Location: Hybrid/Homewood Campus Department name: Student Health and Well-Being Personnel area: University Student Services

&nbsp;",https://www.indeed.com/rc/clk?jk=474dcc3ea27d2b32&bb=1RGOqixboJgQNQ4uto0OX1GpIDtJgIPQUBPNPUR7VH7ttzfF9faUlsbtNDOmEzt0IA-a-iTukZSZ9ntFfZ9VVKUiGHaspeIS5RSkw9289MorHuXVI-Jbbw%3D%3D&xkcb=SoCr67M36vRdtqS8S50NbzkdCdPP&fccid=f34acbd24dd4fcb0&vjs=3
Associate Data Analyst,DEPARTMENT OF INVESTIGATION,"180 Maiden Lane, Manhattan, NY 10005","$85,000 - $96,000 a year -  Full-time","Profile insightsFind out how your skills align with the job descriptionSkillsDo you have experience in Time management?YesNoEducationDo you have a Master's degree?YesNo&nbsp;Job detailsHere’s how the job details align with your profile.Pay$85,000 - $96,000 a yearJob typeFull-time&nbsp;BenefitsPulled from the full job descriptionLoan forgiveness&nbsp;Full job description




Associate Data Analyst



 










Associate Data Analyst 




DEPARTMENT OF INVESTIGATION 






Full-Time 






Location 


MANHATTAN






No Exam Required 







Department


OIG NYPD








Salary Range:
 

$85,000.00 – $96,000.00
 









Job Description




      The New York City Department of Investigation (DOI) is one of the oldest law enforcement agencies in the country with a mission of combating municipal corruption. It serves the people of New York City by acting as an independent and nonpartisan watchdog for New York City government, City agencies, and City employees, vendors with City contracts, individuals and entities that receive City funds.  DOI's Office of the Inspector General for the New York City Police Department (OIG-NYPD) is authorized to investigate, review, study, audit and make recommendations relating to the operations, policies, programs and practices of New York Police Department (NYPD), with the goal of enhancing effectiveness, increasing public safety, protecting civil liberties and civil rights, and increasing the public's confidence in the police force.  DOI's OIG-NYPD is seeking an Associate Data Analyst who will supervise at least one data analyst while supporting active investigations into the operations, policies, practices and programs of the NYPD.   In this role the Associate Data Analyst will:  

Develop and enhance data practices for generating investigative leads through patterns and trends related to the operations, policies, programs, and practices of the NYPD.
Develop and implement data harvesting, data analytics and other strategies that optimize statistical efficiency and quality, and oversee the work of those conducting the analysis.
Acquire data from primary or secondary sources and maintain databases/data systems.
Develop quality assurance systems for data and manage processes to ensure data quality.
Develop strategies to utilize machine learning to enhance the work of OIG-NYPD.
Perform complex statistical analyses of sample and aggregate data sets to identify patterns, trends, and systemic issues.
Work as an advisor on systemic and individual investigations into the practices of NYPD.
Develop new methods for collecting data, new database applications for archiving and retrieval of statistics, and maintenance of records.
Develop error checking programs to determine if the data collected is reliable, timely, and valid.
Create and maintain databases, while preparing data sets for statistical analysis, including data cleaning and formatting.
Communicate clearly and effectively through compelling reports, presentations, and visualizations.
Conduct data related interviews connected to systemic and individual investigations.
Conduct policy assessments, memos and external correspondence.
Create data graphics.
Determine the preservation method of datasets and files related to the analytical work conducted for systemic and individual investigations.
 If selected, the candidate will be fingerprinted and undergo a background investigation. In addition, for positions that have a law enforcement and/or investigative function, the candidate's consumer credit history will be reviewed during the background investigation, and as otherwise permitted by NYC Administrative Code 8-107(24)(b)(2)(A).
     
 Minimum Qualifications
 1. A baccalaureate degree from an accredited college or university and four years of data processing experience; two years of which must have been in internal control/quality assurance or computer science.  2. Education and experience equivalent to ""1"" above.
 Preferred Skills - Master’s degree or advanced coursework in computer science, information systems or related field. - Strong analytical, written and verbal communication skills. - Experience using statistical modeling techniques to analyze policy research questions related to social policy, policing, and government. - Advanced knowledge of Excel and extensive experience with and proficiency in statistical computing software or data analytic environments (e.g., SAS, SPSS, Stata, SQL/NoSQL databases including ETL, Python, R, Tableau), including the ability to analyze large and complex datasets for patterns and trends, and build statistical models. Preference will be given to those with additional experience with geographical mapping software like ArcGIS. - Knowledge of one or more data visualizations tools such as i2 Analyst Notebook, Cognos, Tableau, R libraries, D3.js and SAS. - Knowledge and experience with statistical and datamining concepts such as significance testing, regression, decision trees, clustering, forecasting, sampling, and scenario analysis. - Be familiar with Big Data platforms and Cloud tools data mining, data cleaning, data warehousing and structures and one or more RDBMS systems. - High proficiency in sampling techniques. - Excellent analytical, verbal, and written communication skills and ability to translate complex, technical information for colleagues and consumers who have nontechnical backgrounds. - Knowledge of, and demonstrated interest in, criminal justice, law enforcement, police accountability, and/or civil rights issues - Excellent organization and time management skills. - Superb judgment. - Ability to exercise discretion on sensitive or confidential matters. - Familiarity with NYPD policies, procedures, operations and regulations and New York City government a plus. - Thorough when performing work and conscientious about attending to detail.
 Public Service Loan Forgiveness As a prospective employee of the City of New York, you may be eligible for federal loan forgiveness programs and state repayment assistance programs. For more information, please visit the U.S. Department of Education’s website at https://studentaid.gov/pslf/.
 Residency Requirement New York City residency is generally required within 90 days of appointment. However, City Employees in certain titles who have worked for the City for 2 continuous years may also be eligible to reside in Nassau, Suffolk, Putnam, Westchester, Rockland, or Orange County. To determine if the residency requirement applies to you, please discuss with the agency representative at the time of interview.
 Additional Information

 The City of New York is an inclusive equal opportunity employer committed to recruiting and retaining a diverse workforce and providing a work environment that is free from discrimination and harassment based upon any legally protected status or protected characteristic, including but not limited to an individual's sex, race, color, ethnicity, national origin, age, religion, disability, sexual orientation, veteran status, gender identity, or pregnancy.




 












Job ID 


605039







Title code


31130








Civil service title


SPECIAL INVESTIGATOR








Title classification


Exempt-4








Business title


Associate Data Analyst








Posted until


11/12/2024









Experience Level: 
Experienced (Non-Manager) 







Job level


00








Number of positions


1








Work location


180 Maiden Lane









Category: 
Communications & Intergovernmental Affairs








&nbsp;",https://www.indeed.com/rc/clk?jk=6e65e377eef90454&bb=1RGOqixboJgQNQ4uto0OX3ZCzFq2TI-F-DR5OTUI0V9T8A4IefaCneVresFYE3iYp9eqxWzAEspqtAiUUmqqgwYqyduj4c0768Kibm5bE2eu0ARrv6HVUNx9D79ePdZq&xkcb=SoAf67M36vRdtqS8S50MbzkdCdPP&fccid=7d7b563c6a3a9653&vjs=3
