Job Title,Company,Location,Salary,Description,Link
Principle Data Analyst,Nexxen,"New York, NY","$160,000 - $185,000 a year -  Full-time","Profile insightsFind out how your skills align with the job descriptionSkillsDo you have experience in Tableau?YesNo&nbsp;Job detailsHere’s how the job details align with your profile.Pay$160,000 - $185,000 a yearJob typeFull-time&nbsp;LocationNew York, NY&nbsp;BenefitsPulled from the full job description401(k)Dental insuranceDisability insuranceEmployee assistance programHealth insurancePaid holidaysParental leaveShow morechevron down&nbsp;Full job description
Who is Nexxen? Flexible advertising, unified by data. Nexxen empowers advertisers, agencies, publishers and broadcasters around the world to utilize data and advanced TV in the ways that are most meaningful to them. Our flexible and unified technology stack comprises a demand-side platform (""DSP"") and supply-side platform (""SSP""), with the Nexxen Data Platform at its core. With a global footprint, you can be part of a team that is transforming advertising through our creative, flexible and unified solutions.
 Why join the Nexxen team? With a global footprint, you can be part of a team that is transforming advertising through our creative, flexible and unified solutions. Employees hustle, commit and dedicate themselves to pillars that make up the Nexxen Way – the 3Cs - Customer Centric, Curious Mindset, Collaborative with No Ego.
We are looking for a Principal Data Analyst with strong expertise and data skills to own and deliver our TV Intelligence measurement product worldwide. As a Principal Data Analyst, you will be responsible for evaluating the TV data for correctness and completeness, developing measurement models and systems, prototyping ML algorithms leveraging and building Nexxen's data platform. You will apply your expertise to build data models and your understanding of statistical modeling to raise the bar on how Nexxen can deliver explainable measurement results from campaign performance based on TV viewership data. You will partner with the best technology solution providers at Nexxen and our data/technology partners to enable advertising measurement and optimization on our unique data and technology assets. You will consult with product, engineering, commercial/sales and operations to work on building applications that leverage data captured from disparate sources to draw econometric inferences using machine learning algorithms.
We are looking for someone who is strategically savvy, thinks big, is passionate and self-driven with excellent communication skills within a fast-paced agile environment that requires global collaboration. If you are customer-focused with a passion for innovating to create a first-class measurement experience and can make things happen - please reach out to us now!
 What You'll Do:

Deliver in-depth analytics leveraging TV viewership and campaign data available on Nexxen's end-to-end platforms to deliver explainable measurement results for TV Intelligence products by designing, writing and maintaining data queries & scripts.
Design, deliver and own measurement solutions globally by researching existing measurement strategies, learning existing & new techniques and developing new methodologies/solutions based on data availability and client needs in new markets.
Build long-term measurement strategy & vision working closely with product and business teams to bring innovations to gain competitive advantage.
Work closely with business, product, engineering and operations teams to define requirements, evaluate feasibility, devise execution plans and timely delivery of quality outputs.
Continuously improve models, fine-tune data anomalies & enhance data visualizations when additional data sources are available and design mechanisms for customized measurement reporting as required.
Serve as the subject matter expert on the entire measurement workflow
Partner with product and engineering leads to integrate and productize TVI measurement solutions by designing test cases, fine-tuning parameters and validating results
Help strategize the measurement of product launches by helping the product/business to understand the data nuances.

What will you bring?

7+ years of data analytics experience in adtech industry, out of which 3+ years of owning and developing measurement models.
Experience working with commercial and customers to identify key data problems to solve by diving deep to understand data issues.
Strong expertise with big-based products and languages
SQL – able to write complex SQL queries, good understanding of relational databases, experience with Hadoop/Big data infrastructure and is able to optimize queries to improve performance & timeliness of deliveries
R – able to understand and make necessary adjustments to sophisticated R scripts
Tableau – proficient with data visualization and best practices in Tableau, able to build polished dashboards with complex underlying architecture. Comfortable with advanced formatting and customized views
Strong analytical and problem-solving skills and can understand new data schema, isolate and investigate data anomalies, trouble-shoot complicated calculations
Excellent interpersonal/communication skills and can present results effectively, explain details in methodology and give insightful responses to questions.
Excellent team player who can collaborate with and support product and engineering team members, prioritize tasks and manage delivery timelines based on the overall success of the team
Advanced knowledge of all aspects of the software product development lifecycle for SaaS-based services

Additional skills:

Familiar with data analysis packages in Python (pandas, json, csv etc) and comfortable with writing new scripts from scratch
Good understanding of how machine learning models are trained and applied in various applications, especially within adtech industry
Providing thought leadership by establishing underlying linkage between different information sources that may not be apparent on the surface, provide long-term strategic goals & data-driven insights in campaign measurements
Actively exploring new ideas and broadening Nexxen's measurement solutions

In support of pay transparency and equity, the minimum and maximum full-time annual base salary for this role in New York is $160,000 - $185,000 at the time of posting, with the potential of an incentive or bonus. While this is our reasonable expectation this is not a guarantee of compensation or salary, actual compensation is influenced by a wide range of factors including but not limited to skill set, level of experience, education, certifications, responsibility, and geographic location. Candidates hired to work in other locations will be subject to the pay range associated with that location. We offer a variety of benefits including medical, dental, vision, disability insurance, 401(k), EAP, parental leave, discretionary time off, and company-paid holidays. The specific programs and options available will vary depending on the state, start date, and employment type. Our Talent Acquisition team will be happy to answer any questions you may have.
#LI-KN1
#LI-HYBRID

&nbsp;",https://www.indeed.com/rc/clk?jk=7ee1259c27a620db&bb=gY7L5hacYqTHKyabQKYNP1B8LXBU-SruZUv0qHQngTGIW5Q1xTnxlz9jHm-zeQ2qL3_cWe6SwZNyekQnkpHUrEfRCvQzkVozCXxSbmKV7LjC8at2SILmU_dpGV-JSCPR&xkcb=SoAw67M36ve3NGS0Kh0CbzkdCdPP&fccid=7c0dd3e52976561c&vjs=3
Data Analyst,TRESUME,"43971 Leesburg Pike, Ashburn, VA 20147","$55,000 - $60,000 a year -  Contract","Profile insightsFind out how your skills align with the job descriptionSkillsDo you have experience in SQL?YesNoEducationDo you have a Master's degree?YesNo&nbsp;Job detailsHere’s how the job details align with your profile.Pay$55,000 - $60,000 a yearJob typeContract&nbsp;BenefitsPulled from the full job description401(k)Dental insuranceGreen card sponsorshipHealth insuranceHousing allowanceVisa sponsorship&nbsp;Full job descriptionDuties:- Conduct data analysis using various statistical techniques and machine learning algorithms- Develop predictive models and algorithms to solve business problems- Clean, transform, and preprocess large datasets for analysis- Collaborate with cross-functional teams to identify business requirements and translate them into analytical solutions- Design and implement experiments to test hypotheses and validate models- Communicate findings and insights to stakeholders through visualizations, reports, and presentations- Stay up-to-date with the latest advancements in data science, machine learning, and artificial intelligence
Requirements:- Bachelor's degree in Computer Science, Statistics, Mathematics, or a related field; Master's- Proven experience in data analysis, data mining, and statistical modeling- Proficiency in programming languages such as R and SQL- Familiarity with big data technologies and tools for processing large datasets- Solid understanding of database design principles- Excellent problem-solving skills and ability to think analytically- Strong communication skills with the ability to present complex findings to non-technical stakeholders- based in VA candidates preferred
Job Type: Contract
Pay: $55,000.00 - $60,000.00 per year
Benefits:

401(k)
Dental insurance
Green card sponsorship
Health insurance
Housing allowance
Visa sponsorship

Experience:

SQL: 1 year (Preferred)

Ability to Commute:

Ashburn, VA 20147 (Preferred)

Ability to Relocate:

Ashburn, VA 20147: Relocate before starting work (Preferred)

Work Location: In person&nbsp;",https://www.indeed.com/rc/clk?jk=dd076dc1ae772f57&bb=gY7L5hacYqTHKyabQKYNP8Ysx0ubvEWYcn0wmQTnFA8ZuWdiK1upuiwjQIGbIJYsVFzSGPvpaYmbYqrKmb9crBhD9ko-wat1GGvz45MBDTffyL3y26V16cvCgx77TNGd&xkcb=SoCt67M36ve3NGS0Kh0BbzkdCdPP&fccid=8456b57e4d97ccb6&cmp=TRESUME&ti=Data+Analyst&vjs=3
Senior Data Analyst,Abbott Laboratories,"Abbott Park, IL","$72,700 - $145,300 a year -  Full-time","Profile insightsFind out how your skills align with the job descriptionSkillsDo you have experience in SQL?YesNoEducationDo you have a Bachelor's degree?YesNo&nbsp;Job detailsHere’s how the job details align with your profile.Pay$72,700 - $145,300 a yearJob typeFull-time&nbsp;LocationAbbott Park, IL&nbsp;Full job description
Abbott is a global healthcare leader that helps people live more fully at all stages of life. Our portfolio of life-changing technologies spans the spectrum of healthcare, with leading businesses and products in diagnostics, medical devices, nutritionals and branded generic medicines. Our 114,000 colleagues serve people in more than 160 countries.
Interested in applying your wealth of technical knowledge and experience towards an opportunity in the medical field and improving the lives of people with diabetes? The candidate will be responsible for collecting, cleaning, massaging and analysis of big data. The role will also contribute to defining and implementing Big Data Strategy for the organization along with driving the implementation of IT solutions for the business. The candidate will be working on a big data team to focus on applying data engineering, data science and machine learning approaches to solve business problems.  As a Data Analyst, you will play a crucial role in shaping our data-driven strategies and contributing to the success of our Big Data initiatives at ADC. You will be responsible for designing, developing and deploying advanced data science solutions to uncover customer, product and operational insights from complex datasets. Candidate should be able to work on a geographically distributed team. Additionally, they will be working in a technology-driven environment utilizing the latest tools and techniques.

The ideal candidate should have rigorous analytical capabilities and a pragmatic mindset to help solve our most complex business problems. Highly sought-after qualities include versatility and a desire to continuously learn, improve and empower the team.

Responsibilities

Data Analysis and Modeling:

Craft and maintain data infrastructure with the Data Engineering team by translating business requirements from business partners to data models that will enable reporting, dashboards and segmentation
Proactively analyze data and trends to provide insights and recommendations that drive business strategies


Data Visualization:

Create and maintain dashboards and reports using data visualization tools to communicate findings and insights to technical and non-technical stakeholders


Data Optimization:

Continuously monitor and improve data quality, accuracy and efficiency of data processes, including data cleaning and transformation
Define and maintain a central source of truth and normalizing data


Data Security:

Contribute to data security and confidentiality by maintaining appropriate access controls, encryption and backup procedures


Team Collaboration:

Collaborate with cross-functional teams including R&D, Global Strategic Marketing, Quality, etc. to identify data needs and provide data-driven solutions


Training and Delivery:

Provide training and support to team and business partners to enhance data literacy
Respond to ad-hoc data requests and perform special analyses as required by the business to support strategic decision-making


Innovate:

Stay updated with the latest developments in data science and machine learning to continually improve data analysis methodologies and techniques
Identify opportunities for innovation and propose data-driven solutions


Documentation:

Maintain comprehensive documentation of data analysis processes, methodologies and findings


Required Qualifications

Bachelor’s Degree in a relevant field (e.g., Statistics, Data Science, Economics, Computer Science) plus at least 4-6 years of recent experience
Experience with data exploration, data cleaning, data analysis, data visualization and data mining, preferably in the medical device or healthcare industry
Experience with SQL, building dashboards, data transformation and analysis tools (ie Python, R)
Experience with data visualization tools (e.g., Databricks, QuickSight, Power BI)
Strong knowledge of data governance principles, data integration, data warehousing and ETL processes
Familiarity with data privacy and security regulations, such as HIPAA and GDPR
Ability to work collaboratively in a fast-paced, cross-functional team environment


Excellent communication and presentation skills with the ability to translate technical findings into actionable insights for non-technical stakeholders
Comfortable working asynchronously with a distributed team


Preferred Qualifications

Education in, or experience with, machine learning
Experience working in an agile environment

 The base pay for this position is $72,700.00 – $145,300.00. In specific locations, the pay range may vary from the range posted.
&nbsp;",https://www.indeed.com/rc/clk?jk=ee6941020e5a4c7f&bb=gY7L5hacYqTHKyabQKYNP2uLGiBGGEEkuHdF-MzFnPrBy4jBphSkgO5SDRuz2ApV1J48KoLmT9uoQ9v6rKzNGPFJirXGh-fmQs86aNW5TsnH22TjHd6voQ%3D%3D&xkcb=SoAZ67M36ve3NGS0Kh0AbzkdCdPP&fccid=77426fa86bb11d7c&vjs=3
Data Analyst,Elder Research,Not Available,Full-time,"Profile insightsFind out how your skills align with the job descriptionLicensesDo you have a valid Top Secret Clearance license?YesNoCertificationsDo you have a valid AWS Certification certification?YesNoSkillsDo you have experience in Spark?YesNoEducationDo you have a Master's degree?YesNo&nbsp;Job detailsHere’s how the job details align with your profile.Job typeFull-time&nbsp;Full job description
Data Analyst
Work Location: Remote, with a preference of physical location being in the DMV Area
Clearance Required: Top Secret or CBP BI
Elder Research Inc. is a recognized leader in predictive analytics and machine learning. We pride ourselves in our ability to find creative, cutting edge solutions to real-world problems. We are looking for innovative and inquisitive self-starters who enjoy translating complex models into actionable solutions that deliver real value for our clients.
As a member of the Elder Research team, you will join a functional team of accomplished Data Scientists and Software Engineers that deliver custom analytic solutions. Some of your responsibilities will include: wrangling and fusing large and disparate data sets, assisting in the deployment of models and algorithms, automating the entire data pipeline, and communicating model results through user-focused data visualizations.
We are looking for an experienced Data Analyst to join our team! As a Data Analyst, you will support robust and repeatable data manipulation, large scale infrastructure for data ingestion, and stunning data visualization for custom client applications.

Role Responsibilities:

Responsible for data mining, data preparation, and reporting.
Prepare and conduct analyses and studies, needs/gaps assessments.
Applies knowledge to determine the accuracy and reasonableness of the data, recommendations, and solutions proposed.
Documents and summarizes the results and develops and recommended solutions to the customer’s problems.
Prepares big data, implements data models developed by others, and provides database support for customer solutions.
Key member of a data science project team, supporting data scientists or other consultants in the performance of assigned tasks.

Required Qualifications:

Recently adjudicated Top Secret Clearance. 
Four (4) years relevant experience in applied research, big data analytics, statistics, applied mathematics, data science, computer science, operations research or other closely related other quantitative or mathematical discipline. At least two (2) years of experience applied data science research or big data analytics.
Bachelor’s Degree in Statistics, Applied Mathematics, Data Science, Computer Science, Operations Research or other closely related scientific or technical discipline A Master’s degree may be substituted for up to two (2) years of relevant experience. A PhD may be substituted for experience.
Knowledge of data mining methods, databases, data visualization and machine learning.
Ability to communicate analysis techniques, concepts, and products.
Ability to develop data-driven analysis and reports based on data visualizations and data models.
Strong SQL skills, and ability to identify issues with data.
Experience with Qlik.
Experience with PowerBI tools.
Understanding of database and database design
Demonstrated experience with cleaning, management, optimizing performance and processing large volumes of data.
Demonstrated experience within an AWS environment (AWS certifications preferred)
Familiarity with industry best-practices for software-hardware optimization when processing large sets of data.
Experience with machine learning, with statistical modeling, time-series forecasting and/or geospatial analytics is preferred.
Experience with Hadoop, Spark or other parallel storage/computing processes is a plus.
Ability to travel to and work on site at clients as needed.
Excellent communication skills both verbal and written.


About Elder Research, Inc.
Elder Research is a fast growing consulting firm specializing in predictive analytics and machine learning. Elder Research has been in the data science business for over 20 years providing analytic solutions to hundreds of companies and organizations across numerous industries. At Elder Research, you’ll be part of a fun, friendly community. In keeping with our entrepreneurial spirit, we want candidates that are self-motivated with an innate curiosity and strong team work ethic. We work hard to provide the best value to our clients and allow each person to contribute their ideas and put their skills to use immediately.
Achieving success on defense, intelligence and security projects requires a data science team with broad experience, critical thinking, a proven ability to solve complex problems, and the ability to effectively communicate results. Our scientists conduct analysis in a collaborative environment that frequently brings together the expertise of decision-makers, analysts, agents, investigators, and even behavioral scientists. Our team relies on well-trained technical personnel who have experience with tools, algorithms, best practices, and custom software development to navigate the frontier of unsolved problems we typically encounter. Our team enjoys great variety in the type of work they do and exposure to a wide range of analytic techniques and tools.
Elder Research, Inc. is an Equal Opportunity Employer. All qualified applicants will receive consideration for employment without regard to race, color, religion, sex, sexual orientation, gender identity, national origin, or protected veteran status and will not be discriminated against on the basis of disability.

&nbsp;",https://www.indeed.com/rc/clk?jk=23720bc5f9f76a73&bb=gY7L5hacYqTHKyabQKYNP6TujTt-p9q805qMaG1szIpaF5VdhAuLRMk8FWckRhn6E2Am8nO1V_PDIGgRgo29P_rO1bwMugoGGd2D6L6xIoBHN5n2fnxvaFQ67l_yiYZ9&xkcb=SoCX67M36ve3NGS0Kh0HbzkdCdPP&fccid=b3991d5c19e7c0f4&vjs=3
