Job Title,Company,Location,Salary,Description,Link
Data Analyst,PrairieCare,"3990 Hillsboro Pike, Nashville, TN 37215",Full-time,"Profile insightsFind out how your skills align with the job descriptionSkillsDo you have experience in Tableau?YesNoEducationDo you have a Master's degree?YesNo&nbsp;Job detailsHere’s how the job details align with your profile.Job typeFull-time&nbsp;Location3990 Hillsboro Pike, Nashville, TN 37215&nbsp;Full job description
 About Us: 
 
  Seeking a fulfilling career opportunity? Newport Healthcare and PrairieCare are working together to provide comprehensive treatment and rewarding jobs. We’re expanding access to treatment for people of all ages, through a full continuum of care delivered by compassionate experts and proven to create industry-leading outcomes.
 
 Join Our Team of Caring and Compassionate Experts - Every employee at Newport and PrairieCare plays a key role in creating a transformative experience for each other and for those we serve.
 Responsibilities: 
 
  The Data Analyst provides support to the Business Optimization team and organizational initiatives through analysis of operational, process, financial, and clinical data and works on special projects, as assigned
 


 Responsibilities and Accountabilities: 


Works directly with the Business Optimization Senior Director, and collaborates with Information Technology, company's EHR, and members of the leadership team to provide accurate and timely representations and analyses of data.
Responsible for gathering and integrating qualitative and quantitative data from disparate data sources; evaluating and processing raw data and information into usable datasets; validating data and reports; and transforming data into reports that are simple, easy to read and drive actionable outcomes.
Collaborate with IT to build and/or build and maintain databases to support reporting needs within the scope of the Business Optimization team.
Build data models and analyze data to identify trends and develop models for inference and prediction based on a variety of sources.
Develop and maintain dashboards for Performance Improvement, Quality, Operations, and organizational initiatives.Identify, analyze, and interpret trends or patterns in complex data sets and identify opportunities to increase health care quality and reduce costs.
Identify opportunities for continuous improvement and efficiency within the organization.
 Qualifications: 
 
 Education Requirements:


  Bachelor’s degree in business, statistics, finance, health care administration, public health, psychology, or related field; master’s degree preferred.
 

Three to five years working with data and data management systems.
One to three years working with healthcare and/or clinical data preferred.
Experience working with a wide range of data sets including patient, geographic, insurance, survey, quality and process related data


 Specific Skills:


Basic knowledge of fundamental concepts in health care delivery.
Knowledge of building and maintaining databases.
Data visualization and dashboard development.
Proficiency in SQL and data analysis tools such as Tableau, PowerBI, SAS, and SPSS.
Knowledge of enterprise data warehouse and data management systems.
Ability to identify trends and make recommendations based on findings.
Ability to transform data into actionable outcomes.
Ability to take initiative, exercise sound judgment, and solid decision-making to achieve organizational/departmental objectives.
Ability to function as a member of a multidisciplinary team.
Analytical, resourceful, and an aptitude for problem-solving.
Ability to prioritize and meet deadlines.
Ability to work independently.
Excellent verbal and written communication skills.

 Additional Details: The Data Analyst provides support to the Business Optimization team and organizational initiatives through analysis of operational, process, financial, and clinical data and works on special projects, as assigned.
&nbsp;",
Functional Analyst,General Dynamics Information Technology,"Bossier City, LA 71111","$53,703 - $72,657 a year -  Full-time","Profile insightsFind out how your skills align with the job descriptionCertificationsDo you have a valid ITIL Certification certification?YesNoSkillsDo you have experience in Visio?YesNoEducationDo you have a Bachelor's degree?YesNo&nbsp;Job detailsHere’s how the job details align with your profile.Pay$53,703 - $72,657 a yearJob typeFull-time&nbsp;LocationBossier City, LA 71111&nbsp;BenefitsPulled from the full job description401(k)401(k) matchingAD&D insuranceDental insuranceDisability insuranceHealth insuranceHealth savings accountShow morechevron down&nbsp;Full job description
Type of Requisition: Regular
 
 Clearance Level Must Currently Possess: None
 
 Clearance Level Must Be Able to Obtain: None
 
 Suitability:

 Public Trust/Other Required: Other
 
 Job Family: Functional Experts
 
 Job Qualifications:
 Skills: Analytical Thinking, Data Analysis, Process Improvements
  Certifications:
 Experience: 2 + years of related experience
  US Citizenship Required: No
 
 Job Description:
GDIT has an opening for a Functional Analyst to support the Department of Veterans Affairs Enterprise Service Desk. In this position you will utilize your analytical and communication skills to integrate new platforms and processes to VA Enterprise Service Desk. You will have the opportunity to hone and develop your communication skills through written and oral communications to internal and external customers at all levels of the organization.

 HOW A FUNCTIONAL ANALYST WILL MAKE AN IMPACT:

Data Collection / Documentation and Analysis:

Facilitate Discovery Calls to gather information for new Process Integration opportunities.
Develop VISIO process flows for the “To Be” state, in coordination with VA personnel, the Process Integration team, Subject Matter Experts and the Knowledge/Training/Operation Management teams to ensure a seamless transition to the Service Desk.
Gather and analyze data related to process performance, identifying trends, bottlenecks, and opportunities for improvement.
Develop and maintain a risk register that track and prioritizes identified risks.


Collaboration and Coordination:

Maintain a Virtual Task Board to ensure accurate tracking of Process Integration efforts.
Interface and collaborate with VA personnel and other vendors to ensure seamless operation and data flow across different departments or functions within the organization.
Collaborate with other departments including IT, operations, and management to align process improvements and integrations with overall business goals.
Coordinate testing and validation of process changes and system integrations to ensure they meet business requirements, potentially involving simulations or pilot programs.
Collaborate with other departments to manage risk-related matters.
Coordinate Operational Readiness Reviews to ensure that process changes and system integrations function as expected.


 WHAT YOU’LL NEED TO SUCCEED:

BA/BS and 2+ years of related experience or equivalent years of experience
Active ITIL v4 certification within 30 days of hire
Experience in Microsoft Project or similar technologies
Experience in Visio or similar technologies
Ability to obtain and maintain Public Trust with the VA


 NICE TO HAVES:

1 year or more of experience on the VA Service Desk
Experience in risk management


 GDIT IS YOUR PLACE:

Full-flex work week to own your priorities at work and at home
401K with company match
Comprehensive health and wellness packages
Internal mobility team dedicated to helping you own your career
Professional growth opportunities including paid education and certifications
Cutting-edge technology you can learn from
Rest and recharge with paid vacation and holidays

 The likely salary range for this position is $53,703 - $72,657. This is not, however, a guarantee of compensation or salary. Rather, salary will be set based on experience, geographic location and possibly contractual requirements and could fall outside of this range.
 
 Scheduled Weekly Hours: 40
 
 Travel Required: None
 
 Telecommuting Options: Hybrid
 
 Work Location: USA LA Bossier City
 
 Additional Work Locations: USA KY Barbourville, USA TX El Paso
 
 Total Rewards at GDIT: Our benefits package for all US-based employees includes a variety of medical plan options, some with Health Savings Accounts, dental plan options, a vision plan, and a 401(k) plan offering the ability to contribute both pre and post-tax dollars up to the IRS annual limits and receive a company match. To encourage work/life balance, GDIT offers employees full flex work weeks where possible and a variety of paid time off plans, including vacation, sick and personal time, holidays, paid parental, military, bereavement and jury duty leave. To ensure our employees are able to protect their income, other offerings such as short and long-term disability benefits, life, accidental death and dismemberment, personal accident, critical illness and business travel and accident insurance are provided or available. We regularly review our Total Rewards package to ensure our offerings are competitive and reflect what our employees have told us they value most.
  We are GDIT. A global technology and professional services company that delivers consulting, technology and mission services to every major agency across the U.S. government, defense and intelligence community. Our 30,000 experts extract the power of technology to create immediate value and deliver solutions at the edge of innovation. We operate across 30 countries worldwide, offering leading capabilities in digital modernization, AI/ML, Cloud, Cyber and application development. Together with our clients, we strive to create a safer, smarter world by harnessing the power of deep expertise and advanced technology.
  We connect people with the most impactful client missions, creating an unparalleled work experience that allows them to see their impact every day. We create opportunities for our people to lead and learn simultaneously. From securing our nation’s most sensitive systems, to enabling digital transformation and cloud adoption, our people are the ones who make change real.
  GDIT is an Equal Opportunity/Affirmative Action employer. All qualified applicants will receive consideration for employment without regard to race, color, religion, sex, sexual orientation, gender identity, national origin, disability, or veteran status, or any other protected class.
&nbsp;",
Statistical Data Analyst (Part Time) (Hybrid) - Psychiatry,Washington University in St Louis,"660 S Euclid Ave, St. Louis, MO 63110",$27.21 - $43.56 an hour -  Part-time,"Profile insightsFind out how your skills align with the job descriptionLicensesDo you have a valid Driver's License license?YesNoSkillsDo you have experience in Social media management?YesNoEducationDo you have a Master's degree?YesNo&nbsp;Job detailsHere’s how the job details align with your profile.Pay$27.21 - $43.56 an hourJob typePart-time&nbsp;Location660 S Euclid Ave, St. Louis, MO 63110&nbsp;BenefitsPulled from the full job descriptionFlexible schedule&nbsp;Full job description
Position Summary A group of young investigators in Child & Adolescent Psychiatry at the Washington University School of Medicine are seeking to hire a skilled and passionate statistical data analyst (hybrid or remote) to join and amplify our growing team. This is a PT role with flexible hours, approximately 10-15 hours per week. We are devoted to improving the outcomes of preteens with mental health concerns and driven by a mission to enhance understanding of the role of social media in preteen health and development. This is an exciting opportunity to be part of a team that is transforming the landscape of preteen mental health—the results from this project may help us better understand how social media impacts mental health and development. We offer a collegial and collaborative work culture that values and respects your contributions.  In your role as a Statistical Data Analyst, you will bring your clinical research expertise to oversee the data management processes of our R01 study. This role is crucial to the success of our research efforts, requiring expertise in handling multiple data types, maintain the integrity of our databases, and ensuring compliance with regulatory standards.
 
 Job Description

 Primary Duties & Responsibilities: 

Create, manage, and maintain the REDCap database for the project, ensuring data accuracy, security, and compliance with institutional and regulatory guidelines.
Oversee data collection, entry, and validation processes across various data types, including clinical assessments, biological/hormone data, and patient-reported outcomes (e.g., surveys).
Collaborate closely with the research coordinator, staff, and PIs to ensure seamless data flow and timely reporting.
Conduct regular data audits, monitor data quality, and address any discrepancies promptly.
Generate data reports and summaries for research teams, sponsors, and regulatory bodies as required, including data deposits into the NDA.
Create and organize datasets for use in manuscript submissions.
Provide training and support to research staff on data management best practices and REDCap usage.


 Working Conditions: Job Location/Working Conditions

Normal office environment

 Physical Effort

Typically sitting at desk or table
Repetitive wrist, hand or finger movement (PC typing)

 Equipment

Office equipment

 The above statements are intended to describe the general nature and level of work performed by people assigned to this classification. They are not intended to be construed as an exhaustive list of all job duties performed by the personnel so classified. Management reserves the right to revise or amend duties at any time.
 
 Required Qualifications

 Education: Bachelor’s degree or combination of education and/or experience may substitute for minimum education.
  Certifications: No specific certification is required for this position.No specific certification is required for this position.
  Work Experience: No specific work experience is required for this position.
  Skills: Not Applicable
  Driver's License: A driver's license is not required for this position.
 
 More About This Job Washington University seeks highly motivated individuals who are able to perform duties in a manner consistent with our core mission and guiding principles.
 
 Preferred Qualifications

 Education: Master's degree
  Certifications: No additional certification beyond what is stated in the Required Qualifications section.
  Work Experience: 
No additional work experience beyond what is stated in the Required Qualifications section.
  Skills: Biomedical Research, Clinical Studies, Data Analysis, Data Management, Interpersonal Communication, Oral Communications, Organizing, Redcap, Statistical Packages, Written Communication
 
 Grade G11-H
 
 Salary Range $27.21 - $43.56 / Hourly
  The salary range reflects base salaries paid for positions in a given job grade across the University. Individual rates within the range will be determined by factors including one's qualifications and performance, equity with others in the department, market rates for positions within the same grade and department budget.
 
 Questions
For frequently asked questions about the application process, please refer to our External Applicant FAQ.

 Accommodation
If you are unable to use our online application system and would like an accommodation, please email CandidateQuestions@wustl.edu or call the dedicated accommodation inquiry number at 314-935-1149 and leave a voicemail with the nature of your request.
 All qualified individuals must be able to perform the essential functions of the position satisfactorily and, if requested, reasonable accommodations will be made to enable employees with disabilities to perform the essential functions of their job, absent undue hardship.
 
 Pre-Employment Screening All external candidates receiving an offer for employment will be required to submit to pre-employment screening for this position. The screenings will include criminal background check and, as applicable for the position, other background checks, drug screen, an employment and education or licensure/certification verification, physical examination, certain vaccinations and/or governmental registry checks. All offers are contingent upon successful completion of required screening.
 
 Benefits Statement Please visit our website at https://hr.wustl.edu/benefits/ to review our benefit eligibility criteria along with any applicable benefits.
 
 EEO/AA Statement Washington University in St. Louis is committed to the principles and practices of equal employment opportunity and especially encourages applications by those from underrepresented groups. It is the University’s policy to provide equal opportunity and access to persons in all job titles without regard to race, ethnicity, color, national origin, age, religion, sex, sexual orientation, gender identity or expression, disability, protected veteran status, or genetic information.
 
 Diversity Statement Washington University is dedicated to building a diverse community of individuals who are committed to contributing to an inclusive environment – fostering respect for all and welcoming individuals from diverse backgrounds, experiences and perspectives. Individuals with a commitment to these values are encouraged to apply.
&nbsp;",
Quality Control Data Analyst,Regeneron Pharmaceuticals Inc.,"Rensselaer, NY",$23.89 - $42.93 an hour -  Full-time,"Profile insightsFind out how your skills align with the job descriptionSkillsDo you have experience in Quality control?YesNoEducationDo you have a Bachelor's degree?YesNo&nbsp;Job detailsHere’s how the job details align with your profile.Pay$23.89 - $42.93 an hourJob typeFull-timeShift and scheduleMonday to Friday&nbsp;LocationRensselaer, NY&nbsp;BenefitsPulled from the full job descriptionPaid time off&nbsp;Full job descriptionWe are looking to hire a Quality Control (QC) Data Analyst for a Monday-Friday, 8am-4:30pm schedule. Regeneron successfully manufactures a range of biopharmaceuticals for patients worldwide, including our approved therapeutic proteins and those involved in clinical studies. Our QC Analysts are on the front line, performing a variety of activities to support release and stability programs of these life changing products to ensure that they are safe for our patients. As a Quality Control Analyst, a typical day might include the following: Compile internally and externally generated data in support of compiling CofAs and SofAs. Prepare and provide CofAs and SofAs for all lot release materials Work with members of manufacturing, QA, RA, and R/D to provide updates/status of CofAs, SofAs, testing issues, etc. Trend QC product release data to support lot release and regulatory filings Act as a liaison between QC, Process Analytical Sciences, and Manufacturing group to provide trending analyses to support various activities such as manufacturing investigations, and validation studies. Assist in the implementation and maintenance of product release and stability data trending program for each product candidate Presents trending data at the in-depth product review Write product annual release data trending reports Write lot specific data trending reports for each lot to be released Prepare and populate matrices (databases, spreadsheets) designed to track testing and review status of release and stability samples, lot release data, etc. Compile data to support QC department metrics and performance tracking Assist with the improvement effort of streamlining the review and release process Attend meetings as required on behalf of Quality Control to update partners (Drug Supply, External Manufacturing, QA) as to status issues pertaining to release data Attend meetings to keep informed of development and manufacturing priorities and activities Ensures compliance with applicable cGMP regulations and SOPs Maintain and update relevant SOPs for data review and reporting as needed Meet specified timelines to support release and regulatory filings Complies with all pertinent regulatory agency requirements. Participates in required training activities.  This role might be for you if: Enjoy working in a fast-paced environment and you have the innate ability to balance multiple tasks, prioritize them and execute them independently, while excelling at keeping all impacted parties well advised Have a basic understanding of Microsoft Suite (Word, Excel, Powerpoint) Can follow a set of instructions with exceptional attention to detail Ability to work in a team environment and communicate effectively to accomplish shared goals Develop and drive scientific and/or business-related improvement ideas To be considered for the Quality Control Analyst you must be willing and able to work 1st shift, Monday-Friday, 8am-4:30pm schedule. You must have a BS/BA in Chemistry, Biochemistry or related field and some relevant work experience. Experience working in a cGMP pharmaceutical Quality Control Laboratory is preferred but not required. Does this sound like you? Apply now to take your first step towards living the Regeneron Way! We have an inclusive and diverse culture that provides comprehensive benefits, which often include (depending on location) health and wellness programs, fitness centers, equity awards, annual bonuses, and paid time off for eligible employees at all levels! Regeneron is an equal opportunity employer and all qualified applicants will receive consideration for employment without regard to race, color, religion or belief (or lack thereof), sex, nationality, national or ethnic origin, civil status, age, citizenship status, membership of the Traveler community, sexual orientation, disability, genetic information, familial status, marital or registered civil partnership status, pregnancy or parental status, gender identity, gender reassignment, military or veteran status, or any other protected characteristic in accordance with applicable laws and regulations. The Company will also provide reasonable accommodation to the known disabilities or chronic illnesses of an otherwise qualified applicant for employment, unless the accommodation would impose undue hardship on the operation of the Company's business. For roles in which the hired candidate will be working in the U.S., the salary ranges provided are shown in accordance with U.S. law and apply to U.S.-based positions. For roles which will be based in Japan and/or Canada, the salary ranges are shown in accordance with the applicable local law and currency. If you are outside the U.S, Japan or Canada, please speak with your recruiter about salaries and benefits in your location. Please note that certain background checks will form part of the recruitment process. Background checks will be conducted in accordance with the law of the country where the position is based, including the type of background checks conducted. The purpose of carrying out such checks is for Regeneron to verify certain information regarding a candidate prior to the commencement of employment such as identity, right to work, educational qualifications etc. Salary Range (hourly) $23.89 - $42.93&nbsp;",
Data Analyst,Intone Networks,"Cincinnati, OH",Contract,"Job detailsHere’s how the job details align with your profile.Job typeContract&nbsp;LocationCincinnati, OH&nbsp;Full job descriptionTitle: Data Analyst Location: Cincinnati, OH (hybrid)12-month contract&nbsp;",
