Job Title,Company,Location,Salary,Description,Link
Data Analyst/ Software Developer,"Stress Engineering Services, Inc.","Houston, TX",Full-time,"Profile insightsFind out how your skills align with the job descriptionSkillsDo you have experience in UI development?YesNoEducationDo you have a Bachelor's degree?YesNo&nbsp;Job detailsHere’s how the job details align with your profile.Job typeFull-time&nbsp;LocationHouston, TX&nbsp;Full job description
 Overview: 
 
  Stress Engineering Services Inc. (SES) is a premier provider of engineered solutions and professional engineering consulting services across all engineering disciplines and has been serving clients since 1972. Over the last 50 years, we have built a sound reputation of unsurpassed technical excellence and superior customer service by employing highly trained and experienced professionals with the highest standard of performance. Approximately 80% of current SES business is repeat or direct referral, a testament to our commitment to quality. We take on some of industry’s most difficult problems, utilizing approximately 275 employees, including 155 engineers across offices in Houston; Cincinnati; Waller, TX; and Calgary, Alberta, Canada.
 


 We are seeking a Data Analyst/ Software Developer who will work closely with other employees in the Digital Solutions Group (DSG), as well as engineers and data analysts outside the group, to develop software and scripts to support projects involving automated simulation and analytics. The position will interface primarily with the DSG Full Stack Developer and other DSG staff, as well as with data analysis engineers. A combination of independent learning and team collaboration will be required to successfully execute projects.
 


 This is an onsite position.
 
 Responsibilities: 
 
Support the DSG by reviewing and analyzing data and recommending strategies for creating algorithms and tools to generate value-added output for clients.
Write software and/or scripts to implement algorithms and submit for QA review, including creating and executing unit tests to ensure high-quality code.
Develop and maintain automated testing processes for software, including UI testing, to validate front-end and back-end functionality.
Evaluate and select new software appropriate for emerging applications as needed.
Prepare and present reports documenting analysis, algorithm development, and testing findings.
Support Project Managers to meet project goals and deliverables.
Participate in code reviews internally and externally.
Integrate software with Azure DevOps (ADO) pipelines, ensuring continuous integration and deployment (CI/CD) processes are efficient and reliable.
Stay informed regarding new technologies and improvements in the industry to maintain proficiency.
Monitor and support existing deployed systems to ensure user and business requirements are met.
Participate in software project management processes.
Generate documentation (e.g., user manuals, training videos, etc.) as required.
 Qualifications: 
 Minimum Qualifications: 

Bachelor of Science degree in Engineering, Computer Science, Information Technology, or related major.
A minimum of 2 years of solid experience in DevOps pipeline applications and software development.
Knowledge in the following programming languages: Python, C#, .NET Framework (4+), .NET Core.
Strong experience in developing and executing unit tests, particularly for UI components and backend systems.
Hands-on experience with Azure DevOps (ADO) pipelines for continuous integration and deployment (CI/CD).
Experience with Microsoft Azure cloud services.
Experience with UI design and development; knowledge of JavaScript is a plus.
Experience in software architecture and design, with the ability to develop scalable, maintainable, and efficient software systems.
Interest in physics and physical sciences.
Strong verbal and written communication skills required.
Excellent analytical and problem-solving skills.
Ability to work well in/with teams.
Strong work ethic and attention to detail required.


  Stress Engineering Services is an independent, employee-owned engineering firm. We are an equal opportunity employer. All qualified applicants will receive consideration for employment without regard to race, color, religion, gender, gender identity or expression, sexual orientation, national origin, genetics, pregnancy, disability, age, veteran status, or other characteristics.
 
&nbsp;",
Capture Analyst,"ValidaTek, Inc.","1660 International Drive, McLean, VA 22102","$58,183.94 - $96,973.24 a year -  Full-time","Profile insightsFind out how your skills align with the job descriptionSkillsDo you have experience in SharePoint?YesNoEducationDo you have a Bachelor's degree?YesNo&nbsp;Job detailsHere’s how the job details align with your profile.Pay$58,183.94 - $96,973.24 a yearJob typeFull-time&nbsp;Location1660 International Drive, McLean, VA 22102&nbsp;Full job description
 Company Overview: At ValidaTek, we modernize and optimize IT services to solve some of the most critical challenges facing federal civilian and defense agencies. From customers to partners to top-talent employees, ValidaTek puts people first, empowering them to exceed expectations and transform government organizations. Our success starts and ends with our people, so we built a company where great people can do great things, with the resources and autonomy to make decisions that transform organizations. We operate as one team of diverse people, united by a passion for continuous growth and optimization. Our commitment to quality and performance optimization is the reason why our IT Service Projects and New Development Projects have been appraised at CMMI Maturity Level 5, positioning us as one of a handful of elite companies to receive the highest form of third-party validation. www.validatek.com Summary: 
 We are seeking a talented Business Development/Capture Analyst to assist the activities of the Growth team – business development / capture / solutions / proposals – with research and analysis of opportunities within existing and potential markets. Specifically, provide the full range of technical, administrative, and analytical support across the entire opportunity life-cycle, from identification through the post-proposal submission, including but not limited to, developing capture briefing, maintaining an accurate and up-to-date opportunity pipeline, coordinating and responding to data calls (internal and external), and contributing to the development of various technical, management, past performance, resumes, and pricing artifacts (related to RFx responses). Responsibilities: 
 Perform general tasks within the Growth team to include but not limited to:

Provide technical, administrative, and analytical support across the entire opportunity life cycle, from identification through post-proposal submission.
Support overall Growth pipeline management activities ensuring CRM is always up to date with notes and intelligence
Search for and analyze opportunities to assist the BD team in developing and maintaining the BD pipeline.
Utilize a variety of web-based tools to identify opportunities aligned with the organization strategy, capabilities, and service offerings.
Gather, compile, and analyze data related to existing contracts and new opportunity identification, and communicate findings to the Growth team in written and oral formats. Perform activities on daily, weekly, monthly, and ad hoc basis.
Organize, plan, and support pipeline review meetings, synthesizing, aggregating, streamlining and organizing research data into logical formats to inform disposition actions for identified opportunities.
Research companies (potential teaming partners or competition)
Attend Vendor Outreach Sessions, Industry Day Events, and Webinars and present summaries to Growth team
Mentoring junior team members

This is not intended to be an all-inclusive list of job duties and responsibilities. Other duties, responsibilities and activities may change or be assigned at any time with or without notice. Qualifications: 
 
Minimum bachelor’s degree and four years BD/Capture support experience, or a combination of equivalent experience and training.
Ability to analyze, categorize, and logically group data in written and graphical reports.
Ability to effectively interact with a wide range of personnel
Ability to work independently and collaboratively
Fair understanding and skilled in researching various IT domains and technologies
Understanding of government contract terms
Demonstrated ability to multitask with multiple high-priority demands in an intense, deadline-driven environment
Excellent research, analytical, and problem-solving skills
Excellent attention to detail and organizational skills
High proficiency in MS Word, MS Excel, and Adobe Acrobat Pro, and MS Office applications, SharePoint and Teams
Must be willing to provide after-hours and on-site support as needed.
 Posted Min Pay Rate: USD $58,183.94/Yr. Posted Max Pay Rate: USD $96,973.24/Yr. Salary Disclosure: Actual salary will be based on a variety of factors including but not limited to experience, geographic location, contract affordability, internal equity, education, and certifications. The upper end of the salary range may be reserved for individuals who have demonstrated tenure with the company, seniority, and proven excellent performance. This includes factors such as education, certifications, and extensive/unique experience beyond what is required. EEO Statement: ValidaTek is an Equal Opportunity Employer. All qualified applicants will receive consideration for employment without regard to race, color, religion, sex, national origin, age, protected veteran status, or disability status. Applicants who are selected for employment will be required to verify authorization to work in the United States. Offers of employment will be contingent upon passing a post-offer background check.

Job Type: Full-time
Pay: $58,183.94 - $96,973.24 per year&nbsp;",
Data and Analytics Analyst,MIDCONTINENT INDEPENDENT SYSTEM,"Carmel, IN 46032",Full-time,"Profile insightsFind out how your skills align with the job descriptionSkillsDo you have experience in Tableau?YesNoEducationDo you have a Bachelor's degree?YesNo&nbsp;Job detailsHere’s how the job details align with your profile.Job typeFull-time&nbsp;LocationCarmel, IN 46032&nbsp;Full job description

As MISO’s Data and Analytics Analyst, you will play a pivotal role in shaping our business strategy by leading data-driven initiatives, crafting insightful reports, and delivering actionable recommendations. This position requires analytical experience, proficiency in modern data tools, and the ability to translate complex data into clear insights for non-technical stakeholders. Your work will directly help us stay ahead in a rapidly evolving industry.
Your key responsibilities as MISO’s Data and Analytics Analyst include:

Conducting in-depth data analyses to uncover trends, patterns, and actionable insights that influence key business decisions.
Designing, developing, and maintaining dynamic and scalable data dashboards and reports using tools like Power BI, Tableau, or similar platforms.
Ensuring the accuracy, integrity, and consistency of data through rigorous validation and cleansing techniques.
Identifying opportunities to enhance data workflows, optimize reporting processes, and implement best practices in data collection and analysis.
Maintaining detailed documentation of data sources, methodologies, and reporting procedures to ensure transparency and repeatability.
Responding to ad hoc data requests and provide timely, accurate insights to drive business initiatives forward.

Skills needed for our Data and Analytics Analyst role include:

Bachelor’s degree in Information Technology, Business Administration, or related field or a minimum of five (5) years relevant hands-on work experience
Strong analytical skills, including the ability to define problems, collect and analyze data, and draw meaningful conclusions.
Proficiency in SQL and Python to manage and analyze complex datasets, contributing to our data analytics center of excellence.
Expertise in data visualization and analysis tools such as Tableau, Power BI, and Alteryx.
Familiarity with APIs as we transition to cloud-based systems (Azure) for pulling data via API connections.

Appropriate level will be determined based upon experience and knowledge.
Transformative innovation is happening in the electric industry, from digitalizing homes and distributed resources to renewable energy and an ever-changing grid. MISO manages the electricity superhighway in the Central U.S. and through use of groundbreaking research and advanced technology, our highly skilled employees ensure power flows reliably to 45 million Americans. Operating the electricity grid, running a robust energy market, planning for a bright future – it’s what our immensely hardworking and dedicated team does every day.   At MISO we offer a hybrid work environment and a comprehensive benefits package available on your first day of employment.  #DiscoverMISO #MISOCareers #lifeatMISO #weareMISO
#LI-HYBRID #LI-JH1

 Skills Preferred
 
PowerBI
Python
Tableau

&nbsp;",
Data Analyst,Amex,"Phoenix, AZ","$70,000 - $135,000 a year","Profile insightsFind out how your skills align with the job descriptionSkillsDo you have experience in Visual design?YesNoEducationDo you have a Master's degree?YesNo&nbsp;Job detailsHere’s how the job details align with your profile.Pay$70,000 - $135,000 a year&nbsp;LocationPhoenix, AZ&nbsp;BenefitsPulled from the full job descriptionDental insuranceHealth insuranceLife insurancePaid parental leaveParental leaveRetirement planVision insurance&nbsp;Full job description
You Lead the Way. We’ve Got Your Back.
With the right backing, people and businesses have the power to progress in incredible ways. When you join Team Amex, you become part of a global and diverse community of colleagues with an unwavering commitment to back our customers, communities and each other. Here, you’ll learn and grow as we help you create a career journey that’s unique and meaningful to you with benefits, programs, and flexibility that support you personally and professionally.
At American Express, you’ll be recognized for your contributions, leadership, and impact—every colleague has the opportunity to share in the company’s success. Together, we’ll win as a team, striving to uphold our company values and powerful backing promise to provide the world’s best customer experience every day. And we’ll do it with the utmost integrity, and in an environment where everyone is seen, heard and feels like they belong.
Join Team Amex and let's lead the way together.
American Express engages with thousands of third parties to provide goods and services. To ensure we protect our brand, avoid financial impact and adhere to various laws and regulations, all high-risk third parties are subject to risk management throughout the third-party lifecycle.

The GSM Third-Party Center of Excellence (COE) Reporting & Analytics team is responsible for the data management, transformation, analysis, and visualization of insights in support of the third-party management program. This team produces reporting and analytics for various stakeholders including the Third-Party COE, AXP Business Units, Management Committees and Risk Subject Matter Experts.

Our Third-Party COE Reporting & Analytics team not only understands how process, technology and systems work, but how the information is used to generate valuable and actionable insights for our program stakeholders. So, if you’re interested in a career in analytics, machine learning and data strategy, creating breakthrough analytical products and making an impact on our internal customers and third parties, look no further.

In this role as Data Analyst, the successful candidate will be responsible for understanding analytical requirements, data transformation, applying statistical tools and ML applications and data visualization for the Third-Party COE. The candidate will drive success of the analytical reports by working closely with program stakeholders, maintaining a strong project management framework, developing transformation logic, and providing value-added reporting.

 Responsibilities:


Drive Analytical capabilities in support of Global Supply Management and American Express Business Units

Analyze the existing environment and derive opportunities, recommend alternative solutions to technical problems.

Deliver high quality and accurate results in a timely manner.

Enhancing data collection procedures to include information that is relevant for building analytic models and systems.

Processing, cleansing, and verifying the integrity of data used for analysis.

Propose and implement solutions to ad-hoc business problems, working independently to leverage data, drive insights, and presenting results in a clear and concise manner.

Predictive Analysis and visualization

Data mining using state-of-the-art methods.

Creating automated anomaly detection systems and constant tracking of its performance

Meticulous attention to details while preserving the goal and timeframe of end products

Translate requirements into concepts and user experience design – associate with stakeholders/ business partners to enhance design suggestions.

Drive Data strategy initiatives

Minimum Qualifications:


2+ years of experience in Analytics.

Bachelor’s or master’s degree relevant to the industry (other credentials will be a plus)

Strong analytical bend and experience on analytics tools in Excel, Tableau, SQL, Alteryx etc.

Proficiency in dealing with large quantities of complex data and ability to derive actionable insights.

Strong communication and relationship building skills.

Prior project management experience, with proven ability to create powerful analytics and reporting is a must.

Proven strong performance behavior in previous role.

Excellent Visual Design skills with sensitivity to user-system interaction – experience in developing reporting solutions towards complex multi-paneled, interactive dashboards.


Preferred Qualifications:

Third-party risk reporting knowledge would be preferred.

Ability to communicate complex ideas in a simple manner to a global audience.

Independent and self-motivated, capable of executing under uncertainty with multiple priorities, in a fast-paced environment.

Salary Range: $70,000.00 to $135,000.00 annually + bonus + benefits
The above represents the expected salary range for this job requisition. Ultimately, in determining your pay, we’ll consider your location, experience, and other job-related factors.
We back our colleagues and their loved ones with benefits and programs that support their holistic well-being. That means we prioritize their physical, financial, and mental health through each stage of life. Benefits include:

Competitive base salaries
Bonus incentives
6% Company Match on retirement savings plan
Free financial coaching and financial well-being support
Comprehensive medical, dental, vision, life insurance, and disability benefits
Flexible working model with hybrid, onsite or virtual arrangements depending on role and business need
20+ weeks paid parental leave for all parents, regardless of gender, offered for pregnancy, adoption or surrogacy
Free access to global on-site wellness centers staffed with nurses and doctors (depending on location)
Free and confidential counseling support through our Healthy Minds program
Career development and training opportunities

For a full list of Team Amex benefits, visit our Colleague Benefits Site.
American Express is an equal opportunity employer and makes employment decisions without regard to race, color, religion, sex, sexual orientation, gender identity, national origin, veteran status, disability status, age, or any other status protected by law.
We back our colleagues with the support they need to thrive, professionally and personally. That's why we have Amex Flex, our enterprise working model that provides greater flexibility to colleagues while ensuring we preserve the important aspects of our unique in-person culture. Depending on role and business needs, colleagues will either work onsite, in a hybrid model (combination of in-office and virtual days) or fully virtually.
US Job Seekers/Employees - Click here to view the “Know Your Rights” poster and the Pay Transparency Policy Statement.
If the links do not work, please copy and paste the following URLs in a new browser window: https://www.dol.gov/agencies/ofccp/posters to access the three posters.
Employment eligibility to work with American Express in the U.S. is required as the company will not pursue visa sponsorship for this position.
&nbsp;",
