Job Title,Company,Location,Salary,Description,Link
Business Data Analyst,Providence,"4400 NE Halsey Street, Portland, OR 97213",$32.59 - $55.34 an hour -  Full-time,"Profile insightsFind out how your skills align with the job descriptionSkillsDo you have experience in Tableau?YesNoEducationDo you have a Bachelor's degree?YesNo&nbsp;Job detailsHere’s how the job details align with your profile.Pay$32.59 - $55.34 an hourJob typeFull-timeShift and scheduleDay shift&nbsp;Location4400 NE Halsey Street, Portland, OR 97213&nbsp;BenefitsPulled from the full job description401(k) matchingDental insuranceDisability insuranceHealth insuranceLife insuranceOpportunities for advancementPaid holidaysShow morechevron down&nbsp;Full job description
Description
Providence caregivers are not simply valued – they’re invaluable. Join our team and thrive in our culture of patient-focused, whole-person care built on understanding, commitment, and mutual respect. Your voice matters here, because we know that to inspire and retain the best people, we must empower them.
Providence is calling a Business Data Analyst who will:

Compile information from external data sources and correlate it with data available from within Providence St Joseph Health
Work extensively and efficiently with large relational databases, external data extracts and competitor intelligence data
Research identified issues, both internally and externally, using business intelligence and visualization tools
Possess a unique blend of business and technical savvy, a big-picture vision and the drive to make that vision a reality
Be intellectually curious
Work on complex assignments
Be open minded to new and unusual ideas
Work well within a small team environment
Performs all duties in a manner which promotes teamwork and reflects the mission and philosophy of Providence St Joseph Health

Providence welcomes 100% remote work for residents who reside in the following States:

Alaska
Washington
Oregon
Montana
California
Texas

Required qualifications for this position include:

Bachelor's Degree in Business Administration, Finance, Economics, Information Management or another related field of study -OR- a combination of equivalent education and work experience
3+ years of experience working with relational databases and reporting/business intelligence tools
3+ years of experience gathering, analyzing and reporting data for a wide range of internal customers in various organizational areas
3+ years of experience working with complex data structures; including independent mining and data exploration and utilizing business intelligence and data visualization software (E.G. Tableau, SAP, Business Objects/Crystal Reports, Oracle)

Preferred qualifications for this position include:

1+ years of Health care system or health insurance industry experience
1+ years of Experience with Tableau and data management/ETL software

Salary Range by Location:

AK: Anchorage: Min: $34.96, Max: $55.34
AK: Kodiak, Seward, Valdez: Min: $36.44, Max: $57.69
California: Humboldt: Min: $36.44, Max: $57.69
California: All Northern California - Except Humboldt: Min: $40.89, Max: $64.72
California: All Southern California - Except Bakersfield: Min: $36.44, Max: $57.69
California: Bakersfield: Min: $34.96, Max: $55.34
Montana: Except Great Falls :Min: $28.15, Max: $44.56
Montana: Great Falls: Min: $26.67, Max: $42.21
Oregon: Non-Portland Service Area: Min: $32.59, Max: $51.59
Oregon: Portland Service Area: Min: $34.96, Max: $55.34
Texas - Levelland, Plainview, Lubbock: Min: $26.67, Max: $42.21
Washington: Western - Except Tukwila: Min: $36.44, Max: $57.69
Washington: Southwest - Olympia, Centralia & Below: Min: $34.96, Max: $55.34
Washington: Tukwila: Min: $36.44, Max: $57.69
Washington: Eastern: Min: $31.11, Max: $49.25
Washington: Southeastern: Min: $32.59, Max: $51.59

Why Join Providence?
Our best-in-class benefits are uniquely designed to support you and your family in staying well, growing professionally and achieving financial security. We take care of you, so you can focus on delivering our Mission of caring for everyone, especially the most vulnerable in our communities.
About Providence
At Providence, our strength lies in Our Promise of “Know me, care for me, ease my way.” Working at our family of organizations means that regardless of your role, we’ll walk alongside you in your career, supporting you so you can support others. We provide best-in-class benefits and we foster an inclusive workplace where diversity is valued, and everyone is essential, heard and respected. Together, our 120,000 caregivers (all employees) serve in over 50 hospitals, over 1,000 clinics and a full range of health and social services across Alaska, California, Montana, New Mexico, Oregon, Texas and Washington. As a comprehensive health care organization, we are serving more people, advancing best practices and continuing our more than 100-year tradition of serving the poor and vulnerable.
The amounts listed are the base pay range; additional compensation may be available for this role, such as shift differentials, standby/on-call, overtime, premiums, extra shift incentives, or bonus opportunities.
Providence offers a comprehensive benefits package including a retirement 401(k) Savings Plan with employer matching, health care benefits (medical, dental, vision), life insurance, disability insurance, time off benefits (paid parental leave, vacations, holidays, health issues), voluntary benefits, well-being resources and much more. Learn more at providence.jobs/benefits.
About the Team
Providence Shared Services is a service line within Providence that provides a variety of functional and system support services for our family of organizations across Alaska, California, Montana, New Mexico, Oregon, Texas and Washington. We are focused on supporting our Mission by delivering a robust foundation of services and sharing of specialized expertise.
Providence is proud to be an Equal Opportunity Employer. We are committed to the principle that every workforce member has the right to work in surroundings that are free from all forms of unlawful discrimination and harassment on the basis of race, color, gender, disability, veteran, military status, religion, age, creed, national origin, sexual identity or expression, sexual orientation, marital status, genetic information, or any other basis prohibited by local, state, or federal law. We believe diversity makes us stronger, so we are dedicated to shaping an inclusive workforce, learning from each other, and creating equal opportunities for advancement.
Requsition ID: 314300
Company: Providence Jobs
Job Category: Strategy & Planning
Job Function: Administration
Job Schedule: Full time
Job Shift: Day
Career Track: Business Professional
Department: 4010 SS PE CLINICAL OPS
Address: OR Portland 4400 NE Halsey St
Work Location: Providence Office Park Portland Bldg 1-Portland
Pay Range: $See Posting - $See Posting
The amounts listed are the base pay range; additional compensation may be available for this role, such as shift differentials, standby/on-call, overtime, premiums, extra shift incentives, or bonus opportunities.

&nbsp;",
Data Analyst III,Fairfax County Government,"12000 Government Center Parkway, Fairfax, VA 22035","$85,318.48 - $142,197.95 a year -  Full-time","Profile insightsFind out how your skills align with the job descriptionSkillsDo you have experience in XML?YesNoLanguagesDo you know Spanish?YesNo&nbsp;Job detailsHere’s how the job details align with your profile.Pay$85,318.48 - $142,197.95 a yearJob typeFull-time&nbsp;Location12000 Government Center Parkway, Fairfax, VA 22035&nbsp;Full job description




Salary






     $85,318.48 - $142,197.95 Annually
    





Location 





     FAIRFAX (EJ28), VA
    







Job Type




     FT Salary W BN
    





Job Number




     24-02205
    







Department




     Fire & Rescue
    





Opening Date




     09/14/2024
    







Closing Date




     9/27/2024 11:59 PM Eastern
    





Pay Grade




     S29
    







Posting Type




     Open to General Public
    



 



Job Announcement


The Data Analytics Strategy Management (DASM) Division of the Fairfax County Fire and Rescue Department (FRD) provides decision makers with accurate, up-to-date information across a wide variety of topics. As part of DASM, this position serves as the senior supervisory data analyst for the FRD, including responsibilities such as:

Manages the Data and Analytics Section and supervises a team of analysts and that provide analytical expertise to the organizations three bureaus and outside agencies.
Coordinates, plans, and develops FRD data analysis workloads and preparation functions, and oversees the performance of all statistical analysis performed in the organization.
Reports to the Data Analytics Strategy Manager in the field of data analytics and works with all bureaus in the agency in the development of business requirements and associated data and information needs, metrics and forecasting.
Collaborates with DIT Public Safety division, e-Government and GIS divisions to ensure data analytic solutions meet county standards.
Oversees and performs statistical analysis to identify patterns based on aggregate data to find risks or opportunities, as well as make performance change recommendations.
Assures timely response to requests for reports, data and information.
Supports and/or serves on special committees, commissions, panels and fulfills BOS, executive and other requests for analysis as assigned by the Data Analytics Strategy Manager.
Participates in requirements development for ensuring data elements and reporting alignment.
Stays abreast of data analytics trends, particularly in the fire and rescue arena.




Illustrative Duties


(The illustrative duties listed in this specification are representative of the class but are not an all-inclusive list. A complete list of position duties and unique physical requirements can be found in the position description.)

Mentors the work of lower-level data analysis, providing work counseling, guidance, and training as needed;
Develops data standards, analytic schemas, and complex data models to ensure complete, correct, accessible and shareable data for information technology development projects;
Gathers and documents business data, information, physical, and analytics requirements;
Develops logical business models;
Prepares physical database design and consolidation, standardization, cleansing, migration, or upload of data;
Assists with planning and facilitating user requirement sessions for data analysis, data standardization, and data ownership;
Analyzes business forms, reports, processes, practices, and procedures;
Designs reporting schemas and data models of moderate to advanced scope and complexity Identifies and documents data subject areas, data entities, attributes, relationships, information types, domains, and constraints;
Develops structured diagrams, including data flow, entity life cycle, hierarchy, entity/relationships, conceptual schemas, and association matrix diagrams;
Assesses disparate databases for streamlining, standardization, and consolidation opportunities, designing appropriate schemas to enable modernization or optimization;
Assists with identifying physical implementation requirements such as denormalization, data types, defaults, keys, transformations, referential integrity, and screen/script mapping;
Assists with coordinating the development of shared information assets including logical data standards, definition standards, domain, and type standards, and with the resolution of related conflicts;
Provides key input to the development of the corporate information architecture, policies, and methodologies;
Maintains metadata, schemas, data repositories, and data dictionaries;
Assists with the selection, implementation, guidance and training of data administration practices, data access and CASE tools;
Designs and runs database queries to assess or validate data;
Performs data cleansing and transformations to assess data quality;
Supports data testing and analysis for initiatives of high complexity;
Attends training workshops, product demonstrations, conferences, technical briefings, and conventions;
Serves on committees and task forces;
Undertakes special projects;
Stays abreast of technology changes;
Provides assistance to other staff, as needed.




Required Knowledge Skills and Abilities


(The knowledge, skills and abilities listed in this specification are representative of the class but are not an all-inclusive list.)

Considerable knowledge of information systems and the components that process data;
Considerable knowledge of the principles, practices, and methods related to information architecture;
Considerable knowledge of data administration areas such as policies and standards, data definition, modeling and logical design, database design, and quality control;
Considerable knowledge of data concepts such as syntax, taxonomy, and hierarchy;
Considerable knowledge of relational databases (such as Oracle or DB2) Knowledge of business intelligence solutions or data-related CASE and modeling tools;
Knowledge of data modeling mapping, cleansing, extraction, exchange, manipulation, and load principles;
Extensive knowledge of business process analysis and redesign;
Some knowledge of business intelligence and information system design principles;
Some knowledge of services-oriented architecture, object-oriented application development, data integration, data exchange protocols, or XML schema design;
Skill in brainstorming, presenting, sharing, discussing, and defending ideas;
Skill in problem-solving, with appreciation and respect for diversity of differing professional views;
Skill in leading meeting participants toward consensus;
Skill in designing and presenting conforming, efficient, and unambiguous models and diagrams of complex reporting and information systems;
Skill in applying work and ideas to advance enterprise architecture goals and objectives: Ability to establish and maintain effective business relationships;
Ability to help stakeholders effectively resolve issues related to cross-agency data sharing, usage conflicts, and data inconsistencies;
Ability to follow special formatting requirements and conventions in work products;
Ability to establish and maintain appropriate version control over work products; Ability to communicate effectively, both orally and in writing;
Ability to make use of provided resources and seek guidance as needed;
Ability to analyze and evaluate administrative processes and procedures for data analysis purposes;
Ability to conduct research into new information technology;
Ability to prepare essential task deliverable and documentation;
Ability to translate technical terminology into simple language and concepts;
Ability to train employees in the use of data access tools.




Employment Standards


MINIMUM QUALIFICATIONS: Any combination of education, experience, and training equivalent to the following: (Click on the aforementioned link to learn how Fairfax County interprets equivalencies for “Any combination, experience, and training equivalent to”) Graduation from an accredited four-year college or university with a degree in Information Technology, Information Systems, Computer Science, Business Administration, or related field and coursework in analytics, biosystematics, biology, information architecture, engineering, library science, statistics, sociology, demographics, and/or marketing, Plus five years analysis of data and information experience in an academic, data administration, or business data analytics environment that involves using data modeling, database consolidation, ad hoc query, or business intelligence tools, relational databases, metadata, XML schema design, and/or taxonomy.  PREFERRED QUALIFICATIONS:

Experience conducting descriptive and inferential statistical analysis
Experience conducting data wrangling, data analysis, or advanced analytical reporting
Experience scripting queries and designing objects using relational database software such as Microsoft SQL Server Management Studio or Oracle
Experience designing reports with business intelligence software such as Power BI or Tableau
Experience analyzing geospatial data, or developing geospatial software products and solutions
Experience working within an enterprise GIS portal, such as ArcGIS Enterprise
Experience leading technical teams, either as a team lead or direct supervisor
  CERTIFICATES AND LICENSES REQUIRED: None.  NECESSARY SPECIAL REQUIREMENTS: The appointee to this position will be required to complete a criminal background check and sanctions screening to the satisfaction of the employer.   PHYSICAL REQUIREMENTS: Ability to input, access, and retrieve information from a computer. All duties may be performed with or without reasonable accommodations.   SELECTION PROCEDURE: Panel interview; may include exercise.  The population of Fairfax County is very diverse where 38.7% of residents speak a language other than English at home (Spanish, Asian/Pacific Islander, Indo-European, and others) and we encourage candidates bilingual in English and a foreign language to apply to this opportunity.  Fairfax County Government prohibits discrimination on the basis of race, color, religion, national origin, sex, pregnancy, childbirth or related medical conditions, age, marital status, disability, sexual orientation, gender identity, genetics, political affiliation, or military status in the recruitment, selection, and hiring of its workforce.  Reasonable accommodations are available to persons with disabilities during application and/or interview processes per the Americans with Disabilities Act. Contact 703-324-4900 for assistance. TTY 703-222-7314. DHREmployment@fairfaxcounty.gov. EEO/AA/TTY.  #LI-SP1
  


&nbsp;",
