Job Title,Company,Location,Salary,Description,Link
Machine Learning Scientist,Qarik,Not Available,Not Available,"Profile insightsFind out how your skills align with the job descriptionSkillsDo you have experience in TensorFlow?YesNoEducationDo you have a Master's degree?YesNo&nbsp;LocationRemote&nbsp;Full job description

  About Qarik
 


 Co-founded by Google Cloud Engineering leaders, Qarik is an IT Solutions company focusing on Google Cloud Platform. We’ve grown to 100 employees in less than three years and continue to attract brand-name (F1000) clients. We are an engineer-driven company where your talent is truly appreciated and maximized. Unlike the traditional model, where consultants can remain long beyond project completion, we enter our engagements with the end in mind. Core to our ethos is the ability to solve complex problems and teach clients to do the same.
 


 About the Role
 

  In this role, you'll join our growing team focused on building Generative AI applications for document summarization, classification, and question-and-answer using unstructured and structured data. This team works with companies of all sizes, from startups to Fortune 100 companies, that are leaders in their fields and pushing the limits of possible.
 


 You will develop applications on Google Cloud, work with customers to understand their requirements, suggest new ideas and features to the team, improve the product further, and implement the new functionalities with a passion for quality. You will implement best practices and state-of-the-art techniques for AI and LLMs and work on research, experimentation, and implementation of novel methods.
 
Responsibilities

Required hands-on experience designing and implementing applications using Large Language Models (LLM). More specifically:
Python programming.
Google VertexAI, Tensorflow or PyTorch, AutoML
Classic Machine Learning (ML frameworks, neural net models development, training, tuning, serving).

 Ideal candidate will also have experience in one or more of the following:

Bachelor’s or Master’s degree in Computer Science, Engineering, or related field
Shell scripting
MLOps (ideally on GCP)
Data Engineering (including SQL)

 Personal Attributes

Strong ethics
Strong technical aptitude
Engineering mindset/developer background
Strong sense of ownership and teamwork
Curious, always learning to get better
Enjoys working with clients
Excellent communication skills

 Desired Locations

Pittsburgh, Detroit, New York, or Chicago, but open to any location (including outside of the US) as long as you are willing to overlap US East Coast morning.


  Qarik offers a competitive and comprehensive employee compensation and benefits package.
 


 Qarik is an Equal Opportunity employer. All qualified applicants will receive consideration for employment without regard to race, color, religion, sex, sexual orientation, gender identity and expression, national origin, disability, or protected veteran status. For further information, please contact our careers@qarik.com.
 


 Why Qarik?
 


 Qarik offers a competitive employee compensation and outstanding benefits package.
The job is fully remote with work hours and vacation flexibility for work/life balance.
You will work on a team where people respect each other, have a shared goal of customer success, and work together instead of competing against each other or counting the lines of code or number of PRs to meet personal annual OKRs. Most of your teammates think this is the best team they have ever worked on so far in their careers.
We are using the latest AI tech and pushing the boundaries possible, constantly learning new stuff and creating new cool things together.



 Qarik is an Equal Opportunity employer. All qualified applicants will receive consideration for employment without regard to race, color, religion, sex, sexual orientation, gender identity and expression, national origin, disability, or protected veteran status. For further information, please contact our careers@qarik.com.
 
&nbsp;",https://www.indeed.com/rc/clk?jk=d2640dfafc5cb7d7&bb=Ng-KGOCd4jYPo5oEXtaNwo74UALY1RS3KI8N8V6yVeuXMY2iq9yuMTjXevIRNHHND-fo_WZqq6v-AEEkve3IMRa_PmIa6OD-YGjQvh9h9Fe8pwYIp-JjTZ3WzL2SXTZx&xkcb=SoC567M36z0x4JyxX50BbzkdCdPP&fccid=39065903b0f3cf32&vjs=3
Researcher Graduate (Applied Machine Learning - Enterprise) -2025 Start (BS/MS),ByteDance,"San Jose, CA","$144,000 - $250,000 a year","Profile insightsFind out how your skills align with the job descriptionSkillsDo you have experience in Python?YesNoEducationDo you have a Master's degree?YesNo&nbsp;Job detailsHere’s how the job details align with your profile.Pay$144,000 - $250,000 a year&nbsp;BenefitsPulled from the full job description401(k) matchingAD&D insuranceDental insuranceDisability insuranceEmployee assistance programFlexible spending accountHealth insuranceShow morechevron down&nbsp;Full job descriptionResponsibilities Founded in 2012, ByteDance's mission is to inspire creativity and enrich life. With a suite of more than a dozen products, including TikTok, Helo, and Resso, as well as platforms specific to the China market, including Toutiao, Douyin, and Xigua, ByteDance has made it easier and more fun for people to connect with, consume, and create content.  Why Join Us Creation is the core of ByteDance's purpose. Our products are built to help imaginations thrive. This is doubly true of the teams that make our innovations possible. Together, we inspire creativity and enrich life - a mission we aim towards achieving every day. To us, every challenge, no matter how ambiguous, is an opportunity; to learn, to innovate, and to grow as one team. Status quo? Never. Courage? Always. At ByteDance, we create together and grow together. That's how we drive impact - for ourselves, our company, and the users we serve. Join us.  About the Team: The Applied Machine Learning Enterprise team combines system engineering and machine learning to develop and operate big model service platform that offers businesses Model-as-a-Service solutions (MaaS) to both the big model vendors and users. We are actively seeking talented Researchers specializing in Large Language Models (LLM) to join our team.  We are looking for talented individuals to join our team in 2025. As a graduate, you will get unparalleled opportunities for you to kickstart your career, pursue bold ideas and explore limitless growth opportunities. Co-create a future driven by your inspiration with ByteDance Successful candidates must be able to commit to one of the following start dates below: 1. January 15, 2025 2. February 5, 2025 3. March 4, 2025 4. May 20, 2025 5. June 17, 2025 6. July 15, 2025 7. August 12, 2025 8.September 3, 2025  We will prioritize candidates who are able to commit to these start dates. Please state your availability and graduation date clearly in your resume.  Applications will be reviewed on a rolling basis. We encourage you to apply early.  Candidates can apply for a maximum of TWO positions and will be considered for jobs in the order you applied for. The application limit is applicable to ByteDance and its affiliates' jobs globally.  Responsibilities: In this role, you will be at the forefront of cutting-edge research and development of advanced techniques for MaaS solutions including model continuous pretraining, fine-tuning, evaluation, inference capabilities and also LLM application/agent development. Your primary responsibility will be to: 

Lead the creation of next-generation, high-capacity LLM platforms and innovative products.
Work closely with cross-functional teams to plan and implement projects harnessing LLMs for diverse purposes and vertical domains.
Maintain a deep passion for contributing to the success of large models is essential in this innovative and fast-paced team environment.
 Qualifications  Minimum Qualifications:

Master in Computer Science, Artificial Intelligence, or a related field.
Have prior experience working with training and inference of large language models.
Strong understanding of cutting-edge LLM research (e.g., long context, multi modality, alignment research etc.) and possess practical expertise in effectively implementing these advanced systems.
Proficiency in programming languages such as Python or C++ and a track record of working with deep learning frameworks (e.g., pytorch, deepspeed, etc.).
Strong understanding of distributed computing framework & performance tuning and verification for training/finetuning/inference. Being familiar with PEFT or MoE is a plus.
 Preferred Qualifications:

Excellent problem-solving skills and a creative mindset to address complex AI challenges. Demonstrated ability to drive research projects from idea to implementation, producing tangible outcomes.
Published research papers or contributions to the LLM community would be a significant plus.
Experience with inference tuning and Inference acceleration. Have a deep understanding of GPU and/or other AI accelerators, experience with large scale AI networks, pytorch 2.0 and similar technologies.
Experience with large scale machine learning systems' scheduling and orchestration, familiar with Kubernetes and Cloud Native technologies.
Experience with deploying AI models into production environments, testing and evaluation of AI systems, LLM application & agent development is desirable.
 ByteDance is committed to creating an inclusive space where employees are valued for their skills, experiences, and unique perspectives. Our platform connects people from across the globe and so does our workplace. At ByteDance , our mission is to inspire creativity and bring joy. To achieve that goal, we are committed to celebrating our diverse voices and to creating an environment that reflects the many communities we reach. We are passionate about this and hope you are too.  ByteDance Inc. is committed to providing reasonable accommodations in our recruitment processes for candidates with disabilities, pregnancy, sincerely held religious beliefs or other reasons protected by applicable laws. If you need assistance or a reasonable accommodation, please request via Request Form link.  By submitting an application for this role, you accept and agree to our global applicant privacy policy, which may be accessed here: https://jobs.bytedance.com/en/legal/privacy. Job Information 【For Pay Transparency】Compensation Description (annually)  The base salary range for this position in the selected city is $144000 - $250000 annually.  Compensation may vary outside of this range depending on a number of factors, including a candidate’s qualifications, skills, competencies and experience, and location. Base pay is one part of the Total Package that is provided to compensate and recognize employees for their work, and this role may be eligible for additional discretionary bonuses/incentives, and restricted stock units.  Our company benefits are designed to convey company culture and values, to create an efficient and inspiring work environment, and to support our employees to give their best in both work and life. We offer the following benefits to eligible employees:  We cover 100% premium coverage for employee medical insurance, approximately 75% premium coverage for dependents and offer a Health Savings Account(HSA) with a company match. As well as Dental, Vision, Short/Long term Disability, Basic Life, Voluntary Life and AD&D insurance plans. In addition to Flexible Spending Account(FSA) Options like Health Care, Limited Purpose and Dependent Care.  Our time off and leave plans are: 10 paid holidays per year plus 17 days of Paid Personal Time Off (PPTO) (prorated upon hire and increased by tenure) and 10 paid sick days per year as well as 12 weeks of paid Parental leave and 8 weeks of paid Supplemental Disability.  We also provide generous benefits like mental and emotional health benefits through our EAP and Lyra. A 401K company match, gym and cellphone service reimbursements. The Company reserves the right to modify or change these benefits programs at any time, with or without notice.  For Los Angeles County (unincorporated) Candidates: Qualified applicants with arrest or conviction records will be considered for employment in accordance with all federal, state, and local laws including the Los Angeles County Fair Chance Ordinance for Employers and the California Fair Chance Act. Our company believes that criminal history may have a direct, adverse and negative relationship on the following job duties, potentially resulting in the withdrawal of the conditional offer of employment:  1. Interacting and occasionally having unsupervised contact with internal/external clients and/or colleagues;  2. Appropriately handling and managing confidential information including proprietary and trade secret information and access to information technology systems; and  3. Exercising sound judgment.&nbsp;",https://www.indeed.com/rc/clk?jk=ba8a5a9d0a9a2201&bb=Ng-KGOCd4jYPo5oEXtaNwvVCkWS5ZqEowpl05ccTPVQKHhrwWEOTAPL5RaZGo6kR2n593E_hY_DE8RVkANOCHYG9V5HHVsUFSvnGuSAksvl-cLz5eBCVt2h5t1bkkQys&xkcb=SoAN67M36z0x4JyxX50AbzkdCdPP&fccid=74fbc768a4e5bece&vjs=3
Machine Learning Researcher,Cognition,United States,Full-time,"Profile insightsFind out how your skills align with the job descriptionSkillsDo you have experience in Machine learning?YesNo&nbsp;Job detailsHere’s how the job details align with your profile.Job typeFull-time&nbsp;LocationUnited States&nbsp;Full job description
We are an applied AI lab building end-to-end software agents. 
We’re building collaborative AI teammates that enable engineers to focus on more interesting problems and empower engineering teams to strive for more ambitious goals.  Our team is small and talent-dense. Among our founding team, we have world-class competitive programmers, former founders, and leaders from companies at the cutting edge of AI including Cursor, Scale AI, Lunchclub, Modal, Google DeepMind, Waymo, and Nuro.  Building Devin is just the first step—our hardest challenges still lie ahead. If you’re excited to solve some of the world’s biggest problems and build AI that can reason, apply to join us.
&nbsp;",https://www.indeed.com/rc/clk?jk=5162c3965aa77dc0&bb=Ng-KGOCd4jYPo5oEXtaNwk8LqXs46BHvsy2E5Q-M3ceKGhxwm0Zuhv64xvTOZnw9yXEFfNPMcN9pE0IVMLGoRs4UoO3UCgeGcaXhlzRw9vpxUxTJUxwwUiDL6KxuC8Se&xkcb=SoCD67M36z0x4JyxX50HbzkdCdPP&fccid=f1675e8554a623ae&vjs=3
"Staff Engineer, Machine Learning (AI)",Lenovo,"Chicago, IL",Full-time,"Profile insightsFind out how your skills align with the job descriptionSkillsDo you have experience in iOS?YesNoEducationDo you have a Master's degree?YesNo&nbsp;Job detailsHere’s how the job details align with your profile.Job typeFull-time&nbsp;LocationChicago, IL&nbsp;Full job description



General Information 






      Req #
     

      WD00073965
     



      Career area:
     

      Hardware Engineering
     



      Country/Region:
     

      United States of America
     



      State:
     

      Illinois
     



      City:
     

      Chicago
     



      Date:
     

      Monday, October 28, 2024
     



      Working time:
     

      Full-time
     



Additional Locations: 
      
United States of America - Illinois - Chicago









Why Work at Lenovo 








        We are Lenovo. We do what we say. We own what we do. We WOW our customers.
       


 Lenovo is a US$57 billion revenue global technology powerhouse, ranked #248 in the Fortune Global 500, and serving millions of customers every day in 180 markets. Focused on a bold vision to deliver Smarter Technology for All, Lenovo has built on its success as the world’s largest PC company with a full-stack portfolio of AI-enabled, AI-ready, and AI-optimized devices (PCs, workstations, smartphones, tablets), infrastructure (server, storage, edge, high performance computing and software defined infrastructure), software, solutions, and services. Lenovo’s continued investment in world-changing innovation is building a more equitable, trustworthy, and smarter future for everyone, everywhere. Lenovo is listed on the Hong Kong stock exchange under Lenovo Group Limited (HKSE: 992) (ADR: LNVGY).
       



       This transformation together with Lenovo’s world-changing innovation is building a more inclusive, trustworthy, and smarter future for everyone, everywhere. To find out more visit www.lenovo.com, and read about the latest news via our StoryHub.
      








Description and Requirements 






Motorola Mobility, a Lenovo Company, is one of the world’s fastest growing smartphone providers, creating groundbreaking, affordable, high quality products designed and built with the global customer in mind. And it’s our people who make this all happen. We are thinkers, risk-takers and problem solvers, working together to constantly challenge the status quo. If you share our commitment to ingenuity, creativity and innovation, we want you to help us define our world of tomorrow. Explore the opportunities and apply today.
 Role & Team Description:
We have a software engineering role focused on artificial intelligence within our AI Core Technologies team. We are responsible for delivering complete software stacks for a variety of production and concept AI services. Our team is passionate about delivering industry-leading mobile innovation, and this is an exciting opportunity to join our AI team in the heart of downtown Chicago!
Scope of Responsibilities:
As a member of the AI Core Technologies team, your role will include designing and developing new mobile experiences that leverage artificial intelligence and machine learning. You will be asked to:

Cultivate a strong engineering culture at Motorola as it pertains to our software experiences and performance within the Android mobile ecosystem
Develop and expand our AI Core software to support new experiences and platforms.
Drive improvement of technologies enhancing quality, performance, and efficiency
Collaborate with external teams to ensure effective and timely development and integration of new functionality and end-to-end experiences
Stay up to date with the latest advancements in AI/ML and related technologies

 Basic Qualifications:

BS/MS degree in CS, EE, or a related engineering discipline
2+ years of experience in related field
Experience in mobile development (Android/iOS) and cloud services (AWS, GCP, Azure)
Experience with Python, Linux OS, C, C++, Java, Kotlin, and backend frameworks

 Preferred Qualifications:

Knowledge of AI/ML techniques and frameworks including custom model development and training
Familiarity with wireless protocols (e.g. broadband cellular, WiFi, Bluetooth, NFC, USB, etc..) and motion sensors
Excellent problem solving and analytical skills
Strong communication and collaboration skills
Agile development background as well as experience with Android Studio, Git, Gerrit, and Jira
Experience implementing various design patterns with strong algorithmic, data structure, and object oriented programming skills






We are an Equal Opportunity Employer and do not discriminate against any employee or applicant for employment because of race, color, sex, age, religion, sexual orientation, gender identity, national origin, status as a veteran, and basis of disability or any federal, state, or local protected class.












Additional Locations: 
      
United States of America - Illinois - Chicago





United States of America




United States of America - Illinois




United States of America - Illinois - Chicago





&nbsp;",https://www.indeed.com/rc/clk?jk=79ab343c0590b6f4&bb=Ng-KGOCd4jYPo5oEXtaNwgHg_N7yJJdZxKOhVbvAIFqFv_hetGkocUvWiPm5A_wNQvtbEw5pRiOj7cXowH-DROhLvqAtKCuR4xDhaRYVZ_t_KBoZHphInQ%3D%3D&xkcb=SoA367M36z0x4JyxX50GbzkdCdPP&fccid=af103eaff391cdf0&vjs=3
