Job Title,Company,Location,Salary,Description,Link
Philosophy Tutor - AI Trainer,DataAnnotation,"Greeley, CO","From $40 an hour -  Part-time, Full-time","Profile insightsFind out how your skills align with the job descriptionSkillsDo you have experience in AI?YesNoEducationDo you have a Master's degree?YesNoLanguagesDo you know English?YesNo&nbsp;Job detailsHere’s how the job details align with your profile.PayFrom $40 an hourJob typeFull-timePart-time&nbsp;LocationGreeley, CO&nbsp;Full job descriptionWe are looking for a philosophy tutor to join our team to train AI models. You will measure the progress of these AI chatbots, evaluate their logic, and solve problems to improve the quality of each model.
In this role you will need to hold an expert understanding of philosophy science - a completed or in progress Masters/PhD/JD is preferred but not required. Other related fields include, but are not limited to: Ethics, Metaphysics, Epistemology, Logic.
Benefits:

This is a full-time or part-time REMOTE position
You’ll be able to choose which projects you want to work on
You can work on your own schedule
Projects are paid hourly starting at $40+ USD per hour, with bonuses on high-quality and high-volume work

Responsibilities:

Give AI chatbots diverse and complex problems and evaluate their outputs
Evaluate the quality produced by AI models for correctness and performance

Qualifications:

A current, in progress, or completed Masters and/or PhD/JD is preferred but not required
Fluency in English (native or bilingual level)
Detail-oriented
Proficient in logic, analytical reasoning, strategic thinking, persuasive reasoning, critical thinking, ethical reasoning.

Note: Payment is made via PayPal. We will never ask for any money from you.
Job Types: Full-time, Part-time
Pay: From $40.00 per hour
Expected hours: 1 – 40 per week
Work Location: Remote&nbsp;",https://www.indeed.com/pagead/clk?mo=r&ad=-6NYlbfkN0CnM4TERr6XuVBW3VTRACvDXDx9S3Pbn6a0SwhkmoLTiByC3ECiiXeNdPx_GnHEIswJcmhVwxyd-FS_5A_qgHb1aoPbmJZsafnDKt7ThJHFwTYiLxEwikx86p6n2RXHukrLp7JxXYiWB3UC051ZnpWbwNv-D4laKu71p-5zBwitdTPTBT3uMB53PgTOzT6IVliWzf7-0_gTUhStIrGzbPYp65asbQDB4WJfCoJIz-IrB60sPbREZ0C0vqIs9znTkcYhpEq8FqN0Lclo6daIVaAsUCqRg6U6KSPawO17wKg7BIGePUKJJT4okGe_pHO2jy0ml_fEG3ZCoWSCb1F3jLd40kS-1IPGePDsxLOCAVErEaqdMpO3AqPC3lZftgmaWzGvg1yeRZbyebrrWLZ359Ux5_q_tmB4ejKzQg2hlurQJgVPGGwMrArM3hrb957oZtxgVWwh9us8BknzYNrPN8qECeQvDxGngy8P_k-aQ01vaHXZjMOgozmymRX4wbLGuXpv1ins97gwXog6fVo_5GN0sf7A7OVbOISwm27m5wSAowctMmg2N25CefGcC_cypWYd087QukFnxxWSSUfafCeL4ac2hA-SaMpsK8Q5WTW_oSwh_JzCetxOMNiVu9nBsws1AB7tDqWpNJqngU4XJQMQZ9F4LkCDaiJPvCvXJu06XiDaa8iaL-1IHAgZ_8B1p1XRU5Ut8rxLFk2z7gWoKwVTC9MY0XPjuJB2P_pzt-nteoE-jQ_hGvjx4_k_F7ATsc88Lwb2xhla5c4XP37r7JOTI_7MzmJWExT75st7hJssnmjjjA7BYQ1eDUsuHXVf6k5sUNIxAHEihhpFuXK7wwDO&xkcb=SoBD6_M360ETOvyQbB0LbzkdCdPP&camk=nUmJqO2E8rhFhcUUaYVdUg==&p=0&fvj=1&vjs=3
AI Content Writer,DataAnnotation,"Houston, TX",$20 - $25 an hour -  Contract,"Profile insightsFind out how your skills align with the job descriptionSkillsDo you have experience in Writing skills?YesNoEducationDo you have a Bachelor's degree?YesNoLanguagesDo you know English?YesNo&nbsp;Job detailsHere’s how the job details align with your profile.Pay$20 - $25 an hourJob typeContract&nbsp;Full job descriptionDataAnnotation is committed to creating quality AI. Join our team to help train AI chatbots while gaining the flexibility of remote work and choosing your own schedule.
We are looking for a professional content writer and copy editor to join our team and teach AI chatbots. You will have conversations with chatbots in order to measure their progress, as well as write novel conversations in order to teach them what to say.
As part of the application process, you will be asked to complete an assessment. If you pass, you will gain access to projects. Based on the quality of your work, you will continue to receive projects regularly. We find our most successful candidates work between 5-20 hours per week, up to 40 hours.
Benefits:

This is a full-time or part-time REMOTE position
You’ll be able to choose which projects you want to work on
You can work on your own schedule
Projects are paid hourly, with bonuses for high-quality and high-volume work

Responsibilities:

Come up with diverse conversations over a range of topics
Write high-quality answers when given specific prompts
Compare the performance of different AI models
Research and fact-check AI responses

Qualifications:

Fluent in English
A bachelor's degree (completed or in progress)
Excellent writing and grammar skills
Strong research and fact-checking skills to ensure accuracy and originality
Previous experience as a Freelance Writer, Content Writer, Editor, Copywriter, Copy Editor, or those with experience in journalism and/or media is preferred but not required

Note: Payment is made via PayPal. We will never ask for any money from you. PayPal will handle any currency conversions from USD. This job is only available to those in the US, UK, Canada, Australia, or New Zealand. Those located outside of these countries will not see work or assessments available on our site at this time.
Job Type: Contract
Pay: $20.00 - $25.00 per hour
Location:

Houston, TX (Required)

Work Location: Remote&nbsp;",https://www.indeed.com/pagead/clk?mo=r&ad=-6NYlbfkN0CnM4TERr6XuVBW3VTRACvDXDx9S3Pbn6a0SwhkmoLTiNuchFC0m8cWri1e9jExW810b_9VZCDHeqchW_j2iNDqDTJfQyoN4jE9D2bokp8jeKqNzIDpTZaj0caTVVG-1Az-98CHwqjET4C-lZu9Y8lAJu3OAaZtJUPZD5_GPPXUEpAHLcrkF5dR27iykOY1hHi4Z1nnR2X33q0EoxPHrh9CQ5fQNtLpbEK82iHfp-eHIQsl1sW1R8uWs8r5bBKpLrYTHvgZ92v5lxguWLedjWTaw5K6OR2lrgyOihQUmBO8uhPsQWoWE_GT0mRL_WFvBCovV-PFGbomFjKSCgGW6vPeXx11iOM6botLCED7voUXs6czkE19js_kNgCD7S-7ITzcM6UDw7JYpTyhuOO1xxiWkJ-0JH8kXkgw8RQQXnqJPZxgrFHw0Z63w7t3hugssoUA0_5pCh5yLJDJ7ilhiknM_Naeh-cE9SsbxRG7643r4bqeDBXZzf6u2rpheCjGLfNrljDHEdwSNyCaRvIP9WhMNBv0nET76JmQDc-YunPcV5yVq27QWqwLok22MkxMArojRKkRHxWYzh_jgXrcqKvrMXBa03koShiPRdjIsHAu2Xdh8pJj3DmWAt0cDOUku5IEcejFO6ZuJNyqx4o65C9E09sCITD9Kl_Tf6lgQ6yQ4GAoUiTLlgBsESWOOg3NvjmfNKE9ZofF3rfBteHosS0BVDjPHxD9yTCVoZ0RMzM9LSfP6HFGMRVWO5JeFlR-rlqxbjMXs0ErbTdSDHU8-7-FJfb4DPwbKFxVvX-8bfrRRgrnXslCd7_qGebxUOAle6U4H07xGQQ0wkGDl7tfKXQ14XVADfT8wQsIPKlCNrVV7A==&xkcb=SoD36_M360ETOvyQbB0KbzkdCdPP&camk=4HOcmqOLYrDTKK9_dkim2w==&p=1&fvj=1&vjs=3
Data Scientist - AI Trainer,DataAnnotation,"Amarillo, TX",From $40 an hour -  Contract,"Profile insightsFind out how your skills align with the job descriptionSkillsDo you have experience in Writing skills?YesNoEducationDo you have a Bachelor's degree?YesNoLanguagesDo you know English?YesNo&nbsp;Job detailsHere’s how the job details align with your profile.PayFrom $40 an hourJob typeContractShift and scheduleChoose your own hours&nbsp;LocationAmarillo, TX&nbsp;BenefitsPulled from the full job descriptionFlexible schedule&nbsp;Full job descriptionWe are looking for proficient programmers to join our team to train our AI chatbots to code. You will work with the chatbots that we are building in order to measure their progress, as well as write and evaluate code.
To apply to this role, you will need to be proficient in either Python and/or JavaScript. Your role will require proficiency in at least one programming language (JavaScript, Python, C#, C++, HTML, SQL, or Swift) in order to solve coding problems (think LeetCode, HackerRank, etc). For each coding problem, you must be able to explain how your solution solves the problem.
As part of the application process, you will be asked to complete an assessment. If you pass, you will gain access to projects. Based on the quality of your work, you will continue to receive projects regularly. We find our most successful candidates work between 5-20 hours per week, up to 40 hours.
Benefits:

This is a full-time or part-time REMOTE position
You’ll be able to choose which projects you want to work on
You can work on your own schedule
Projects are paid hourly, with bonuses on high-quality and high-volume work

Responsibilities:

Come up with diverse problems and solutions for a coding chatbot
Write high-quality answers and code snippets
Evaluate code quality produced by AI models for correctness and performance

Qualifications:

Fluency in English
Proficient in either Python and/or JavaScript
Detail-oriented
Excellent writing and grammar skills
A bachelor's degree (completed or in progress)

Note: Payment is made via PayPal. We will never ask for any money from you. PayPal will handle any currency conversions from USD. This job is only available to those in the US, UK, Canada, Australia, or New Zealand. Those located outside of these countries will not see work or assessments available on our site at this time.
Job Type: Contract
Pay: From $40.00 per hour
Benefits:

Flexible schedule

Compensation Package:

Bonus opportunities

Schedule:

Choose your own hours

Work Location: Remote&nbsp;",https://www.indeed.com/pagead/clk?mo=r&ad=-6NYlbfkN0CnM4TERr6XuVBW3VTRACvDXDx9S3Pbn6a0SwhkmoLTiByC3ECiiXeNcJUKEURQzerCKUH24A6AQNL-4K7x_dh17mlQxqX_-UwSjpbasQ4UMTB2wQ6mmBIzDjx6AaXwwmLagmO4OBC-hEEszqkKp9all1sZo1_eM2P1hi_F87cC3Sjz652iwhIJifczdzgR0_JVSP0EdGp6Xw79gC7IoXJeaOYOvaKbLCPRj3_zcbf5Dw4tYMyvubItf0d7IESjzJpQBlqiiPLURn0Wg5dpYikgraxErwc26V3K4P5jZMPDmSs4WrSnwgqZLE0dqBl_YgBGiUr-OerSFNLnSl45HeZ7E5e68GjIBDbDegX68w_JWR-rT6fUZoZQoLSdSvkNXkWm0NT3uOuzOFptF6S1uOQ-Ij3gb_BWN_vp0blDHdqks7DMhCqu6TiugDlsDZc4PhOiBjMHRya-mNoI0TexDWDIGMAjCQUR1cWx4gAUDecDkVAdrRjNmU-44PEPVNdgJCoGNJICh5y26les4KmNAfqvfMjh-PKpdoh7K_S2tMe7uk5jvWcDCFRc_sQgOH9WLsIG6PYcQDW3Qm3GL-X2rfEcQN0Dpw0n2_So4YXv0fI9AyKv8V8_WG15XnVnXosbpXS4C85ZsIGTXxHWOGLLhuhcSj5u2Kq1dR2eYuctv9miBATCur5BtP5STHeEY-eykRcufriqQl3S2JN5CWjWfFg3ceS28B9wAhoq5to8UkdLsA1pU7IoYkQLYJQEgdUVNa-1SW6L-Tsu7cb_JiuGwZO7zM7G4M1dC9HJCh3gbQvRuPHdQezYCmjKaJM-W01rcY-sRMQPrdAaFwa54jV6125lTdYQabZGQ9l0P191CyGWsg==&xkcb=SoBq6_M360ETOvyQbB0JbzkdCdPP&camk=nUmJqO2E8riucXEezrxm3Q==&p=2&fvj=1&vjs=3
AI Development Specialist,Outlier Ai,"Montgomery, AL","$30 an hour -  Contract, Freelance","Profile insightsFind out how your skills align with the job descriptionSkillsDo you have experience in TypeScript?YesNoEducationDo you have a Bachelor's degree?YesNoLanguagesDo you know English?YesNo&nbsp;Job detailsHere’s how the job details align with your profile.Pay$30 an hourJob typeContractFreelanceShift and scheduleOvertime&nbsp;Full job description
Outlier helps the world’s most innovative companies improve their AI models by providing human feedback. Are you an experienced software engineer who would like to lend your coding expertise to train AI models?
 We partner with organizations to train AI large language models, helping cutting-edge generative AI models write better code. Projects typically include discrete, highly variable problems that involve engaging with these models as they learn to code. There is no requirement for previous AI experience.
 About the opportunity:

Outlier is looking for talented coders to help train generative artificial intelligence models
This freelance opportunity is remote and hours are flexible, so you can work whenever is best for you

You may contribute your expertise by…

Crafting and answering questions related to computer science in order to help train AI models
Evaluating and ranking code generated by AI models

Examples of desirable expertise:

Currently enrolled in or completed a bachelor's degree or higher in computer science at a selective institution
Proficiency working with one or more of the the following languages: Java, Python, JavaScript / TypeScript, C++
Ability to articulate complex concepts fluently in English
Excellent attention to detail, including grammar, punctuation, and style guidelines

Payment:

Currently, pay rates for core project work by Tier 2 coding experts in the U.S. average USD $30 per hour.
Rates vary based on expertise, skills assessment, location, project need, and other factors. For example, higher rates may be offered to PhDs. For non-core work, such as during initial project onboarding or project overtime phases, lower rates may apply. Certain projects offer incentive payments. Please review the payment terms for each project.


 PLEASE NOTE: We collect, retain and use personal data for our professional business purposes, including notifying you of opportunities that may be of interest and sharing with our affiliates. We limit the personal data we collect to that which we believe is appropriate and necessary to manage applicants’ needs, provide our services, and comply with applicable laws. Any information we collect in connection with your application will be treated in accordance with the Outlier Privacy Policy and our internal policies and programs designed to protect personal data.
 This is a 1099 contract opportunity on the Outlier.ai platform. Because this is a freelance opportunity, we do not offer internships, sponsorship, or employment. You must be authorized to work in your country of residence. If you are an international student, you may be able to sign up for Outlier if you are on a visa. You should contact your tax and/or immigration advisor with specific questions regarding your circumstances.

&nbsp;",https://www.indeed.com/pagead/clk?mo=r&ad=-6NYlbfkN0De7scZMGRktcRm1xquClSEeXRaD9t0XBHJvo7d6kcpE4H64IEDbL6G6R_P4w-3iqoKWt_OxgFBiM0MAXvLXpFuyBonDiivqh3cg0dppADubprv0_ylNhTWIcCqu4C_pTQmQtKiv4dOpqBpnb1M41jJ078hNeBfG-du0bniHMCFb4xvviYyE7Ug2C5E3eAP0LGmkB_fX2sMA65QMcvZ8cMzEKLdGFhmc3PA7dV5twt1WJ8OngtYk7LNQvG0VYV4oc2LLvMccUrygnfsErM93OaKQ5OZvkxFFTvqGv1BJfJFKfBYIQ9FNSmYe2fapHyCI6vl49YsAcUPPUsivzVOa-wUb2yp9zywWzGRy5wVxYsfjU1lXXlOGlITuUw7fRkaaYaVDB_qPPhx1AjnluaOjIm-WsNDupg4imjOm3IOE7WAjeSn2e905t7IJSrz8uW9zF1a8ITHo38VslTyy90yj9rDl1O8WtFjUEFl7byNk-YXzfxuVNCLPrXM_piJJMX3fgYdYP60ij0-8gvXgb9FcTHP4oOSD39wUtW1E9MoulJEa5Ud40OW2gKOMirs-pWB3ZWQzp_erRaLBZZn2aKk9rbX-SrOeiifexpt1P4AAPwHhF2rwCpb9BrqOOIaWZmqedp4j5guMVu_tAxrAEd71pzg76p5-JV6C036cTtTIU-Q3Z3VxZu0syrqRox2zB5gx-M_8MxyAUJ-y8XMt0s_CuGtxz35cSsBkxKijiemCY3AN_-3aDjdp3hS5jwMAFpd696R0SnpwusoGpst1Lcv9KjY-eQJPFH6gKZpIL8PmSgVIzlqj63qjFYWNf7env7rWjRpa_nDacUvv68fpRuKo-QzsCOPTNGkoytCoW09G318C9dCljiEaPKynMkTawwsZoZyr95DJfoJ_sTi2fJhqkOA5r5USoFL3E6G_O0xuaN1-llJoUkVqcMIwn3tWHy9QLgrJFV_6EyDa6znrSKgAlbBy4eUDvA1700pqJ2mo0bqf3YeZ4DioIxLYUhnFz1UGyAEWRdLmdGfhw1WfVeU-h94nuPPN8kgRUZfkAO30bPhmuU86BATDrbv_tfeaeqOAP8jvl57ZqP6mWPpVk4_4gtZ13r-3XhgiUE23tsbF3yXvXaNQ-_IMgfU6S-yRXa4B-nEWDdJX6NdaGxoVnYPO_Xg1jysWjg6YeagAEeumtRbPwgC8twreCRinCa7MCoGdt7XM9LZvhw5NQ-ZXv35gzVhmSZgwAJHNbQvU1hLr-pPwO5VuRY9QEk93APImpWgO36LmWVcXfZXQnFZmKAsxDcZgUNx2lPohWrztRPLjUuwVgPip5W01eOsBu9qVNDnUGfFlj5xSXArIcYDJb7zOAmJ80qxjaeGKLPszV8mP5xFPWZ6zxZ7AkKNU55PMqEDPB0gkgjj_-yS6w==&xkcb=SoDe6_M360ETOvyQbB0IbzkdCdPP&camk=nUmJqO2E8rgAR_no4UEDnA==&p=3&fvj=0&vjs=3
"Data Annotator for AI Models | English (US) | Remote, Part Time, Work from Home",RWS Group,Not Available,$14 - $20 an hour -  Freelance,"Profile insightsFind out how your skills align with the job descriptionSkillsDo you have experience in Windows?YesNoLanguagesDo you know English?YesNo&nbsp;Job detailsHere’s how the job details align with your profile.Pay$14 - $20 an hourJob typeFreelanceShift and scheduleChoose your own hours4 hour shift&nbsp;LocationRemote&nbsp;BenefitsPulled from the full job descriptionWork from home&nbsp;Full job description
 Job Purpose: 
 Apply here!

Work Location: Remote working.
You must be eligible to work in the US and currently reside in the USA.
Work Schedule: part time, generally 4-6 hours per day for several weeks but can vary per project
Compensation is project-dependent: 14 - 20 USD per hour (1099 contractor basis)
Experience: no prior experience required
Education: no education requirements
Language Requirements: native in English (US)
Start Date: ASAP, ongoing projects
Project Duration: typically 4-6 weeks, with option to extend and/or work on other projects


 Does this sound like you?

  Are you a stay-at-home mom or dad, student, gig worker, or professional looking for freelance, part-time, remote, work-from-home jobs where you can set your own schedule? Are you interested in helping to improve the reliability of today’s AI models? If yes, then this opportunity is for you!
 

 What we’re looking for?

  RWS Group is looking for Data Annotators to work on a range of tasks in the context of Artificial Intelligence development. The tasks can range from reviewing and scoring existing audio samples and providing constructive feedback to speech recording or captioning. This information will be used to train and improve AI and machine learning models.
 

 Typical tasks include:

Data annotation or evaluating of text or audio/speech samples OR
Briefly describing audio/speech sample contents or rewriting the generated captions OR
Assigning applicable categories OR
Speech and/or video recording

 Work benefits

Work from home part time
Work-life balance - maintain your lifestyle while you work
Earn extra money on the side
Timely payments made directly to your PayPal or bank account

 Equipment you’ll need

High-speed internet access (cable modem, DSL, etc.)
A personal computer (+ headset for recording tasks)
Windows or Mac OS X operating system
Email service: Outlook, Gmail, or any other

 Job requirements

Native-level fluency in English (US)
Located and eligible to work in United States (valid W9 form), with limitations for Texas or Illinois.
Ability to answer general free-form questions
Detail-oriented with the ability to understand and follow instructions
Ability to meet deadlines
Responsible, reliable, and communicative
Minimum daily availability of 4 hours.


  Part time (minimum of 4 hours / day)/ Remote / Temporary
 

 How to apply?


 1. You need to register with us to be added to our AI community, allowing us to reach out to you also later on with additional work we may have. APPLY HERE:
 
https://workzoneapplication.rws.com/WorkzoneApplicationPortal?CampaignId=AI_DATA_SERVICES

  2. After registering, you need to complete the assigned tests in order to get pre-qualified for the tasks. 3. Different projects may contain extra qualifications or compliance checks.
 


 If you already registered with our RWS TrainAI Community and you meet all the requirements, we will reach out to you via email with further details.
 
 Life at RWS: 
 
  At RWS, we’re here for one purpose: unlocking global understanding.
 

  As a unique, world-leading provider of technology-enabled language, content, and intellectual property services, we remove the barriers to communication to make global connection possible. Our unrivalled experience and deep understanding of language have been developed over more than 60 years. As we look to shape the future, our ambition is to create a world where understanding is universal for everyone.
 

  We work with over 80% of the world’s top 100 brands, more than three-quarters of Fortune’s 20 ‘Most Admired Companies’ and almost all the top pharmaceutical companies, investment banks, law firms and patent filers. Our client base spans Europe, Asia Pacific and North and South America. Our 65+ global locations across five continents service clients in the automotive, chemical, financial, legal, medical, pharmaceutical, technology and telecommunications sectors.
 

  If you like the idea of working with smart people who are passionate about breaking down language barriers and giving back to their communities, then you’ll love life at RWS. Our work fundamentally recognizes the value of every language and culture. So, we celebrate difference, we are inclusive and believe that diversity makes us strong.
 

  For further information, please visit: RWS


&nbsp;",https://www.indeed.com/rc/clk?jk=a48e4e8a223cda51&bb=OHS_9THhrPNKK4_fahHXMGqxFLanxj-algryb1aDAfVuS4WWrczJU2WhxlSS6ibI3j2-_bkhpqxNZ0WqaknYew-7r26n0NIakCabvG-m2LzFJEcyzLqPqV9kXA-acvJ5&xkcb=SoCk67M360ETOvyQbB0PbzkdCdPP&fccid=42902ed7252fb8a2&vjs=3
Remote AI Prompt writing,Davidayo,Not Available,$25 an hour -  Full-time,"Profile insightsFind out how your skills align with the job descriptionSkillsDo you have experience in Writing skills?YesNoEducationDo you have a Bachelor's degree?YesNo&nbsp;Job detailsHere’s how the job details align with your profile.Pay$25 an hourJob typeFull-timeShift and scheduleOvertime&nbsp;BenefitsPulled from the full job descriptionProfessional development assistance&nbsp;Full job descriptionDavidayo is committed to simplifying AI for businesses and individuals by offering insights, tools, and resources that make AI accessible and actionable. From beginner-friendly guides to advanced AI applications, Davidayo focuses on practical AI solutions in automation, data analysis, and decision-making to enhance productivity and drive innovation. Whether you're a tech enthusiast or a business looking to leverage AI, Davidayo provides the knowledge and strategies to help you thrive in an AI-driven world.
Role: 
How to Apply:

Be Patient and TEST OUR GEMINI AI,
Click CAREERS and Apply for our clients,
Let Us know how to improve our AI.

Responsibilities

Generate creative and engaging AI prompts for various applications.
Collaborate with the team to brainstorm and develop innovative prompt ideas.
Conduct research to understand target audience preferences and trends.
Ensure prompt content is accurate, relevant, and aligns with project objectives.
Implement feedback and make revisions to enhance prompt quality.
Stay updated on AI technology advancements and incorporate new techniques into prompt writing.

Qualifications

Strong proficiency in AI technology and natural language processing
Excellent writing skills with a focus on creativity and engagement
Experience in creating AI-generated content or working with AI writing tools
Understanding of machine learning algorithms and data processing
Ability to work independently and meet deadlines in a remote setting
Bachelor's degree in Computer Science, AI, or related field is preferred.

Benefits

Professional Growth: Gain hands-on experience in software development and work on cutting-edge projects that will make your resume stand out.
Resume - Building: Highlight your work at Davidayo on your resume, showcasing your experience with a reputable and forward-thinking company.

Also, you want more jobs, AI trends, and software development projects.. Follow us at Davidayo.
Will appreciate your reply or please do refer to friends or colleagues. If you are looking for a new opportunity in the market please follow me and share your interest I will search for a good job for you.
Have a Great Day!!
Job Type: Full-time
Pay: $25.00 per hour
Expected hours: 40 per week
Benefits:

Professional development assistance

Schedule:

Overtime

Work Location: Remote&nbsp;",https://www.indeed.com/rc/clk?jk=4ea857e95ef8633d&bb=OHS_9THhrPNKK4_fahHXMBoM94ljOoKuMrBo9aNErjB2JmT-JxhC1ASnUeFhtCE1P0yug6NDdMDcGP1F6s2CaDL88-2YFgmd3MM4LhLzJOMovA7IGxT2kH_ATuTrnE7P&xkcb=SoAQ67M360ETOvyQbB0ObzkdCdPP&fccid=96fc08d3767f5f67&cmp=Davidayo&ti=Ai+Prompt+Consultant&vjs=3
