Job Title,Company,Location,Salary,Description,Link
"Machine Learning Researcher, Multimodal Foundation Models",Apple,"Sunnyvale, CA","$143,100 - $264,200 a year","Profile insightsFind out how your skills align with the job descriptionSkillsDo you have experience in Python?YesNoEducationDo you have a Bachelor's degree?YesNo&nbsp;Job detailsHere’s how the job details align with your profile.Pay$143,100 - $264,200 a year&nbsp;LocationSunnyvale, CA&nbsp;BenefitsPulled from the full job descriptionDental insuranceEmployee stock purchase planHealth insuranceRSURetirement plan&nbsp;Full job description
Summary  Posted: Aug 9, 2024  Role Number:200561879  Imagine what you could do here. At Apple, new ideas have a way of becoming extraordinary products, services, and customer experiences very quickly. Bring passion and dedication to your job and there's no telling what you could accomplish. Multifaceted, amazing people and inspiring, innovative technologies are the norm here. The people who work here have reinvented entire industries with all Apple Hardware products. The same passion for innovation that goes into our products also applies to our practices strengthening our commitment to leave the world better than we found it. Join us in this truly exciting era of Artificial Intelligence to help deliver the next groundbreaking Apple product & experiences! As a member of our dynamic group, you will have the unique and rewarding opportunity to craft upcoming research directions in the field of multimodal foundation models that will inspire the future Apple products. We are continuously advancing the state of the art in Computer Vision and Machine Learning. You will be working alongside highly accomplished and deeply technical scientists and engineers to develop state of the art solution for challenging problems. We are touching all aspects of language and multimodal foundation models, from data collection, data curation to modeling, evaluation and deployment. This is a unique opportunity to be part of what forms the future of Apple products that will touch the life of many people. We (Spatial Perception Team) looking for a machine learning researcher to work on the field of Generative AI and multi-modal foundation models. Our team has an established track record of shipping features that leverages multiple sensors, such as FaceID, RoomPlan and hand tracking in VisionPro. We are focused on building experiences that leverages the power of our sensing hardware as well as large foundation models.  Description  This position requires a highly motivated person who wants to help us advance the field of generativeAI and multi-modal foundation models. You will be responsible for designing, implementing, evaluating foundation models based on the latest advancements in the fields, taking into account future hardware design and product needs. In addition, you will have an opportunity to engage and collaborate with several teams across apple to deliver the best products. 
 
BS and a minimum of 3 years relevant industry experience.
Solid programming skills with Python .
Deep understanding of large foundation models.
  Preferred Qualifications

Strong academic and publication record (CVPR, ICCV/ECCV, NeurIPS, ICML, etc)
Deep understanding of multi-task, multi-modal machine learning domain
Familiarity with deep learning toolkits
Familiar with challenges associated with training large models and working with large data
Ability to communicate the results of analyses in a clear and effective manner
  Pay & Benefits

  At Apple, base pay is one part of our total compensation package and is determined within a range. This provides the opportunity to progress as you grow and develop within a role. The base pay range for this role is between $143,100 and $264,200, and your base pay will depend on your skills, qualifications, experience, and location.  Apple employees also have the opportunity to become an Apple shareholder through participation in Apple’s discretionary employee stock programs. Apple employees are eligible for discretionary restricted stock unit awards, and can purchase Apple stock at a discount if voluntarily participating in Apple’s Employee Stock Purchase Plan. You’ll also receive benefits including: Comprehensive medical and dental coverage, retirement benefits, a range of discounted products and free services, and for formal education related to advancing your career at Apple, reimbursement for certain educational expenses - including tuition. Additionally, this role might be eligible for discretionary bonuses or commission payments as well as relocation. Learn more about Apple Benefits.  Note: Apple benefit, compensation and employee stock programs are subject to eligibility requirements and other terms of the applicable plan or program.
  More

Apple is an equal opportunity employer that is committed to inclusion and diversity. We take affirmative action to ensure equal opportunity for all applicants without regard to race, color, religion, sex, sexual orientation, gender identity, national origin, disability, Veteran status, or other legally protected characteristics. Learn more about your EEO rights as an applicant.

&nbsp;",https://www.indeed.com/rc/clk?jk=debb7e77fc377647&bb=yMYD8eMkCimnkRTAmLWH_B8EGaNV99SaUpUvs4lHpB9VGoUOdDYBHbLoTEV2rm9WY_1ZZ_aDxuP5dQ69nK-L8Y_i09-jagTOA5VHebIuzZoVAnyyyJXKYw%3D%3D&xkcb=SoDx67M360G_PYyxX50LbzkdCdPP&fccid=c1099851e9794854&vjs=3
Machine Learning Engineer - Applied AI,Uber,"Seattle, WA","$158,000 - $175,500 a year -  Full-time","Profile insightsFind out how your skills align with the job descriptionSkillsDo you have experience in TensorFlow?YesNoEducationDo you have a Master's degree?YesNo&nbsp;Job detailsHere’s how the job details align with your profile.Pay$158,000 - $175,500 a yearJob typeFull-time&nbsp;Full job description
About the Role   Uber's Applied AI team is at the forefront of leveraging cutting-edge Artificial Intelligence and Machine Learning technologies to enhance the Uber experience for millions of users globally. The Applied AI team collaborates with product teams across Uber to deliver innovative AI solutions for core business problems. We work closely with engineering, product and data science teams to understand core business problems and the potential for AI solutions, then deliver those AI solutions end-to-end.   The Applied AI team is building Natural Language and Computer Vision capabilities for multimodal document understanding. We are looking for a strong Machine Learning Engineer to join our team in Seattle! - What the Candidate Will Do - 
 
Train, evaluate and deploy Machine Learning models.
Develop distributed pipelines to analyze and process large datasets.
Collaborate with cross-functional teams to understand business problems and deliver an end-to-end Machine Learning solution.
Stay current with the latest advancements in AI/ML and integrate new technologies into the team's work.
- Basic Qualifications - 
 
Masters or equivalent in Computer Science, Engineering, Mathematics or related field
2 years of Software Engineering work experience.
Experience in programming with Python.
Experience with modern Machine Learning methods, such as Deep Learning
Experience with ML packages such as Tensorflow, PyTorch, JAX, and Scikit-Learn.
Experience in the development, training, productionization and monitoring of ML solutions at scale.
- Preferred Qualifications - 
 
4 years of Software Engineering work experience.
Experience in Natural Language Processing (NLP) and Computer Vision.
Experience in modern generative AI, such as transformer architectures, diffusion models and prompting.Publications or contributions to AI/ML research in top conferences or journals.
   For Seattle, WA-based roles: The base salary range for this role is USD$158,000 per year - USD$175,500 per year. You will be eligible to participate in Uber's bonus program, and may be offered an equity award & other types of comp. You will also be eligible for various benefits. More details can be found at the following link https://www.uber.com/careers/benefits.
&nbsp;",https://www.indeed.com/rc/clk?jk=bfd3be21bb76c356&bb=yMYD8eMkCimnkRTAmLWH_Bq0E91e15U1zL6xgg9GgatbHglWw8bUjhyGXBWfdXznzfBzeMdPhE6cTCoEjI9jg9IKwYI_e6BMN71-B_lzelL_tCCc27-vF86ufJiTnxVK&xkcb=SoBF67M360G_PYyxX50KbzkdCdPP&fccid=f766f8bfbc3effb7&vjs=3
Quantitative Analytics Specialist (001568),Wells Fargo,"Charlotte, NC",Full-time,"Profile insightsFind out how your skills align with the job descriptionSkillsDo you have experience in Statistical software?YesNoEducationDo you have a Doctoral degree?YesNo&nbsp;Job detailsHere’s how the job details align with your profile.Job typeFull-time&nbsp;LocationCharlotte, NC&nbsp;Full job description
 At Wells Fargo, we want to satisfy our customers' financial needs and help them succeed financially. We're looking for talented people who will put our customers at the center of everything we do. Join our diverse and inclusive team where you'll feel valued and inspired to contribute your unique skills and experience.  Help us build a better Wells Fargo. It all begins with outstanding talent. It all begins with you.  Corporate Risk helps all Wells Fargo businesses identify and manage risk. The team focuses on several key risk types, including conduct, credit, financial crimes, information security, interest rate, liquidity, market, model, operational, regulatory compliance, reputation, strategic, and technology risk.  The group provides leadership, enhances communications, assists with problem identification and solutions, and shares best practices. In addition, the group provides an enterprise-wide view of risk, assists management and our Board of Directors in identifying and monitoring risks that may affect multiple lines of business, and takes appropriate action when business activities exceed the risk tolerance of the company.  Wells Fargo Bank N.A. seeks a Quantitative Analytics Specialist in Charlotte, NC.  Job Role and Responsibility:   Wells Fargo Bank, N.A. is hiring for the position of Quantitative Analytics Specialist to develop, implement, and calibrate various analytical models. Perform highly complex activities related to financial products, business analysis and modeling. Perform basic statistical and mathematical models using Python, R, SAS, C++ and SQL. Perform analytical support and provide insights regarding a wide array of business initiatives. Provide solutions to business needs and analyze work flow processes to make recommendations for process improvement in risk management. Collaborate and consult with peers, colleagues, managers and regulators to resolve issues and achieve goals. Telecommuting is permitted up to 2 days a week. Position must appear in person to the location listed as the work address.  Travel required: None   Required Qualifications:  A PhD in Mathematics, Economics, or related quantitative field and 0 years of experience.  Experience and skills can be gained through work experience or as part of graduate-level coursework. 

Experience using statistical software packages such as Python, R, SAS, SQL, Spark, Java, or C++


Experience with data analytics, modeling, statistical inference, computing, big data analytics, Artificial Intelligence, machine learning, or natural language processing


Experience with Mathematical and Statistical Model Development or Validation


Experience with analytical research in response to requests or assignment


Analyzing processes to improve risk management activities
  Posting End Date:  5 Nov 2024 *Job posting may come down early due to volume of applicants.   We Value Diversity  At Wells Fargo, we believe in diversity, equity and inclusion in the workplace; accordingly, we welcome applications for employment from all qualified candidates, regardless of race, color, gender, national origin, religion, age, sexual orientation, gender identity, gender expression, genetic information, individuals with disabilities, pregnancy, marital status, status as a protected veteran or any other status protected by applicable law.  Employees support our focus on building strong customer relationships balanced with a strong risk mitigating and compliance-driven culture which firmly establishes those disciplines as critical to the success of our customers and company. They are accountable for execution of all applicable risk programs (Credit, Market, Financial Crimes, Operational, Regulatory Compliance), which includes effectively following and adhering to applicable Wells Fargo policies and procedures, appropriately fulfilling risk and compliance obligations, timely and effective escalation and remediation of issues, and making sound risk decisions. There is emphasis on proactive monitoring, governance, risk identification and escalation, as well as making sound risk decisions commensurate with the business unit's risk appetite and all risk and compliance program requirements.  Candidates applying to job openings posted in US: All qualified applicants will receive consideration for employment without regard to race, color, religion, sex, sexual orientation, gender identity, national origin, disability, status as a protected veteran, or any other legally protected characteristic.  Candidates applying to job openings posted in Canada: Applications for employment are encouraged from all qualified candidates, including women, persons with disabilities, aboriginal peoples and visible minorities. Accommodation for applicants with disabilities is available upon request in connection with the recruitment process.  Applicants with Disabilities  To request a medical accommodation during the application or interview process, visit Disability Inclusion at Wells Fargo .  Drug and Alcohol Policy  Wells Fargo maintains a drug free workplace. Please see our Drug and Alcohol Policy to learn more.  Wells Fargo Recruitment and Hiring Requirements:  a. Third-Party recordings are prohibited unless authorized by Wells Fargo.  b. Wells Fargo requires you to directly represent your own experiences during the recruiting and hiring process.
&nbsp;",https://www.indeed.com/rc/clk?jk=342f19ad4d31b2ad&bb=yMYD8eMkCimnkRTAmLWH_Ai9P9dJIULyL7qWuU6U5kQ2N9PKLBhS0WabxV7pCsm1hLoi-w_9Z6Xks7JmJ24yjNLqseygQGNGucu6O2TNiBSEh7AtwufWvA%3D%3D&xkcb=SoDY67M360G_PYyxX50JbzkdCdPP&fccid=78bbcd26e39621f5&vjs=3
Machine Learning Engineer - Applied AI,Uber,"Sunnyvale, CA","$158,000 - $175,500 a year -  Full-time","Profile insightsFind out how your skills align with the job descriptionSkillsDo you have experience in TensorFlow?YesNoEducationDo you have a Doctoral degree?YesNo&nbsp;Job detailsHere’s how the job details align with your profile.Pay$158,000 - $175,500 a yearJob typeFull-time&nbsp;Full job description
About the Role   The Applied AI team collaborates with product teams across Uber to deliver innovative AI solutions for core business problems. We work closely with engineering, product and data science teams to understand core business problems and the potential for AI solutions, then deliver those AI solutions end-to-end. Key areas of expertise include Computer Vision, ML Optimization, Geospatial AI, Personalization and Generative AI. - What the Candidate Will Do -  

Build and iterate on capturing semantic information of Uber entities by leveraging LLMs.
Generate embeddings using the semantic information to help improve our understanding of places, merchants, items and users.
Leverage this to improve ML models across Uber and to build novel personalized experiences.
- Basic Qualifications -  

PhD or equivalent in Computer Science, Engineering, Mathematics or related field AND 2-years full-time Software Engineering work experience OR 5-years full-time Software Engineering work experience, WHICH INCLUDES 3-years total technical software engineering experience in one or more of the following areas:
Programming language (e.g. C, C++, Java, Python, or Go)
Large-scale training using data structures and algorithms
Modern machine learning algorithms (e.g., tree-based techniques, supervised, deep, or probabilistic learning)
Machine Learning Software such as Tensorflow/Pytorch, Caffe, Scikit-Learn, or Spark MLLib
Note the 3-years total of specialized software engineering experience may have been gained through education and full-time work experience, additional training, coursework, research, or similar (OR some combination of these). The years of specialized experience are not necessarily in addition to the years of Education & full-time work experience indicated.
Experience with ML packages such as Tensorflow, PyTorch, JAX, and Scikit-Learn.
Experience with big-data architecture, ETL frameworks such as Spark, MapReduce, HDFS, Hive.
- Preferred Qualifications -  

3+ years of experience in the development, training, productionization and monitoring of ML solutions at scale.
Experience with formulating a business problem as an ML problem, identifying the right features, model structure and optimization constraints, and delivering business impact.
Experience in modern deep learning architectures and recommender systems.
Experience in building foundational data and embeddings that can be plugged into other application specific models.Experience working with multiple across team and org boundaries with engineering and product counterparts.
   For San Francisco, CA-based roles: The base salary range for this role is USD$158,000 per year - USD$175,500 per year. For Sunnyvale, CA-based roles: The base salary range for this role is USD$158,000 per year - USD$175,500 per year. For all US locations, you will be eligible to participate in Uber's bonus program, and may be offered an equity award & other types of comp. You will also be eligible for various benefits. More details can be found at the following link https://www.uber.com/careers/benefits.
&nbsp;",https://www.indeed.com/rc/clk?jk=c8f3bed74b9f2ce3&bb=yMYD8eMkCimnkRTAmLWH_KVFjGFE8QAjWcrcxnJ5PTGWuAxrKEEE0iqxE08YCXHiBzbg15yC3H49v7XEje3HgzlD79nX78nrb-9VqgsNGlpZ10-KmVIdvT1fnL5pq2iE&xkcb=SoBs67M360G_PYyxX50IbzkdCdPP&fccid=f766f8bfbc3effb7&vjs=3
"Applied Scientist, Conversational AI ModEling and Learning",Amazon.com Services LLC,"Bellevue, WA","$136,000 - $222,200 a year -  Full-time","Profile insightsFind out how your skills align with the job descriptionSkillsDo you have experience in TensorFlow?YesNoEducationDo you have a Master's degree?YesNo&nbsp;Job detailsHere’s how the job details align with your profile.Pay$136,000 - $222,200 a yearJob typeFull-time&nbsp;Full job description
PhD, or Master's degree and 2+ years of building machine learning models for business application experience
PhD, or a Master's degree and experience in CS, CE, ML or related field research
Experience programming in Java, C++, Python or related language
3+ years’ experience with modeling languages and tools like PyTorch / TensorFlow, R, scikit-learn, numpy, scipy, etc
Solid ML background and familiar with standard NLU, NLG, and LLM techniques
 Conversational AI ModEling and Learning (CAMEL) team is part of Amazon Artificial General Intelligence (AGI) organization where our mission is to create a best-in-class Conversational AI that is intuitive, intelligent, and responsive, by developing superior Large Language Models (LLM) solutions and services which increase the capabilities built into the model and which enable utilizing thousands of APIs and external knowledge sources to provide the best experience for each request across millions of customers and endpoints.  We are looking for a passionate, talented, and resourceful Applied Scientist in the field of LLM, Artificial Intelligence (AI), Natural Language Processing (NLP), Recommender Systems and/or Information Retrieval, to invent and build scalable solutions for a state-of-the-art context-aware conversational AI. A successful candidate will have strong machine learning background and a desire to push the envelope in one or more of the above areas. The ideal candidate would also have hands-on experiences in building Generative AI solutions with LLMs, enjoy operating in dynamic environments, be self-motivated to take on challenging problems to deliver big customer impact, moving fast to ship solutions and then iterating on user feedback and interactions.  Key job responsibilities As an Applied Scientist, you will leverage your technical expertise and experience to collaborate with other talented applied scientists and engineers to research and develop novel algorithms and modeling techniques to reduce friction and enable natural and contextual conversations. You will analyze, understand and improve user experiences by leveraging Amazon’s heterogeneous data sources and large-scale computing resources to accelerate advances in artificial intelligence. You will work on core LLM technologies, including Supervised Fine-Tuning (SFT), In-Context Learning (ICL), Learning from Human Feedback (LHF), etc. Your work will directly impact our customers in the form of novel products and services . 

PhD in Computer Sciences, Electrical Engineering, or Mathematics with specialization in machine learning, deep learning, or natural language processing
1+ years experience in building conversational AI and/or natural language processing systems.
Publications at peer-reviewed NLP/ML conferences (e.g. ACL, EMNLP, NAACL, NeurIPS, ICLR, ICML, AAAI, etc.)
Scientific thinking and the ability to invent, a track record of thought leadership and contributions that have advanced the field.
2+ years experience with large scale distributed systems such as Hadoop, Spark etc.
Excellent written and spoken communication skills
 Amazon is committed to a diverse and inclusive workplace. Amazon is an equal opportunity employer and does not discriminate on the basis of race, national origin, gender, gender identity, sexual orientation, protected veteran status, disability, age, or other legally protected status. For individuals with disabilities who would like to request an accommodation, please visit https://www.amazon.jobs/en/disability/us.  Los Angeles County applicants: Job duties for this position include: work safely and cooperatively with other employees, supervisors, and staff; adhere to standards of excellence despite stressful conditions; communicate effectively and respectfully with employees, supervisors, and staff to ensure exceptional customer service; and follow all federal, state, and local laws and Company policies. Criminal history may have a direct, adverse, and negative relationship with some of the material job duties of this position. These include the duties and responsibilities listed above, as well as the abilities to adhere to company policies, exercise sound judgment, effectively manage stress and work safely and respectfully with others, exhibit trustworthiness and professionalism, and safeguard business operations and the Company’s reputation. Pursuant to the Los Angeles County Fair Chance Ordinance, we will consider for employment qualified applicants with arrest and conviction records.  Our compensation reflects the cost of labor across several US geographic markets. The base pay for this position ranges from $136,000/year in our lowest geographic market up to $222,200/year in our highest geographic market. Pay is based on a number of factors including market location and may vary depending on job-related knowledge, skills, and experience. Amazon is a total compensation company. Dependent on the position offered, equity, sign-on payments, and other forms of compensation may be provided as part of a total compensation package, in addition to a full range of medical, financial, and/or other benefits. For more information, please visit https://www.aboutamazon.com/workplace/employee-benefits. This position will remain posted until filled. Applicants should apply via our internal or external career site.&nbsp;",https://www.indeed.com/rc/clk?jk=c349ff0d4f5331d0&bb=yMYD8eMkCimnkRTAmLWH_IGOo7SCmrwTGzv-jo_sJdoR2er0e4-g53wW-FCBB0-3HYduzykqdaLjoctuFpoEzqKs9A95mXIjhzvcWpqFcurCRaABlcu-cg%3D%3D&xkcb=SoDi67M360G_PYyxX50PbzkdCdPP&fccid=fe2d21eef233e94a&vjs=3
