Job Title,Company,Location,Salary,Description,Link
Machine Learning Engineer,Reps & Co,Not Available,Full-time,"Profile insightsFind out how your skills align with the job descriptionSkillsDo you have experience in Talend?YesNoEducationDo you have a Master's degree?YesNo&nbsp;Job detailsHere’s how the job details align with your profile.Job typeFull-time&nbsp;BenefitsPulled from the full job description401(k)401(k) matchingDental insuranceDisability insuranceEmployee assistance programEmployee stock ownership planGym membershipShow morechevron down&nbsp;Full job descriptionFounded in 2017, REPS & Co. has rapidly become a leader in data analytics in the entertainment industry. Recognized on the Forbes list of America's Best Startup Employers, we focus on delivering advanced analytics that support data driven decisions. Our solutions provide comprehensive insights and forecasts, enabling us to have a better understanding and response to supply and demand in the ticketing world. With a commitment to driving innovation, REPS & Co. helps shape a dynamic market environment.
We are looking for an experienced Machine Learning Engineer to join our dynamic team. The ideal candidate will have a strong background in machine learning, data engineering, and statistical analysis. You will be responsible for designing and implementing machine learning models, managing data pipelines, optimizing and improving existing models, and collaborating with cross-functional teams to integrate machine learning solutions into our products. You should be comfortable working in a fast-paced startup environment.
Key Responsibilities:

Design, develop, and deploy machine learning models and algorithms.
Analyze and process large datasets to extract meaningful insights.
Manage and maintain data pipelines to ensure data quality and availability.
Utilize ETL tools for efficient data extraction, transformation, and loading.
Collaborate with data scientists, data engineers, and other stakeholders to integrate machine learning solutions into products.
Continuously improve and optimize existing models for better performance and scalability.
Conduct experiments to evaluate model performance and iterate based on findings.
Translate abstract data concepts into practical applications
Document model development processes, methodologies, and performance metrics.
Implement and manage model deployment in production environments.
Monitor and troubleshoot model performance in real time production systems.
Develop and maintain machine learning infrastructure, including cloud based solutions.
Collaborate with software engineers to embed machine learning models into applications.
Participate in cross functional team meetings to align on project goals and deliverables.
Contribute to the development of reusable code libraries and frameworks.
Ensure reproducibility of experiments and models.
Evaluate and integrate third party machine learning tools and libraries.
Stay updated with the latest advancements in machine learning and artificial intelligence.

Requirements:

Bachelor’s or Master’s degree in Computer Science, Engineering, Mathematics, or a related field.
Proven experience as a Machine Learning Engineer or similar role.
Proficiency in programming languages such as Python, R, or Java.
Strong understanding of data structures, algorithms, and statistical methods.
Experience with data preprocessing, feature engineering, and model evaluation.
Proficiency in managing data pipelines and using ETL tools (e.g., Alteryx, Talend, Informatica).
Familiarity with cloud platforms (AWS, Google Cloud, Azure) and MLops tools.
Excellent problem-solving skills and attention to detail.
Strong communication and teamwork abilities.

Benefits

Medical, Dental and Vision insurance
Sick Leave
Paid Holidays
Volunteer Time Off
401k with Match
ESOP
Parental Leave
100% Employer Paid Life Insurance & Long Term Disability
EAP Program
Bonus
Gym Membership Reimbursement
Ticket Benefits

Job Type: Full-time
Benefits:

401(k)
Dental insurance
Health insurance
Life insurance
Paid time off
Professional development assistance
Relocation assistance

People with a criminal record are encouraged to apply
Work Location: Remote&nbsp;",https://www.indeed.com/rc/clk?jk=0a2790545bad77b6&bb=Y4giGCOwOrllGYa9dYBVR_wHnpe9fMqOQJeGgM68W9_TpSqnTZec8AXt0CXId7Aji18U4YjX95In_S0cdmD_6FY2zvAVUG0DzAtho7nzfCVEh9GIvR2lMg88FYwBYb9JH0IhcLQ9MLg%3D&xkcb=SoD367M360HkPfAUm70DbzkdCdPP&fccid=44e7b9dd3baad208&cmp=REPS-%2526-Co.&ti=Machine+Learning+Engineer&vjs=3
Artificial Intelligence (AI) Machine Learning,Blackwatch International,United States,Full-time,"Profile insightsFind out how your skills align with the job descriptionSkillsDo you have experience in Machine learning?YesNoEducationDo you have a Bachelor's degree?YesNo&nbsp;Job detailsHere’s how the job details align with your profile.Job typeFull-time&nbsp;BenefitsPulled from the full job descriptionOpportunities for advancementTuition reimbursement&nbsp;Full job description
Blackwatch International Corporation (Blackwatch), a small business founded in 2010, is a small business dedicated to supporting Federal business and national security objectives. Based in McLean, VA, with offices in Sacramento, CA, Blackwatch invests in innovation and quality for our customers and staff, holding corporate-level ISO 9001:2015, ISO/IEC 27001:2013, and ISO/IEC 20000-1:2018 quality certifications. We are a leading provider of information technology (IT) infrastructure, cybersecurity, DevSecOps, data exploitation, and engineering services, specializing in large and complex projects. Blackwatch is dedicated to growth and offers a dynamic working environment with multiple opportunities for advancement.
 Position Summary
The AI ML Lead will lead CISOD’s exploration of cutting-edge AI frameworks and methodologies, conducting in-depth research to understand their capabilities and applications.

 Essential Duties and Responsibilities
The essential functions include, but are not limited to, the following:


Responsible for the team’s documentation of the entire lifecycle of AI model creation, deployment, and operation, focusing on identifying potential risks and vulnerabilities inherent in each phase.
Leads team in developing robust strategies and frameworks for securing AI/ML applications, ensuring they adhere to industry standards and regulatory requirements.
Establishes and refines testing procedures specifically tailored to assess the security posture of AI/ML models and algorithms, including devising methodologies to simulate real-world attack scenarios and evaluate the resilience of AI systems against potential threats.
Provides mentorship and educational assistance to penetration testers and security analysts, empowering them with the knowledge and tools needed to effectively assess and mitigate risks within AI frameworks.


 Minimum Qualifications (Knowledge, Skills, and Abilities)

10 years’ experience in a relevant field
Bachelor’s degree in computer science or related field
Secret security clearance required
GISP or SANS certification required

&nbsp;",https://www.indeed.com/rc/clk?jk=a81d50562dafa975&bb=Y4giGCOwOrllGYa9dYBVR7s_ldCBm-agkdeqcsQs-9wnAhWhEEh1ByZO0jlcnSXMKxYmLi62qthrzvtoPJHfU8H1Zo9tG35FeXqNV-y3M9h2H4EGUOWHgyESBobwwlZB&xkcb=SoBD67M360HkPfAUm70CbzkdCdPP&fccid=b49002171b6d1399&vjs=3
"Research Scientist, Multimodal Machine Learning - Trust and Safety",TikTok,"San Jose, CA","$145,000 - $250,000 a year","Profile insightsFind out how your skills align with the job descriptionSkillsDo you have experience in Research?YesNoEducationDo you have a Master's degree?YesNo&nbsp;Job detailsHere’s how the job details align with your profile.Pay$145,000 - $250,000 a year&nbsp;BenefitsPulled from the full job description401(k) matchingAD&D insuranceDental insuranceDisability insuranceEmployee assistance programFlexible spending accountHealth insuranceShow morechevron down&nbsp;Full job descriptionResponsibilities TikTok is the leading destination for short-form mobile video. At TikTok, our mission is to inspire creativity and bring joy. TikTok's global headquarters are in Los Angeles and Singapore, and its offices include New York, London, Dublin, Paris, Berlin, Dubai, Jakarta, Seoul, and Tokyo.  Why Join Us Creation is the core of TikTok's purpose. Our platform is built to help imaginations thrive. This is doubly true of the teams that make TikTok possible. Together, we inspire creativity and bring joy - a mission we all believe in and aim towards achieving every day. To us, every challenge, no matter how difficult, is an opportunity; to learn, to innovate, and to grow as one team. Status quo? Never. Courage? Always. At TikTok, we create together and grow together. That's how we drive impact - for ourselves, our company, and the communities we serve. Join us.  Our Trust and Safety team is fast growing and responsible for building machine learning models and systems to protect our users from the impact of negative content . Our mission is to protect billions of users and publishers across the globe every day. We embrace state-of-the-art machine learning technologies and scale them to moderate the tremendous amount of data generated on the platform. With the continuous efforts from our team, TikTok is able to provide the best user experience and bring joy to everyone in the world.  The achievement of our mission relies on comprehensive understanding of content on the platform. We are looking for talented research scientists to help us enhance our content understanding techniques which are used in a variety of downstream business projects. We expect you to have solid experience in content understanding domain including but not limited to CV, NLP, Multimodal, and LLM. This position will work with a team of excellent research scientists and machine learning engineers to propose, develop, and implement innovative content understanding models and scale them to improve the experience of billions of Tiktok users around the world.  Responsibilities - What You'II Do 

Work with team members to design and develop next generation CV/NLP/Multimodality/LLM models.
Work with engineering teams to implement and deploy the model for scalable online serving.
Work with business partners to understand the business challenges and propose solutions.
Collaborate with product team to define objectives and improve trust and safety strategy.
 Qualifications Minimum Qualification 

PhD degree focusing on, or Master degree with at least 2 years of practical experience in one or more areas of content understanding, including but not limited to:
Multimodal understanding, such as video representation learning, temporal action localization, etc.
Vision < > language, such as image/video captioning, retrieval, VQA, etc.
Large language model domain adaption, such as SFT, LORA, etc.
 Preferred Qualifications 

Experience in LLM, multimodal modeling, representation learning is a plus.
Experience in working with XFN in an agile environment and ability to deliver in a fast-paced environment.
Proven record of research experience demonstrated by peer-reviewed publications in top AI/ML conference(s).
 TikTok is committed to creating an inclusive space where employees are valued for their skills, experiences, and unique perspectives. Our platform connects people from across the globe and so does our workplace. At TikTok, our mission is to inspire creativity and bring joy. To achieve that goal, we are committed to celebrating our diverse voices and to creating an environment that reflects the many communities we reach. We are passionate about this and hope you are too.  TikTok is committed to providing reasonable accommodations in our recruitment processes for candidates with disabilities, pregnancy, sincerely held religious beliefs or other reasons protected by applicable laws. If you need assistance or a reasonable accommodation, please reach out to us at https://shorturl.at/cdpT2 Job Information The base salary range for this position in the selected city is $145000 - $250000 annually.  ​  Compensation may vary outside of this range depending on a number of factors, including a candidate’s qualifications, skills, competencies and experience, and location. Base pay is one part of the Total Package that is provided to compensate and recognize employees for their work, and this role may be eligible for additional discretionary bonuses/incentives, and restricted stock units.  ​  Our company benefits are designed to convey company culture and values, to create an efficient and inspiring work environment, and to support our employees to give their best in both work and life. We offer the following benefits to eligible employees:  ​  We cover 100% premium coverage for employee medical insurance, approximately 75% premium coverage for dependents and offer a Health Savings Account(HSA) with a company match. As well as Dental, Vision, Short/Long term Disability, Basic Life, Voluntary Life and AD&D insurance plans. In addition to Flexible Spending Account(FSA) Options like Health Care, Limited Purpose and Dependent Care.  ​  Our time off and leave plans are: 10 paid holidays per year plus 17 days of Paid Personal Time Off (PPTO) (prorated upon hire and increased by tenure) and 10 paid sick days per year as well as 12 weeks of paid Parental leave and 8 weeks of paid Supplemental Disability.  ​  We also provide generous benefits like mental and emotional health benefits through our EAP and Lyra. A 401K company match, gym and cellphone service reimbursements. The Company reserves the right to modify or change these benefits programs at any time, with or without notice.  ​  For Los Angeles County (unincorporated) Candidates: ​  Qualified applicants with arrest or conviction records will be considered for employment in accordance with all federal, state, and local laws including the Los Angeles County Fair Chance Ordinance for Employers and the California Fair Chance Act. Our company believes that criminal history may have a direct, adverse and negative relationship on the following job duties, potentially resulting in the withdrawal of the conditional offer of employment:  ​  1. Interacting and occasionally having unsupervised contact with internal/external clients and/or colleagues;  ​  2. Appropriately handling and managing confidential information including proprietary and trade secret information and access to information technology systems; and  ​  3. Exercising sound judgment.&nbsp;",https://www.indeed.com/rc/clk?jk=257dffa5ca9260d7&bb=Y4giGCOwOrllGYa9dYBVR14pYyKpeZXqm281eJTVga3LxKjb9XGcTHmKATqo9pLa9HdvVAnkXy554JxDgkrAuRd_37lzw_dRXPs5lrh7vblc1fJVOqiw2t4RdpUqR71y&xkcb=SoDe67M360HkPfAUm70BbzkdCdPP&fccid=caed318a9335aac0&vjs=3
AI Researcher (Scientist),Kiva AI,Not Available,Not Available,"Profile insightsFind out how your skills align with the job descriptionSkillsDo you have experience in TensorFlow?YesNoEducationDo you have a Doctoral degree?YesNoLanguagesDo you know Multilingual?YesNo&nbsp;BenefitsPulled from the full job descriptionUnlimited paid time off&nbsp;Full job description

About Us


  Kiva AI is a San Francisco-based startup at the forefront of AI innovation, focused on delivering scalable solutions that push the boundaries of AI applications. We're revolutionizing data labeling, collection, and curation through our AI marketplace, leveraging cutting-edge technologies like AI and Web3 infrastructure. With over 70% of the multi-billion-dollar market's demand still unmet, we see a tremendous opportunity to establish ourselves as industry leaders. Backed by strong funding and guided by experienced industry veterans, Kiva AI is poised for exceptional growth and a transformative impact.
 


 About the Role


  Kiva AI is building the next generation of foundation for AI applications. We’re seeking an experienced AI Researcher to join our team. This person will play a pivotal role in building specialized AI models to empower applications for our global customers. You will be at the forefront of developing state-of-the-art language models with a strong emphasis on multilingual capabilities. You’ll partner closely with the CEO and Product and Engineering teams to transform customer needs into high-performing, impactful AI solutions.
 
Key Responsibilities

Develop and build specialized language and multimodal models to meet customer needs.
Stay ahead of the latest AI trends and innovations, advising on the integration of cutting-edge technologies.
Optimize model performance for scalability, accuracy, and efficiency across diverse use cases.
Lead research initiatives and contribute to the AI knowledge base through publications, papers, and open-source contributions.
Collaborate closely with cross-functional teams, including product and engineering, to align AI solutions with business goals.
Engage with external partners, research communities, and conferences to showcase Kiva.ai’s innovations and extend the company’s influence in the AI ecosystem.

 Qualifications

PhD in Computer Science, Artificial Intelligence, or a related technical field, or equivalent industry experience.
3+ years of hands-on experience building, deploying, and evaluating production-ready AI models, preferably in a startup or technology company environment.
Track record of publishing in top-tier peer-reviewed AI conferences or journals.
Proven expertise in natural language processing, including areas such as text classification, named entity recognition, and language generation.
Proficiency in Python and experience with AI frameworks like TensorFlow or PyTorch.
Strong analytical skills with the ability to articulate complex concepts to both technical and non-technical stakeholders.
Eagerness to stay ahead of emerging trends and contribute to the broader AI research community.

 Preferred Qualifications

Proven experience working with multilingual NLP models.
Research expertise in post pre-training methodologies, such as SFT, RLHF, and evaluations.
Strong familiarity with cloud-based platforms such as AWS, GCP, or Azure.
Prior experience in a startup environment.

 Perks

Competitive salary and benefits.
Generous initial equity grants.
Unlimited PTO.
Wellness benefits.


 If you’re excited to build foundational AI models that redefine what’s possible for our customers, we’d love to hear from you!



 Kiva AI is an equal opportunity employer and does not discriminate on the basis of race, national origin, gender, gender identity, sexual orientation, protected veteran status, disability, age, or other legally protected status.
 

&nbsp;",https://www.indeed.com/rc/clk?jk=f450b32883b57de5&bb=Y4giGCOwOrllGYa9dYBVR4Gi5vgbDSv6AZKm9hGOPq1EWW-GVmQnS25-fu5Tp3THbioacJjw0s0Og4ZFCxCLTqKTg4Eqj9Mn3gjk9pb5ziWrpABTC9WZRvYMrZNYcTS7&xkcb=SoBq67M360HkPfAUm70AbzkdCdPP&fccid=dd616958bd9ddc12&vjs=3
Scientist: Robot Learning for AI Supported Teleoperation Avatar,Honda Research Institute USA,"San Jose, CA",Not Available,"Profile insightsFind out how your skills align with the job descriptionSkillsDo you have experience in TensorFlow?YesNoEducationDo you have a Doctoral degree?YesNo&nbsp;Full job description


   Job Number: P23F08
  

   Honda Research Institute USA (HRI-US) in San Jose, California, is seeking a highly motivated Scientist to join our Robotics team at the intersection of robotics and machine learning. Through the creation of AI supported teleoperation avatars and autonomous intelligent entities, HRI's robotics program is positioning robots to work alongside humans in collaborative, scalable networks aimed at extending human capabilities. The main objective of this research is to create and improve various AI support functions for dexterous teleoperation avatar through robot learning.
  

   San Jose, CA
  

Key Responsibilities:

Research & Development of machine learning algorithms for telemanipulation, contact rich dexterous manipulation, object pose estimation and operator intention estimation.
Implementing the algorithms in simulation and verify on multi-fingered teleoperation avatar robot hardware.
Research topics may include the application of machine learning to human intention modeling, interaction planning, dexterous skills acquisition, contact-rich manipulation policy learning, learning from videos, reducing sim-to-real gap, and various related technologies.
Collaborate with local and international researchers and engineers within the company.
File patents on developed technologies.
Publish the research results at top-tier conferences and journals in machine learning and robotics.

Minimum Qualifications:

Ph.D. in computer science, robotics, mechanical engineering, electrical engineering, or a related field.
Experience with robotic manipulation, control, and dynamics.
Experience with machine learning deployed on a real robotics platform.
Familiarity with deep learning platforms such as TensorFlow and PyTorch.
Good programming skills in C++ or Python.
Familiarity with robot hardware and proficient in using ROS.
Strong written and oral communication skills.

Bonus Qualifications:

Experience in robotic teleoperation and collaborative robotic development
Experience in robotic object pose estimation and perception system development.
Experience with simulation platforms and engines, such as MuJoCo, PyBullet, IsaacSym, IsaacGym, Unreal Engine.
Experience with building simulated environments and training manipulation policies in simulation and transfer to real (sim-to-real)
Experience with policy deployment on multi-fingered robots and/or contact-rich tasks.
Experience in human action and task recognition using multimodal data.
Experience in frameworks and methodologies utilized in building LLM, LVM, and LMM applications.

Years of Experience Required: 2-5 years









Warning:You do not have the permission to access the upload fields on this form. Contact the form owner or portal administrator to request the access.
      






&nbsp;",https://www.indeed.com/rc/clk?jk=ff87e0130a7c99c9&bb=Y4giGCOwOrllGYa9dYBVR18C23_TVotdSyCXRSvbWL1Ii1jmKHDXuhsvxWSZYmIrR79zJqnUbqbuzPmNGzUbnwC0nymd5ErVzg5iznc0E91kIsZT743MlHbSP8PGvjmT&xkcb=SoDk67M360HkPfAUm70HbzkdCdPP&fccid=0aad0b277b718ea4&vjs=3
Machine Learning Engineer,Givzey,Not Available,Full-time,"Profile insightsFind out how your skills align with the job descriptionCertificationsDo you have a valid AWS Certification certification?YesNoSkillsDo you have experience in Training & development?YesNoEducationDo you have a Master's degree?YesNo&nbsp;Job detailsHere’s how the job details align with your profile.Job typeFull-time&nbsp;Full job description
Machine Learning Engineer
We're looking for a talented and motivated Machine Learning Engineer to join our team and help develop cutting-edge AI solutions. In this role, you'll have the opportunity to shape and create our machine learning capabilities from the ground up. You'll be at the forefront of innovation, designing and implementing ML systems that drive our business forward.
Responsibilities:

Design, develop, and implement machine learning models and algorithms
Analyze large datasets and extract meaningful insights
Collaborate with cross-functional teams to integrate ML solutions into existing systems
Optimize ML models for performance and scalability
Stay current with the latest advancements in machine learning and AI
Create and implement big data processing pipelines and architectures
Design and build scalable data infrastructure to support ML applications

Requirements:

Bachelor's or Master's degree in Computer Science, Data Science, or related field
3+ years of experience in machine learning or AI development
Strong proficiency in Python and its ML/data science libraries (e.g., TensorFlow, PyTorch, scikit-learn, pandas)
Solid understanding of machine learning algorithms and statistical modeling
Experience with big data technologies (e.g., Hadoop, Spark, Kafka)
Proven ability to create and implement big data solutions from scratch
Comfortable setting up and managing distributed computing environments
Experience in designing and implementing data pipelines for large-scale data processing
Proficient in working with various database systems, both SQL and NoSQL, depending on the use case
Strong skills in data modeling and database design for machine learning applications
Excellent problem-solving and analytical skills
Strong communication skills and ability to work in a team environment

Preferred Qualifications:

Experience in creating and managing real-time data streaming architectures
AWS Certified Machine Learning - Specialty or AWS Certified Big Data - Specialty
Experience with AWS machine learning services
Proficiency in using AWS big data services
Knowledge of serverless architectures on AWS (e.g., Lambda)
Experience in creating and managing real-time data streaming architectures on AWS (e.g., Kinesis)
Understanding of AWS security best practices for machine learning and data processing workflows

 
What you'll do day-to-day:

Be a member of a world-class team focused on inventing solutions that have the ability to impact the world
Tackle a wide variety of technical problems throughout the stack and contribute daily to all parts of our product code base
Help build a beautiful, intuitive product that revolutionizes the nonprofit industry
Work closely with our customers, founders, team members and Board to understand customer pain points, develop solutions, and prototype, iterate, and deploy code on regular cycles


&nbsp;",https://www.indeed.com/rc/clk?jk=2e5d3b3fcac53242&bb=Y4giGCOwOrllGYa9dYBVR0safTO-SvKW-pwKcV19gKN2QRgXO7Q49bwftkW7douYOy98RCW5ETrw7ssDKNOuAWpmyoRZZ_YME5TQJp0dP13mO0lxuTae4zdGLH_GtdOI&xkcb=SoBQ67M360HkPfAUm70GbzkdCdPP&fccid=dd616958bd9ddc12&vjs=3
