Job Title,Company,Location,Salary,Description,Link
Philosophy Tutor - AI Trainer,DataAnnotation,"Greeley, CO","From $40 an hour -  Part-time, Full-time","Profile insightsFind out how your skills align with the job descriptionSkillsDo you have experience in AI?YesNoEducationDo you have a Master's degree?YesNoLanguagesDo you know English?YesNo&nbsp;Job detailsHere’s how the job details align with your profile.PayFrom $40 an hourJob typeFull-timePart-time&nbsp;LocationGreeley, CO&nbsp;Full job descriptionWe are looking for a philosophy tutor to join our team to train AI models. You will measure the progress of these AI chatbots, evaluate their logic, and solve problems to improve the quality of each model.
In this role you will need to hold an expert understanding of philosophy science - a completed or in progress Masters/PhD/JD is preferred but not required. Other related fields include, but are not limited to: Ethics, Metaphysics, Epistemology, Logic.
Benefits:

This is a full-time or part-time REMOTE position
You’ll be able to choose which projects you want to work on
You can work on your own schedule
Projects are paid hourly starting at $40+ USD per hour, with bonuses on high-quality and high-volume work

Responsibilities:

Give AI chatbots diverse and complex problems and evaluate their outputs
Evaluate the quality produced by AI models for correctness and performance

Qualifications:

A current, in progress, or completed Masters and/or PhD/JD is preferred but not required
Fluency in English (native or bilingual level)
Detail-oriented
Proficient in logic, analytical reasoning, strategic thinking, persuasive reasoning, critical thinking, ethical reasoning.

Note: Payment is made via PayPal. We will never ask for any money from you.
Job Types: Full-time, Part-time
Pay: From $40.00 per hour
Expected hours: 1 – 40 per week
Work Location: Remote&nbsp;",https://www.indeed.com/pagead/clk?mo=r&ad=-6NYlbfkN0CnM4TERr6XuVBW3VTRACvDXDx9S3Pbn6a0SwhkmoLTiByC3ECiiXeNdPx_GnHEIswJcmhVwxyd-FS_5A_qgHb1aoPbmJZsafnDKt7ThJHFwTYiLxEwikx86p6n2RXHukrLp7JxXYiWB3UC051ZnpWbwNv-D4laKu71p-5zBwitdTPTBT3uMB53YJr_yTk1p5kXcX3Z-_knhfFvpQMOMwzoJ3I1ARNnb8lhDNFsTNrBCm9QjzgmjDUM-g3f5Lq1PkaZl3wCT1KXH19kIDzx5oWIci6uK7qnm_lukqGukfiLdTdbeQ3PveTWkCuL_FJfecofXBIBSXwLOi0VguzyU-IzqfYUabK5F7zQ6b0OSIyyhRoiyvcUbA5ECIOYqRJqglnT1Z1O_Jf5GOPsgqwbxaII3bnUWoB2xFlmg3aiZupNQQhcb1GH0K0Of3JLVi-w_0BF8N--Rlu1DSSuDwlqlgzveqPO1-ngJD8Zc-cvzb-g9xhRAiQHap4aG53uMs1GmE7RWOk8GeXQGtxiVrFy6u_RlidpKqQ3RXsFsRk6TxURZOYqb9nd8IFQlAdMiBYODP_NJtU5f8i_7uoLljR8Fhu28ms3VEb3-nZ0zypSOry_MpVY4kvfikE5NLgFlYVD6mlJ5d3fq9ZftZY2dJBGCMkkjOt83qkc9JcZHlrM3VTH_7phKAIEpLHR4f7WdrD_LMFVg1Eaijipv351x8eQUGpFjeeUWSWYdK8F5Dz7Q2eCpns3luxl56EhkLzKIKx6HgUb_J0rn2xYGiAktl-JXCm0C1nhdwgMzxrikiOy8XXkFipZxdUpS6WsLKYiEs9Sr3fPtXTGeCtRFBUNSb2wLmxaFlGByDI1QVo=&xkcb=SoAO6_M36zzrbVSxX50LbzkdCdPP&camk=nUmJqO2E8rhFhcUUaYVdUg==&p=0&fvj=1&vjs=3
Philosophy Teacher - AI Trainer,DataAnnotation,"Brunswick, GA","From $40 an hour -  Part-time, Full-time","Profile insightsFind out how your skills align with the job descriptionSkillsDo you have experience in AI?YesNoEducationDo you have a Master's degree?YesNoLanguagesDo you know English?YesNo&nbsp;Job detailsHere’s how the job details align with your profile.PayFrom $40 an hourJob typeFull-timePart-time&nbsp;Full job descriptionWe are looking for a philosophy teacher to join our team to train AI models. You will measure the progress of these AI chatbots, evaluate their logic, and solve problems to improve the quality of each model.
In this role you will need to hold an expert understanding of philosophy science - a completed or in progress Masters/PhD/JD is preferred but not required. Other related fields include, but are not limited to: Ethics, Metaphysics, Epistemology, Logic.
Benefits:

This is a full-time or part-time REMOTE position
You’ll be able to choose which projects you want to work on
You can work on your own schedule
Projects are paid hourly starting at $40+ USD per hour, with bonuses on high-quality and high-volume work

Responsibilities:

Give AI chatbots diverse and complex problems and evaluate their outputs
Evaluate the quality produced by AI models for correctness and performance

Qualifications:

A current, in progress, or completed Masters and/or PhD/JD is preferred but not required
Fluency in English (native or bilingual level)
Detail-oriented
Proficient in logic, analytical reasoning, strategic thinking, persuasive reasoning, critical thinking, ethical reasoning.

Note: Payment is made via PayPal. We will never ask for any money from you.
Job Types: Full-time, Part-time
Pay: From $40.00 per hour
Expected hours: 1 – 40 per week
Work Location: Remote&nbsp;",https://www.indeed.com/pagead/clk?mo=r&ad=-6NYlbfkN0CnM4TERr6XuVBW3VTRACvDXDx9S3Pbn6a0SwhkmoLTiByC3ECiiXeNdPx_GnHEIswJcmhVwxyd-KY-NAmqf8tkz7cFMdFSzHERjdu2-A_7a5UdlEhkNC5fGcLUthDugU_t-PkT8QxvOsUu72AIwlhwp4rEM6E_xYTdNtgAqSc-JsLJwSkJIDxqNxeNEMalQ9EAvZ0kfg4DeVImYBMtCx44F_HgLI64I1D38FP_W8GS_tOqtdggc6KtUEUYx7S9iuFlqatO-rgWP0nmRXHYHrB6DGGIu2q38cf5NlM3nvFl7CD8z4M7YdjHUyoCxqcD1-PwWK8yqJWzL5IyFawLk4goBi8V-vcw7iHDmNkdf4Bw6V5AHxxyr-xyJrcXymZB-wUBTfUM6jhDRyWNemzLV0OUYN6LfbuJGHOYmBhe5_DZFEETe3gIOyqTkzteqme5Uv_NxWToDD6pnzbNjObt4A7lGThM98B5MSGfzpK2xbzpEZoeBWgGbSfKJ6LctrB-XUGirJyAckEXgA_4BFhcopVEZQkVYr11HEf4Al32uBg23kQj9HCrFiSjLuD8a6JL0HcJRKCZRie1ZuuOrH7wbLr6s4XAAFWXcrtJAoDQrwTooKTbyYrFENp4u8beyrZMCDS84lDTaBt1VbMiQ2eUuw5wirw6cCr2mK7khuIlEJoY5nLK-_IumZloHYA3zMHX_DMBymV721NQJsr5M0FRrEBN0y9G63wV4o1cdXORAv9BhPNxQ0nB1auitDNNhCohlI2rDJIPI_0h7ocm2pjDUYtVMK17VKd9yQ0HJkeRvG-69SOuPZD4n6mB4Jl0dQ3r1DwxqFtGMItKrqo5aanGuH9Av2phlmonFzo=&xkcb=SoC66_M36zzrbVSxX50KbzkdCdPP&camk=nUmJqO2E8rhFhcUUaYVdUg==&p=1&fvj=1&vjs=3
Physics Expertise Sought for AI Training,Outlier Ai,"Jackson, MS","$30 - $50 an hour -  Contract, Freelance","Profile insightsFind out how your skills align with the job descriptionSkillsDo you have experience in AI?YesNoEducationDo you have a Bachelor's degree?YesNoLanguagesDo you know English?YesNo&nbsp;Job detailsHere’s how the job details align with your profile.Pay$30 - $50 an hourJob typeContractFreelanceShift and scheduleOvertime&nbsp;LocationJackson, MS&nbsp;Full job description
Outlier helps the world’s most innovative companies improve their AI models by providing human feedback. Are you an experienced physics who would like to lend your expertise to train AI models?

 About the opportunity:

Outlier is looking for talented Physics experts to help train generative artificial intelligence models
This freelance opportunity is remote and hours are flexible, so you can work whenever is best for you

You may contribute your expertise by…

Assessing the factuality and relevance of domain-specific text produced by AI models
Crafting and answering questions related to physics
Evaluating and ranking domain-specific responses generated by AI models


 Examples of desirable expertise:

A bachelor's or higher degree in physics or a related subject
Experience working as an physics professional
Ability to write clearly about concepts related to physics in fluent English


 Payment:

Currently, pay rates for core project work by physics experts range from $30 to $50 per hour USD.
Rates vary based on expertise, skills assessment, location, project need, and other factors. For example, higher rates may be offered to PhDs. For non-core work, such as during initial project onboarding or project overtime phases, lower rates may apply. Certain projects offer incentive payments. Please review the payment terms for each project.




 PLEASE NOTE: We collect, retain and use personal data for our professional business purposes, including notifying you of opportunities that may be of interest and sharing with our affiliates. We limit the personal data we collect to that which we believe is appropriate and necessary to manage applicants’ needs, provide our services, and comply with applicable laws. Any information we collect in connection with your application will be treated in accordance with the Outlier Privacy Policy and our internal policies and programs designed to protect personal data.
 This is a 1099 contract opportunity on the Outlier.ai platform. Because this is a freelance opportunity, we do not offer internships, sponsorship, or employment. You must be authorized to work in your country of residence. If you are an international student, you may be able to sign up for Outlier if you are on a visa. You should contact your tax and/or immigration advisor with specific questions regarding your circumstances.

&nbsp;",https://www.indeed.com/pagead/clk?mo=r&ad=-6NYlbfkN0De7scZMGRktcRm1xquClSEeXRaD9t0XBHJvo7d6kcpE4H64IEDbL6GmtDx6tM798eAshwmhboahamk7NPfMQBndZ5YhrC92Y2sodD0rXJ7zcYPXW0Ryq8Muu-bp9PHToJOMQD8g8Ft-vAHj7nawitocul5xVo_6217YW7x1sbsD8PXQm1RMBgMUEroRisBUa6osK49QuyXhHBklBv5L5U3NihwSZnxbK_ankoWcO3zaQkUR8BK1tJjJUEW8_V6TAqATaQaedUXdMpiBgoNfoe-VnDi3SkVSGnZ-WPdASqAJwhwpqDZOjvG_TT7e7N5krJO09b9SebvJ6Rhd8Nku7Nb8nxbwC0iluV9900LccQGv8bzIiCZmln1c04P2PD72r133wmSJVoRA4xXe6zFSv1Ge2exCAs2ep8eLA6Em20wpHqCyEkbkxWWqVRArlnhj-kTjhG4qtUvHeG9GAdoM_Um2iyDuoHALnpQfRK4aw_otNv06je4brhKZymnRxABTMRQhTcBNSAigLtKZVqFPIQy0tLVTJTQAQipWwAMaO9HyqMzcAPW5vmEew0jBh7zPmw-OVz47eyBkb8i9wEA5RugdHCpd4HYgQ8mH_DvT_Pb1V1WsckQ9GZtASmppmQdyLtT6qcHgQo4d_25pUyCsVzJb58BlV8ZlwvkgOi3kwMoStJD_bEM5PSDguJIt7kzkVqF9BOLONNwm3CGIMWRyCbOZ1DgFKI7oGPKZvaPVslJmfYEOkgub_XqUvxSok1s_gvi8RRXZnFy0qV2nMBZwcGHtQ8Ozs1E1t4ednVeLOTbOQA5Gro6cZf8Xkw2YTYpJ__cvB6JeXipKtC4BYI0a8BIIKU8_jRnFkse0sqmvIzB6aJIdK5hRJdVs6Nuidxq7DSgJjqbORNDI-HgFB1-eBLUZ55v7OSv40BTFjujT_Mz9YnSTJoiN04Ga6QMyqSNDhp84RrJ4jbL-EhINFnCv_A5O0RJGjXvH0c9kidtKKDOmkvMs5p02ERSNpvgPboTH7yfrO2X6zoXaHRhbeAdjmr6dB_wsVHIDcUml9F0qnU2AYXb4hs2D4NN3WguqEhar8OVl5gc-WVoPvU_oPmJL6_Q1wA4djm6wd9dtYKRQqJHCJ_p1gAK5HFDDk-FAVXa26o0zZT5aogWDIFJICz54smLi-iMmbtWfgAKLe8piSULdSYl9TQFPaSy5aA7gnuDFst5KuN5mEAHr9jFclRjZqxPXtaqEcGVTfgUE362CsBdlRyxjJrNDKxjkI20tUu4tL8hewKjHUjOjlnC3eatMSXxxPO9D_80T2kCUR6h8Yva5vPiEnHiGF0g6oXF6eFP_mAsLiWtSV-0muKwtbSdYTuKSbfhhwjOggm_rlVXuuidA6M8QjkjG-ehd80dO9wncOjpf4T0_kiwgr7cqDHRhEWV&xkcb=SoAn6_M36zzrbVSxX50JbzkdCdPP&camk=nUmJqO2E8rgD7kcnVqqKeg==&p=2&fvj=0&vjs=3
"Data Annotator for AI Models | English (US) | Remote, Part Time, Work from Home",RWS Group,Not Available,$14 - $20 an hour -  Freelance,"Profile insightsFind out how your skills align with the job descriptionSkillsDo you have experience in Windows?YesNoLanguagesDo you know English?YesNo&nbsp;Job detailsHere’s how the job details align with your profile.Pay$14 - $20 an hourJob typeFreelanceShift and scheduleChoose your own hours4 hour shift&nbsp;BenefitsPulled from the full job descriptionWork from home&nbsp;Full job description
 Job Purpose: 
 Apply here!

Work Location: Remote working.
You must be eligible to work in the US and currently reside in the USA.
Work Schedule: part time, generally 4-6 hours per day for several weeks but can vary per project
Compensation is project-dependent: 14 - 20 USD per hour (1099 contractor basis)
Experience: no prior experience required
Education: no education requirements
Language Requirements: native in English (US)
Start Date: ASAP, ongoing projects
Project Duration: typically 4-6 weeks, with option to extend and/or work on other projects


 Does this sound like you?

  Are you a stay-at-home mom or dad, student, gig worker, or professional looking for freelance, part-time, remote, work-from-home jobs where you can set your own schedule? Are you interested in helping to improve the reliability of today’s AI models? If yes, then this opportunity is for you!
 

 What we’re looking for?

  RWS Group is looking for Data Annotators to work on a range of tasks in the context of Artificial Intelligence development. The tasks can range from reviewing and scoring existing audio samples and providing constructive feedback to speech recording or captioning. This information will be used to train and improve AI and machine learning models.
 

 Typical tasks include:

Data annotation or evaluating of text or audio/speech samples OR
Briefly describing audio/speech sample contents or rewriting the generated captions OR
Assigning applicable categories OR
Speech and/or video recording

 Work benefits

Work from home part time
Work-life balance - maintain your lifestyle while you work
Earn extra money on the side
Timely payments made directly to your PayPal or bank account

 Equipment you’ll need

High-speed internet access (cable modem, DSL, etc.)
A personal computer (+ headset for recording tasks)
Windows or Mac OS X operating system
Email service: Outlook, Gmail, or any other

 Job requirements

Native-level fluency in English (US)
Located and eligible to work in United States (valid W9 form), with limitations for Texas or Illinois.
Ability to answer general free-form questions
Detail-oriented with the ability to understand and follow instructions
Ability to meet deadlines
Responsible, reliable, and communicative
Minimum daily availability of 4 hours.


  Part time (minimum of 4 hours / day)/ Remote / Temporary
 

 How to apply?


 1. You need to register with us to be added to our AI community, allowing us to reach out to you also later on with additional work we may have. APPLY HERE:
 
https://workzoneapplication.rws.com/WorkzoneApplicationPortal?CampaignId=AI_DATA_SERVICES

  2. After registering, you need to complete the assigned tests in order to get pre-qualified for the tasks. 3. Different projects may contain extra qualifications or compliance checks.
 


 If you already registered with our RWS TrainAI Community and you meet all the requirements, we will reach out to you via email with further details.
 
 Life at RWS: 
 
  At RWS, we’re here for one purpose: unlocking global understanding.
 

  As a unique, world-leading provider of technology-enabled language, content, and intellectual property services, we remove the barriers to communication to make global connection possible. Our unrivalled experience and deep understanding of language have been developed over more than 60 years. As we look to shape the future, our ambition is to create a world where understanding is universal for everyone.
 

  We work with over 80% of the world’s top 100 brands, more than three-quarters of Fortune’s 20 ‘Most Admired Companies’ and almost all the top pharmaceutical companies, investment banks, law firms and patent filers. Our client base spans Europe, Asia Pacific and North and South America. Our 65+ global locations across five continents service clients in the automotive, chemical, financial, legal, medical, pharmaceutical, technology and telecommunications sectors.
 

  If you like the idea of working with smart people who are passionate about breaking down language barriers and giving back to their communities, then you’ll love life at RWS. Our work fundamentally recognizes the value of every language and culture. So, we celebrate difference, we are inclusive and believe that diversity makes us strong.
 

  For further information, please visit: RWS


&nbsp;",https://www.indeed.com/rc/clk?jk=a48e4e8a223cda51&bb=VaeE8oHa2xWvA9FFDAeuNxwr-z2h5GaG78uVbRQyYJU5jPZyCL-gye78OE_IVTwYfBmZEyAlO7EUrW48rFBwR7MkrcI5S438QDXnVdICY5mBMjulp5x0L9es-3vUuuVj&xkcb=SoBn67M36zzrbVSxX50IbzkdCdPP&fccid=42902ed7252fb8a2&vjs=3
Remote AI Prompt writing,Davidayo,Not Available,$25 an hour -  Full-time,"Profile insightsFind out how your skills align with the job descriptionSkillsDo you have experience in Writing skills?YesNoEducationDo you have a Bachelor's degree?YesNo&nbsp;Job detailsHere’s how the job details align with your profile.Pay$25 an hourJob typeFull-timeShift and scheduleOvertime&nbsp;LocationRemote&nbsp;BenefitsPulled from the full job descriptionProfessional development assistance&nbsp;Full job descriptionDavidayo is committed to simplifying AI for businesses and individuals by offering insights, tools, and resources that make AI accessible and actionable. From beginner-friendly guides to advanced AI applications, Davidayo focuses on practical AI solutions in automation, data analysis, and decision-making to enhance productivity and drive innovation. Whether you're a tech enthusiast or a business looking to leverage AI, Davidayo provides the knowledge and strategies to help you thrive in an AI-driven world.
Role: 
How to Apply:

Be Patient and TEST OUR GEMINI AI,
Click CAREERS and Apply for our clients,
Let Us know how to improve our AI.

Responsibilities

Generate creative and engaging AI prompts for various applications.
Collaborate with the team to brainstorm and develop innovative prompt ideas.
Conduct research to understand target audience preferences and trends.
Ensure prompt content is accurate, relevant, and aligns with project objectives.
Implement feedback and make revisions to enhance prompt quality.
Stay updated on AI technology advancements and incorporate new techniques into prompt writing.

Qualifications

Strong proficiency in AI technology and natural language processing
Excellent writing skills with a focus on creativity and engagement
Experience in creating AI-generated content or working with AI writing tools
Understanding of machine learning algorithms and data processing
Ability to work independently and meet deadlines in a remote setting
Bachelor's degree in Computer Science, AI, or related field is preferred.

Benefits

Professional Growth: Gain hands-on experience in software development and work on cutting-edge projects that will make your resume stand out.
Resume - Building: Highlight your work at Davidayo on your resume, showcasing your experience with a reputable and forward-thinking company.

Also, you want more jobs, AI trends, and software development projects.. Follow us at Davidayo.
Will appreciate your reply or please do refer to friends or colleagues. If you are looking for a new opportunity in the market please follow me and share your interest I will search for a good job for you.
Have a Great Day!!
Job Type: Full-time
Pay: $25.00 per hour
Expected hours: 40 per week
Benefits:

Professional development assistance

Schedule:

Overtime

Work Location: Remote&nbsp;",https://www.indeed.com/rc/clk?jk=4ea857e95ef8633d&bb=VaeE8oHa2xWvA9FFDAeuNz1rMULsUZxWi0ogqp1ByV9kb7UFYhV_FnnYaIxfmprUVkYBXBDTYlR7c5z-o3cuhy_HQho8ibSxNj96R86wq6Nd3d8GnoidBSbz_x61OR9n&xkcb=SoDp67M36zzrbVSxX50PbzkdCdPP&fccid=96fc08d3767f5f67&cmp=Davidayo&ti=Ai+Prompt+Consultant&vjs=3
Machine Learning Engineer - LLMs & Generative AI,Apple,"Cupertino, CA","$143,100 - $264,200 a year -  Full-time","Profile insightsFind out how your skills align with the job descriptionSkillsDo you have experience in Operating systems?YesNoEducationDo you have a Master's degree?YesNo&nbsp;Job detailsHere’s how the job details align with your profile.Pay$143,100 - $264,200 a yearJob typeFull-time&nbsp;BenefitsPulled from the full job descriptionDental insuranceEmployee stock purchase planHealth insuranceRSURetirement plan&nbsp;Full job description
Summary  Posted: Aug 29, 2024  Weekly Hours: 40  Role Number:200565766  The Intelligence Platform team empowers clients across Apple’s operating systems with high quality user-centric knowledge and inferences that enable next generation user experiences. We’re an applied Machine Learning team that leverages state of the art technologies like generative AI, graph machine learning, and private learning to deliver high quality inferences. We are in search of an accomplished and driven Machine Learning Engineer who has a robust understanding of Large Language Models and Generative AI. Your primary role will involve decoding and applying groundbreaking research and setting the course for the team in this thriving field. By contributing to our team, you’ll play an integral part in developing Siri, Photos, Music, and various other services, leaving a significant footprint on the evolution of our AI platforms! Join us in our exciting journey as we push the frontiers of Machine Learning and Generative AI. Your expertise and contributions will be invaluable in shaping the future of our Intelligence Platform!  Description  As a Machine Learning Engineer on the Knowledge Platform team, you’ll join a phenomenal team of talented engineers and researchers and will be entrusted with a range of responsibilities. Your tasks will include: - Leading the exploration and application of Large Language Models and Generative AI, venturing into areas within these fields such as Question-Answering over structured databases. - Translating the latest research into high-performing systems and models that can be practically applied to enhance user experiences. - Setting the team’s strategic direction, cultivating an environment that encourages innovation and professional growth. - Actively engaging in all aspects of model development, from ideation and experimentation to deployment. - Collaborating with various teams to develop and implement Machine Learning solutions, ensuring performance optimization and alignment with broader business goals. 
 
An advanced degree (Master’s or Ph.D.) in Computer Science, Artificial Intelligence, Machine Learning, or a related field is preferred
Hands-on experience with LLM fine-tuning approaches and training models.
  Preferred Qualifications

Proven ability to comprehend, interpret, and apply cutting-edge research into tangible applications.
Published research in the field of Machine Learning or AI is highly desirable, indicating an ability to not only understand but also contribute to cutting-edge research.
Proven problem-solving and leadership abilities, with the capacity to steer the team’s research and practical applications in a collaborative and fast-paced environment.
In-depth experience in Machine Learning, with a particular emphasis on Large Language Models (LLMs) and Generative AI.
  Pay & Benefits

  At Apple, base pay is one part of our total compensation package and is determined within a range. This provides the opportunity to progress as you grow and develop within a role. The base pay range for this role is between $143,100 and $264,200, and your base pay will depend on your skills, qualifications, experience, and location.  Apple employees also have the opportunity to become an Apple shareholder through participation in Apple’s discretionary employee stock programs. Apple employees are eligible for discretionary restricted stock unit awards, and can purchase Apple stock at a discount if voluntarily participating in Apple’s Employee Stock Purchase Plan. You’ll also receive benefits including: Comprehensive medical and dental coverage, retirement benefits, a range of discounted products and free services, and for formal education related to advancing your career at Apple, reimbursement for certain educational expenses - including tuition. Additionally, this role might be eligible for discretionary bonuses or commission payments as well as relocation. Learn more about Apple Benefits.  Note: Apple benefit, compensation and employee stock programs are subject to eligibility requirements and other terms of the applicable plan or program.
  More

Apple is an equal opportunity employer that is committed to inclusion and diversity. We take affirmative action to ensure equal opportunity for all applicants without regard to race, color, religion, sex, sexual orientation, gender identity, national origin, disability, Veteran status, or other legally protected characteristics. Learn more about your EEO rights as an applicant.

&nbsp;",https://www.indeed.com/rc/clk?jk=74ae31cf3da8c8f6&bb=VaeE8oHa2xWvA9FFDAeuN3Hsk8hLNYDJ-I5bUZQyw_IIb2T3RKIQ26oreEGYyj1CkldpYuPEMb581PjdV5-qZRiqSPw3IF5dJwWVuvJ01kJ4pc45jbQLVg%3D%3D&xkcb=SoBd67M36zzrbVSxX50ObzkdCdPP&fccid=c1099851e9794854&vjs=3
