Job Title,Company,Location,Salary,Description,Link
Software Engineering Program Manager (AI/ML/Algorithms),Apple,"Cupertino, CA","$165,500 - $293,800 a year","Profile insightsFind out how your skills align with the job descriptionSkillsDo you have experience in Software development?YesNoEducationDo you have a Bachelor's degree?YesNo&nbsp;Job detailsHere’s how the job details align with your profile.Pay$165,500 - $293,800 a year&nbsp;BenefitsPulled from the full job descriptionDental insuranceEmployee stock purchase planHealth insuranceRSURetirement plan&nbsp;Full job description
Summary  Posted: Jul 8, 2024  Role Number:200558547  Imagine what you could do here. At Apple, new insights have a way of becoming extraordinary products, services, & customer experiences very quickly. Bring passion and dedication to your job and there's no telling what you could accomplish. Dynamic, resourceful people and inspiring, innovative technologies are the norm here. The people who work here have reinvented entire industries with all Apple Hardware products. The same passion for innovation that goes into our products also applies to our practices strengthening our dedication to leave the world better than we found it. Do you want to join us in these pursuits? Join us to help deliver the next groundbreaking Apple products! Apple is seeking a Software Engineering Program Manager with Computer Vision (CV)/ML/Algorithm experience to join the Video Computer Vision team which delivered Vision Pro and FaceID algorithms! The ideal candidate would grasp and drive complex technical topics and lead a hardworking engineering team during its product development phases. We are looking for a SW EPM with proven algorithm experience and a strong software background. The ideal candidate has gone through entire product cycles and has a variety of different experiences. You should have a solid track record of shipping complex new technology and experience in building algorithms. The ideal candidate thrives in a dynamic, constantly evolving environment. You will lead teams through the software development cycle from concept to delivery, collaborating with several teams and driving the definition, schedule, execution and communication of new features. If this sounds like you, please apply!  Description  In this role, you will drive large, multi-functional efforts to build technologies for Apple and have the opportunity to work on cutting edge technologies using Computer Vision, Machine Learning and Generative AI. You will create development schedules, identify critical paths, and maintain thorough execution You will ensure tight inter-team coordination and communication. You should be able to grasp complex technical topics and abstract key issues and risks into a useful form for executive management. Optimally and consistently communicate overall program status. 
 
Experience leading complex, multi-functional software projects.
Engineering experience in any of the following or related areas: Computer science, Software, Machine Learning, Systems Engineering, Embedded Software, Hardware Development, Computer Vision, etc.
BS in Electrical or Computer Engineering + 10 years relevant experience
  Preferred Qualifications

Technical program management experience managing consumer-facing software programs.
Serious consideration will be given to qualified candidates from computer vision fields with relevant software engineering, product development experience and data science background.
Previous experience with Hardware process and Embedded Software Systems is a plus.
Strong knowledge of software development processes.
Ability to dive into technical details in Machine Learning, Computer Vision and other algorithms.
Comprehends and deals well with rapid changes and remains flexible and calm in the face of uncertainty.
Excellent communication, presentation, organizational, and leadership skills.
Ability to influence, lead and mitigate risks.
Self-motivated and proactive with demonstrated creative and critical thinking capabilities.
  Pay & Benefits

  At Apple, base pay is one part of our total compensation package and is determined within a range. This provides the opportunity to progress as you grow and develop within a role. The base pay range for this role is between $165,500 and $293,800, and your base pay will depend on your skills, qualifications, experience, and location.  Apple employees also have the opportunity to become an Apple shareholder through participation in Apple’s discretionary employee stock programs. Apple employees are eligible for discretionary restricted stock unit awards, and can purchase Apple stock at a discount if voluntarily participating in Apple’s Employee Stock Purchase Plan. You’ll also receive benefits including: Comprehensive medical and dental coverage, retirement benefits, a range of discounted products and free services, and for formal education related to advancing your career at Apple, reimbursement for certain educational expenses - including tuition. Additionally, this role might be eligible for discretionary bonuses or commission payments as well as relocation. Learn more about Apple Benefits.  Note: Apple benefit, compensation and employee stock programs are subject to eligibility requirements and other terms of the applicable plan or program.
  More

Apple is an equal opportunity employer that is committed to inclusion and diversity. We take affirmative action to ensure equal opportunity for all applicants without regard to race, color, religion, sex, sexual orientation, gender identity, national origin, disability, Veteran status, or other legally protected characteristics. Learn more about your EEO rights as an applicant.

&nbsp;",https://www.indeed.com/rc/clk?jk=b166bf26c8e01cb4&bb=AEbniSccx35oLt9Ku5tckGbOEcbDgGwx1D_s84WGAV8-z_A-zR9HEcGjEcGHyPZWk-nGejz8M49agwG294kO8CpdnZLAVYXZDSJSi3MhuZpTzz-fp_IICg%3D%3D&xkcb=SoDx67M36z2MszgXjT0CbzkdCdPP&fccid=c1099851e9794854&vjs=3
Head of Artificial Intelligence (AI) Studio,VSP Global,Not Available,Full-time,"Profile insightsFind out how your skills align with the job descriptionSkillsDo you have experience in Program management?YesNoEducationDo you have a Bachelor's degree?YesNo&nbsp;Job detailsHere’s how the job details align with your profile.Job typeFull-time&nbsp;Full job description
 Responsible for determining and executing internal and external projects around cutting-edge technologies within the transformational AI ecosystem. Provides program management and technical expertise in the implementation and initiatives within the VSP Vision Artificial Intelligence (AI) Studio and across the entire enterprise as a connection point to innovation and transformational AI.
 

  Lead the development and execution of transformational AI strategies, ensuring alignment with VSP Vision’s overall business objectives.
 


  Plays a key role in establishing credibility and visibility of a new and growing hybrid AI team.
 


  Oversee the planning, development, and implementation of transformational AI projects and initiatives within the GIC and across the enterprise.
 


  Foster cross-departmental collaboration to drive transformational AI initiatives, facilitating integration and adoption of generative AI technologies throughout the organization.
 


  Prepare and present information for a diverse and executive-level audience, ensuring clear and effective communication of transformational AI projects and outcomes.
 


  Provide technical expertise and leadership in AI, including machine learning, data science, and advanced analytics, to support transformational innovation initiatives.
 


  Develop and manage relationships with external partners, including startups, academic institutions, and industry experts, to leverage cutting-edge AI technologies and solutions.
 


  Ensure that transformational AI projects are delivered on time, within scope, and within budget, while meeting quality and performance standards.
 

  Monitor and evaluate the performance of transformational AI projects and initiatives, using metrics and KPIs to drive continuous improvement and innovation.
 


  Stay current with the latest advancements in AI and related technologies and identify opportunities for their application within VSP Vision.
 


  Communicate transformational AI strategies, projects, and outcomes to executive leadership and other stakeholders, ensuring alignment and support for transformational AI initiatives.
 


  Mentor and develop a high-performing team of AI professionals, fostering a culture of innovation and excellence.
 


  Design, establish, and maintain an organizational structure and staffing to effectively accomplish the department’s goals and objectives.
 


  Establish good working relationships across Company functions and business units, specifically with Digital Technology and Architecture and Policy and Governance within Global Technology Solutions.
 


  Develop, mentor and grow personnel within the organization.
 


  Monitor performance of direct reports; provides prompt and objective coaching and counseling; conduct performance reviews and recommend salary increases.
 


  Participate in the hiring and interviewing process for open positions within the unit ensuring that the most qualified candidates are selected.
 


  Assure effective communications are maintained within the unit and externally. Where appropriate, inform employees as to plans and progress, conduct employee discussion sessions at regular intervals.
 


  Participate in a wide variety of special projects at Corporate or LOB level, as needed.
 


  Coordinate with other units/departments to facilitate special requests, resolve workflow or production issues.
 


  Job Specifications
 


 Typically has the following skills or abilities:



  Bachelor’s degree in computer science, Data Science, Engineering, or a related field;
 


  Minimum 10 years of experience related to functional area.
 


  Proven experience in leading cross-functional AI projects and initiatives, with the ability to collaborate effectively with stakeholders at all levels.
 


  Demonstrated ability to build and maintain relationships with external partners, including startups, academic institutions, and industry experts.
 


  Strong technical expertise in AI and machine learning, including experience with AI frameworks, tools, and technologies.
 


  Excellent communication and presentation skills, with the ability to convey complex technical concepts to non-technical audiences.
 


  Experience with presenting to audiences (of 5 to 100 people) of various levels (developers to executives) and backgrounds (business, technical, operations).
 


  Experience in managing budgets and resources for AI projects, with a focus on delivering value and impact.
 


  Strong problem-solving and analytical skills, with a proactive approach to identifying and addressing challenges and opportunities.
 


  Passion for innovation and continuous learning, with a commitment to staying current with the latest advancements in AI and related technologies.
 
















                VSP Vision is an equal opportunity employer and gives consideration for employment to qualified applicants without regard to age, gender, race, color, religion, sex, national origin, gender identity, sexual orientation, disability or protected veteran status. We maintain a drug-free workplace and perform pre-employment substance abuse testing.
               
















  Notice to Candidates: Fraud Alert - Fake Job Opportunity Solicitations Used to Collect Fees/Personal Information.
 

 We have been made aware that fake job opportunities are being offered by individuals posing as VSP Vision and affiliate recruiters. 
  
   Click here
  to learn about our application process and what to watch for regarding false job opportunities.
 


  As a regular part of doing business, VSP Vision (“VSP”) collects many different types of personal information, including protected health information, about our audiences, including members, doctors, clients, brokers, business partners, and employees. VSP Vision employees will have access to this sensitive personal information and are subject to follow Information Security and Privacy Policies.
 
&nbsp;",https://www.indeed.com/rc/clk?jk=50785ab3c21c4a7a&bb=AEbniSccx35oLt9Ku5tckKbw-6DVNuWKdI32F6iRxfVStQUAZzBdGT7ccJD8OhDaKBrRdneOW69qIyCgG1N30Pzp87mfPXdUVS9gE2ugcRH7hVCVIpLGsckxRcwDE99S&xkcb=SoBs67M36z2MszgXjT0BbzkdCdPP&fccid=274e39ee4b679fc5&vjs=3
"Manager, Engineering (Data and AI Architecture)",Fedex,"3680 Hacks Cross Road, Memphis, TN 38125","$11,280 - $16,920 a month -  Full-time","Profile insightsFind out how your skills align with the job descriptionSkillsDo you have experience in TensorFlow?YesNoEducationDo you have a Bachelor's degree?YesNoLanguagesDo you know Bilingual?YesNo&nbsp;Job detailsHere’s how the job details align with your profile.Pay$11,280 - $16,920 a monthJob typeFull-time&nbsp;Location3680 Hacks Cross Road, Memphis, TN 38125&nbsp;BenefitsPulled from the full job descriptionDental insuranceTuition reimbursementVision insurance&nbsp;Full job description
Takes ownership and responsibility for the support the design, build, test and maintain data pipelines at big data scale. Leads a team responsible for modeling and development to support operations initiatives, strategic programs and new products and solutions. Strong background and experience in the use of advanced descriptive, diagnostic, predictive, prescriptive and ensemble modeling, advanced statistical techniques, and complex mathematical tools. Uses expertise to lead a team that initiates and delivers projects and develops end-to-end solutions that drive business results, including proofs-of-value for new business problems and production-ready solutions for operations and customer-facing products. Understands and ensures development of solutions supporting the movement of data and information assets following API-First / Service-Oriented Architecture principles. Advances Dataworks’ broad capabilities to use and deploy cutting edge data science and machine learning tools in Dataworks projects, platforms and products. Provides expert consultation and thought leadership to senior management. Mentors other team members to drive results and effectively collaborates with cross-functional teams to deliver business goals.
 As the Manager Engineering - Data and AI Architecture, you will be responsible for leading the architecture, and implementation of the organization's data and AI strategy. You will work closely with executive leadership, business architects, data scientists, platform engineers, software engineers and other stakeholders to ensure that Data and AI initiatives are accelerating FedEx towards a smarter supply chain. This role requires deep expertise in data architecture, AI technologies, and cloud native as well as legacy systems. The successful candidate will have a strong platform and product engineering mindset with accompanying experience in data governance, compliance, and operational excellence.

 Job Description / Responsibilities
 Architectural Design:

Identify and implement the optimal data and AI architecture, leveraging both open-source and commercial tools.
Drive the modernization of platform, data and application data architectures, transitioning legacy systems to scalable and reliable, cloud-native solutions while maintaining business continuity and performance.
Ensure the security, reliability, and maintainability of our data and AI infrastructure.
Translate complex technical concepts into actionable insights for senior leadership, ensuring data and AI strategies support broader organizational goals.
Stay up to date on the latest data and AI technologies and best practices.

 Team Management:

Lead and mentor a team of data architects, data scientists, and other engineering professionals.
Foster a culture of innovation and collaboration within the data and AI team.
Lead cross-functional teams in creating reusable data and AI services that can be leveraged across the enterprise, fostering a product engineering mindset within the data and AI organization.

 Technology Partnerships:

Evaluate and select appropriate data and AI technologies and platforms.
Manage relationships with technology partners and vendors.
Collaborate with business stakeholders to ensure data-driven solutions are aligned with business priorities and drive measurable outcomes.

 Data Governance:

Develop and implement data governance policies and procedures.
Prioritize ethical AI implementation by safeguarding against security threats and ensuring transparency and accountability.
Champion best practices for data security, governance, and compliance, ensuring adherence to both internal policies and external regulatory standards.


 Skills / Abilities

Technologies: Expertise in Azure services, Databricks, relational databases, document stores, key value stores, streaming and messaging systems, Lakehouse architecture, data warehouses, ETL pipelines, and AI/ML frameworks (e.g., TensorFlow, PyTorch, etc.).
Cloud Expertise: Strong experience with Azure cloud-based data architectures, including data storage, processing, and AI integration.
On-Prem Expertise: Proven experience modernizing legacy data systems such as JMS, DB2 and Oracle, with a focus on transitioning to cloud-native data platforms.
AI/ML Integration: Deep knowledge of integrating AI models into existing data infrastructures and deploying them across hybrid environments.
Data Governance and Security: Expertise in data governance, ensuring compliance with regulatory standards and implementing robust security practices across both cloud and on-prem environments.
DevOps for Data: Experience integrating DevOps practices into data pipelines, ensuring automation, efficiency, and continuous delivery of data-driven solutions.


 Minimum Education
Bachelor's Degree in Information Systems, Computer Science, or a quantitative discipline such as Mathematics or Engineering and/or equivalent formal training or work experience.
 Minimum Experience
Seven (7) years equivalent work experience in measurement and analysis, quantitative business problem solving, simulation development and/or predictive analytics. Extensive knowledge in data engineering and machine learning frameworks including design, development and implementation of highly complex systems and data pipelines. Extensive knowledge in Information Systems including design, development and implementation of large batch or online transaction-based systems. Strong understanding of the transportation industry, competitors, and evolving technologies. Experience providing leadership in a general planning or consulting setting. Experience as a leader or a senior member of multi-function project teams. Strong oral and written communication skills. A related advanced degree may offset the related experience requirements.
Knowledge, Skills and Abilities
 Preferred Qualifications: 
Pay Transparency: This compensation range is provided as a reasonable estimate of the current starting salary range for this role across all potential locations. If this opportunity includes multiple job levels, the range is a reasonable estimate of the current starting salary for the lowest level to the current starting salary of the highest level. Actual starting pay would be determined by experience relative to the job, market level, pay at the location for this job and other job-related factors permitted by law. An employee may be eligible for additional pay, premiums, or bonus potential. The Company offers eligible employees health, vision and dental insurance, retirement, and tuition reimbursement.
 Pay: U.S Pay Range: $11,280.00 - 16,920.00 (Monthly)
 Additional Details: Application Criteria: Upload a current copy of Resume (Microsoft Word or PDF format only) and answer job screening questionnaire by 5 PM CT on October 17th, 2024.
 All qualified applicants will receive consideration for employment without regard to race, color, religion, sex, sexual orientation, gender identity, national origin, disability, or status as a protected veteran. Reasonable accommodations are available for qualified individuals with disabilities throughout the application process. Applicants who require reasonable accommodations in the application or hiring process should contact recruitmentsupport@fedex.com.
Applicants have rights under Federal Employment Laws:

Equal Employment Opportunity is the Law
EEO is the Law Supplement
Pay Transparency Policy
Family and Medical Leave Act (FMLA)
Employee Polygraph Protection Act

E-Verify Program Participant: Federal Express Corporation participates in the Department of Homeland Security U.S. Citizenship and Immigration Services' E-Verify program (For U.S. applicants and employees only). Please click below to learn more about the E-Verify program:

E-Verify Notice (bilingual)
Right to Work Notice (English) / (Spanish)


&nbsp;",https://www.indeed.com/rc/clk?jk=b2b13fe6718b4b0c&bb=AEbniSccx35oLt9Ku5tckCT-tEh-E4HTIL7XDipXTMplikdvYk7xDqfypT2F07Q83SZX4PVpp_zJyHWJ07aZcoF7WwD2cnI1GGzCCaV1OXNizfzEqtS3kETDGMeDCekw&xkcb=SoDY67M36z2MszgXjT0AbzkdCdPP&fccid=51d7caba6f0d1508&vjs=3
