Job Title,Company,Location,Salary,Description,Link
Data Analyst and Machine Learning Specialist,University of Maryland Baltimore County,"1000 Hilltop Circle, Baltimore, MD 21250","$62,500 - $71,500 a year -  Full-time","Profile insightsFind out how your skills align with the job descriptionSkillsDo you have experience in Tableau?YesNoEducationDo you have a Master's degree?YesNo&nbsp;Job detailsHere’s how the job details align with your profile.Pay$62,500 - $71,500 a yearJob typeFull-timeShift and scheduleMonday to Friday&nbsp;BenefitsPulled from the full job descriptionDisability insurance&nbsp;Full job description




Department:


Division of Information Technology - Business Information Systems and Support Technology
https://analytics.umbc.edu/




Position Overview:


UMBC is looking for a data scientist to conduct, interpret, and present results that support UMBC’s mission, strategic goals, and the recommendations of our accreditation Self Study and to assist with the effective use of tools (both internally developed and vendor provided) to support the continuous improvement of the university.




Why Work at UMBC?


UMBC offers competitive compensation. This role starts at $62,500 and has over 4 weeks of vacation for regular full time roles. Tuition remission is also available.
What is it like to work at UMBC? Check out Glassdoor or Indeed.
For 15 years in a row UMBC has been recognized as a Great College to Work For!




Telework:


A hybrid telework schedule may be available.




Responsibilities:


The Data Analyst and Machine Learning Specialist's role is to conduct, interpret, and present results that support UMBC’s mission, strategic goals, and the recommendations of our accreditation Self Study and to assist with the effective use of tools (both internally developed and vendor provided) to support the continuous improvement of the university.   Using standard analytical tools and vendor-provided systems, the person holding this position will help to support campus stakeholders with development and assessment of our student success initiatives. They will support and conduct projects that increase enrollment, graduation and retention rates, reduce time to degree, support improved academic advising, and improve student learning and course performance.   This person holding this position will help to improve our ability to assess the outcomes of strategic planning and strategic enrollment planning decisions by supporting the presentation and visualization of analytical results and business intelligence dashboards (often using Tableau) that monitor strategic goals and key performance indicators.   Responsibilities:

Support the implementation, training, and effective use of vendor-provided and internally-built analytics systems by campus stakeholders. This includes effectively using analytics products and platforms to deliver information that stakeholders can understand and act upon through basic (e.g., tables and charts) and more advanced analytics (e.g., interactive dashboards, and the assessment of, development, and deployment of predictive models).
Work with campus stakeholders to identify, prioritize, and conduct analytical projects that support the university’s mission, goals, strategic plan, and strategic enrollment plan.
Use appropriate data and methods to uncover fact patterns and perform basic and intermediate statistical inference.
Curate and present real-time or intervention/action-based data from our systems (e.g., the LMS, card swipes, PeopleSoft, Sales Force, Webassign, Vital Source, etc.) in new ways that allow us to tackle new problems or re-imagine solutions to existing ones.
Prepare high-quality and clear written reports, exhibits, and visualizations that present and interpret findings.
Support and assess our student experience initiatives. This includes, for example, supporting committees charged with student success and persistence, use data and analysis to support the development and assessment of our student advising, case management, nudging, first-year alert program and other activities (at the class, department, college, or university level) designed to help student success, improve retention, improve graduation rates, and shorten time to degree.
Mentor Undergraduate and Graduate Research Assistants in their work supporting the above initiatives.





Required Minimum Qualifications:



Requires a bachelor's degree in economics, mathematics/statistics, computer science or other fields with related analytical competencies.
2 years experience in analytics and machine learning modeling.
2 years experience in data warehouse report creation and data extraction using SQL.
2 years programming experience in Python, R, Julia, and HTML/CSS/Javascript.





Preferred Qualifications:



Master’s degree in Computer Science, Data Science and Engineering, or Mathematics preferred.
4 years experience with AI/ML modeling. Experience with Tableau dashboard creation.
Candidates pursuing or holding doctorates will receive strong consideration.
Experience with HelioCampus data warehouse and Tableau reporting.





Background Screening Statement:


A background check will be required.




Special Instructions to Applicants:


Upload a cover letter and a resume.




Closing Date:


     Open Until Filled
    



Benefits:


UMBC offers a rich benefits package.
Regular and grant funded regular positions (Full benefits summary click here):
Generous Leave which includes accruing:

22 Days of Annual Leave
15 Days of Sick Leave
15 Holidays
3 Personal Days

Tuition Remission:

8 credit hours per semester

Additional Benefits:

Life and disability insurance
Professional development opportunities
Wellness opportunities
& Much more

Contingent II positions may include some benefits.
Benefits offered align with type (Regular, Contingent II, etc.) of position.




Salary:


Salary: $62,500 - $71,500 depending on qualifications and experience.  The salary of the finalist(s) selected for this role will be set based on a variety of factors, including but not limited to, internal equity, budget, prior experience, skills, knowledge, abilities, education, licensure and certifications, and other business considerations.
The above salary range represents the University’s good faith and reasonable estimate of the range of possible compensation at the time of posting.




Hours:


     Full-time
    



Type:


     Contractual, Contingent II
    



Additional Information:


     Please note that this is a full-time contractual staff position. The contract term will be for a one-year period, with the option to renew.
    



FLSA Status:


     Exempt
    



Equal Opportunity Statement:


     UMBC is an Affirmative Action/Equal Opportunity Employer. Applications from women, minority group members, veterans and individuals with disabilities are encouraged to apply.
    



Title IX:


     As an institution that receives federal financial assistance, UMBC adheres to Title IX and does not discriminate on the basis of sex. For more information about Title IX and contact information for Title IX Coordinator click here.
    



Accommodation:



If you require a reasonable accommodation for a disability for any part of the employment process, please contact the Human Resources Department at 410-455-2337 or MD TTY Relay Service 1-800-735-2258 between 8:30 a.m. and 4:00 p.m. Monday through Friday.




Work Authorization


     As required by the 1986 Immigration Act, be prepared to present acceptable documentation upon hire showing your identity and that you are a U.S. citizen or an alien who is authorized to work.
    



&nbsp;",https://www.indeed.com/rc/clk?jk=45220b60d9bfa25d&bb=YHE_AFbg9fHwErHyZyGhZ1nhCTBQhmGPfIbfCk6RI2keRqUwPKCxnyPRPW9XNsbhyMoRgWijR6K3tnm3cULLPzryy-043STaXMeF_-xCTmajc7Q8xmCKqgnMtzcHPdJJ&xkcb=SoAd67M36z0Qqjy0H50LbzkdCdPP&fccid=b757d8b5d8e08079&vjs=3
Senior Machine Learning Engineer,Procore Technologies,"Austin, TX","$156,400 - $215,050 a year -  Full-time","Profile insightsFind out how your skills align with the job descriptionSkillsDo you have experience in TensorFlow?YesNoEducationDo you have a Master's degree?YesNo&nbsp;Job detailsHere’s how the job details align with your profile.Pay$156,400 - $215,050 a yearJob typeFull-time&nbsp;LocationAustin, TX&nbsp;BenefitsPulled from the full job descriptionHealth insurancePaid time off&nbsp;Full job description
Job Description
 We’re looking for a Senior Machine Learning Engineer to join Procore’s Product & Technology Team. Procore software solutions aim to improve the lives of everyone in construction and the people within Product & Technology are the driving force behind our innovative, top-rated global platform. We’re a customer-centric group that encompasses engineering, product, product design and data, security and business systems.
This Senior Machine Learning Engineer will advance the future of Construction Intelligence. As a member of our Copilot team, you’ll help deliver the future of our next-generation insights, recommendations, and automated experiences. You will deliver AI capabilities to everyone in construction on a global platform.
The construction vertical is ripe for technological innovation. Construction impacts the lives of nearly everyone in the world, and the introduction of Large Language Models (LLMs) is creating new opportunities for informing, assisting, and guiding our customers. Procore is leading the market with our SaaS construction platform. We build for real people with real experiences, empowering Groundbreakers to develop and transform the communities where we all live.
As a Senior Machine Learning Engineer, you’ll create prototypes, explore the latest in LLM technologies, and build production level services. We have a rich dataset of terabytes of data from being the leader in construction management software for over twenty years. This position is a great opportunity to use your machine learning, data engineering, and AWS cloud service skills to enable machine learning as a service at scale at Procore.
This position reports to the Manger, Software Engineering in the Copilot team and is based in our Austin, TX office. We’re looking for someone to join our team immediately.
 What you’ll do:

Work with large scale structured and unstructured data, build and continuously improve cutting edge Machine Learning models for Procore product, business and operational use cases.
Evaluate and train Large Language Models (LLMs), traditional language models such as BERT, and other machine learning models such as XGBoost.
Hands-on develop, productionize, and operate Machine Learning models and pipelines at scale, including both batch and real-time use cases.
Leverage third-party and in-house Machine Learning tools & infrastructure to develop reusable, highly differentiating and high-performing Machine Learning systems, enable fast model development, low-latency serving and ease of model quality upkeep.
Practice continuous delivery / continuous integration methodologies using tools like CircleCI, SonarQube, and JFrog for testing, deployment, and promotion to production
Design, build, and deploy APIs to serve predictive insights tailored to our construction data sets.
Work collaboratively with cross-functional partners including software engineers, product managers, operations and data scientists, identify opportunities for business impact, understand, refine, and prioritize requirements for machine learning models, drive engineering decisions, and quantify impact.

 What we’re looking for:

5+ years of industry experience in applied Machine Learning. Relevant graduate degrees (MS or PhD) may substitute for 2-4 years of experience.
Exceptional written and verbal communication skills
Strong programming ( Python / Java / C++ or equivalent) and data engineering skills
Strong understanding in the machine learning and data science technical ecosystems (e.g., Tensorflow, Pytorch, MLflow, Ray, LangChain, Data lake house (Databricks), Snowflake, SageMaker, Scikit-learn, etc)
Deep understanding of Machine Learning best practices (eg. training/serving skew minimization, A/B test, feature engineering, feature/model selection), algorithms (eg. gradient boosted trees, neural networks/deep learning, optimization) and a strong desire to further pursue natural language processing techniques, including LLMs.
Industry experience building end-to-end Machine Learning infrastructure and/or building and productionizing Machine Learning models
Understand cost of software development / tech debt and long-term maintenance
Passion for customers and seeking a deep understanding of end-user problems as well as competitive and market trends in the AI space
Nice to have: experienced in construction technologies and software
  Additional Information
 Base Pay Range $156,400 - $215,050. Eligible for Bonus Incentive Compensation. Procore is committed to offering competitive, fair, and commensurate compensation, and has provided an estimated pay range for this role. Actual compensation will be based on a candidate’s job-related skills, experience, education or training, and location.

 Perks & Benefits
At Procore, we invest in our employees and provide a full range of benefits and perks to help you grow and thrive. From generous paid time off and healthcare coverage to career enrichment and development programs, learn more details about what we offer and how we empower you to be your best.
 About Us
Procore Technologies is building the software that builds the world. We provide cloud-based construction management software that helps clients more efficiently build skyscrapers, hospitals, retail centers, airports, housing complexes, and more. At Procore, we have worked hard to create and maintain a culture where you can own your work and are encouraged and given resources to try new ideas. Check us out on Glassdoor to see what others are saying about working at Procore.
We are an equal-opportunity employer and welcome builders of all backgrounds. We thrive in a diverse, dynamic, and inclusive environment. We do not tolerate discrimination against candidates or employees on the basis of gender, sex, national origin, civil status, family status, sexual orientation, religion, age, disability, race, traveler community, status as a protected veteran or any other classification protected by law.
Alternative methods of applying for employment are available to individuals unable to submit an application through this site because of a disability. Contact benefits@procore.com to discuss reasonable accommodations.
If you'd like to stay in touch and be the first to hear about new roles at Procore, join our Talent Community.
 For Los Angeles County (unincorporated) Candidates:
Procore will consider for employment all qualified applicants, including those with arrest or conviction records, in accordance with the requirements of applicable federal, state, and local laws, including the City of Los Angeles’ Fair Chance Initiative for Hiring Ordinance, the Los Angeles County Fair Chance Ordinance for Employers, and the California Fair Chance Act.
A criminal history may have a direct, adverse, and negative relationship on the following job duties, potentially resulting in the withdrawal of the conditional offer of employment: 1. appropriately managing, accessing, and handling confidential information including proprietary and trade secret information, as well as accessing Procore's information technology systems and platforms; 2. interacting with and occasionally having unsupervised contact with internal/external customers, stakeholders, and/or colleagues; and 3. exercising sound judgment.
&nbsp;",https://www.indeed.com/rc/clk?jk=67b1c2e9f10cb1c9&bb=YHE_AFbg9fHwErHyZyGhZ3rltpBOJGEvnz5z9KszlIbuilNoWI5E8HLLhNHfc0VwQA-5dkJGqNXY0zXLmLraIDz58cHXIFBwsGpDIbkTS1WYXPHaLOM0JPgU3LSPHlnJ&xkcb=SoCp67M36z0Qqjy0H50KbzkdCdPP&fccid=bc675912b67fcb67&vjs=3
"Manager, Machine Learning",Centene,Missouri,"$116,800 - $216,200 a year -  Full-time","Profile insightsFind out how your skills align with the job descriptionSkillsDo you have experience in Statistical analysis?YesNoEducationDo you have a Bachelor's degree?YesNo&nbsp;Job detailsHere’s how the job details align with your profile.Pay$116,800 - $216,200 a yearJob typeFull-time&nbsp;LocationMissouri&nbsp;BenefitsPulled from the full job description401(k)Health insurancePaid holidaysPaid time offTuition reimbursement&nbsp;Full job description
You could be the one who changes everything for our 28 million members by using technology to improve health outcomes around the world. As a diversified, national organization, Centene's technology professionals have access to competitive benefits including a fresh perspective on workplace flexibility.Position Purpose: Manages the design, development, and maintains scalable software solutions utilizing statistical, artificial intelligence (AI), and machine-learning (ML) modeling approaches. Performs research and testing to develop machine learning algorithms and predictive models. Utilizes big data computation and storage tools to create prototypes and datasets. Conducts model training and evaluation. Integrates, tests, tunes, and monitors solutions. Accomplishes the above by leading a team of machine learning engineers.
 
Leads the design, development, and maintenance of predictive analytics, machine learning, and artificial intelligence solutions, making specific determinations about overall performance, reliability, and scalability
Collaborate with multiple partner teams such as Business, Technology, Product Management, Legal, Compliance, Strategy and Business Management to develop use cases and to deploy solutions into production
Communicate advanced ML/AI concepts to senior leadership to facilitate decision making
Supports maintenance of existing models and meeting service levels
Works cross functionally with product managers, data scientists, and engineers to understand, implement, refine, and design machine learning and other algorithms
Maintains knowledge of new learning approaches, technology, and tools through continuous research to ensure currency of solutions
Drives innovative ideas and act as one of the thought leaders in identifying and selecting use cases for applicability of machine learning, appropriate modeling techniques and technologies, and determines success criteria and implementation methodologies
Manages the hiring and training of new and existing staff, conducts performance reviews, and provides leadership, technical guidance, and coaching
Shares knowledge and develops staff capabilities to strengthen understanding of business issues and best practices
Develops and communicates organizational objectives; inspires and motivates team members to achieve results
Responsible for the establishment and maintenance of Agile Scrum ceremonies and methodologies on the team
Performs other duties as assigned
Complies with all policies and standards

 Education/Experience: Requires a Bachelor's degree and 5+ years of related experience.  Or equivalent experience acquired through accomplishments of applicable knowledge, duties, scope and skill reflective of the level of this position.  Technical Skills:

One or more of the following skills are desired.
Knowledge of Other: Statistical analysis
Knowledge of Other: Building predictive models
Knowledge of Other: Agile software development approaches such as Scrum and how to use them. Has experience in leading engineers through technical impediments and production support
Compute clouds, creating database schemas, Linux administration, continuous integration/continuous deployment, SQL, creating and consuming REST APIs
 Experience building ML/AI models using common methods within R and Python

 Soft Skills:


Ability to lead/manage others
Collaboration and team building skills
Effectively coaches and delivers constructive feedback
Instills commitment to organizational goals
Ability to communicate and make recommendations to upper management
Effective conflict management skills
Develops and delivers effective presentations
Demonstrated negotiation skills

 Pay Range: $116,800.00 - $216,200.00 per year
 Centene offers a comprehensive benefits package including: competitive pay, health insurance, 401K and stock purchase plans, tuition reimbursement, paid time off plus holidays, and a flexible approach to work with remote, hybrid, field or office work schedules. Actual pay will be adjusted based on an individual's skills, experience, education, and other job-related factors permitted by law. Total compensation may also include additional forms of incentives.
Centene is an equal opportunity employer that is committed to diversity, and values the ways in which we are different. All qualified applicants will receive consideration for employment without regard to race, color, religion, sex, sexual orientation, gender identity, national origin, disability, veteran status, or other characteristic protected by applicable law.
 Qualified applicants with arrest or conviction records will be considered in accordance with the LA County Ordinance and the California Fair Chance Act
&nbsp;",https://www.indeed.com/rc/clk?jk=191fae6880257ceb&bb=YHE_AFbg9fHwErHyZyGhZ5DQWSRQ6tGItFG_ZX5TRfzYQCZIz9OGlAcbjtoFZS0XeTA_QsS-JZ55q3q8jediBUxP8WLVFTUQOpv80Jn4NaXXmeOdWgMFnA%3D%3D&xkcb=SoA067M36z0Qqjy0H50JbzkdCdPP&fccid=5ece327da33e0274&vjs=3
