Job Title,Company,Location,Salary,Description,Link
Machine Learning Engineer 30,Adobe,"San Jose, CA 95110","$118,500 - $219,100 a year -  Full-time","Profile insightsFind out how your skills align with the job descriptionSkillsDo you have experience in TensorFlow?YesNoEducationDo you have a Master's degree?YesNo&nbsp;Job detailsHere’s how the job details align with your profile.Pay$118,500 - $219,100 a yearJob typeFull-time&nbsp;LocationSan Jose, CA 95110&nbsp;Full job descriptionOur Company  Changing the world through digital experiences is what Adobe’s all about. We give everyone—from emerging artists to global brands—everything they need to design and deliver exceptional digital experiences! We’re passionate about empowering people to create beautiful and powerful images, videos, and apps, and transform how companies interact with customers across every screen.  We’re on a mission to hire the very best and are committed to creating exceptional employee experiences where everyone is respected and has access to equal opportunity. We realize that new ideas can come from everywhere in the organization, and we know the next big idea could be yours!  The Opportunity Adobe is looking for a Machine Learning Engineer to understand & optimize the experience of Adobe’s Digital Experience customers. Partnering with Adobe Research and other business units, the candidate will build products that transform the way companies approach audience creation, journey optimization, and personalization at scale. You will join a diverse, collaborative, lively group of engineers and scientists long established in the ML space. The work is dynamic, fast-paced, creative, and data-driven.  What you'll Do Develop innovative models in partnership with Adobe Research. Design and build applications powered by predictive models, including working on traditional engineering problems such as defining APIs, integrating with UIs, deploying on Cloud services, CICD, etc., as well as implementing ML-Ops best practices. Understand data to make recommendation for the right predictive models, quality metrics and governance approaches. Engage in product lifecycle – architecture, design, deployment, and production operations.  What you need to succeed  The ideal candidate will have the following background: MS or PhD degree in Computer Science, Data Science or related field required. 3 to 5 years of applied AI/ML experience - developing, evaluating ML models, and deploying models into production. Deep understanding of statistical modeling, machine learning, or analytics concepts, and a track record of solving problems with these method Experience in or knowledge of building large scale data pipeline Ability to quickly learn new skills and work in a fast-paced team. Proficient in one or more programming languages such as Python, Scala, Java, SQL. Proficient in ML frameworks such as scikit-learn, SparkML, TensorFlow or PyTorch. Experience working with both research and product teams. Excellent problem-solving and analytical skills Excellent communication and relationship building skills  Our compensation reflects the cost of labor across several U.S. geographic markets, and we pay differently based on those defined markets. The U.S. pay range for this position is $118,500 -- $219,100 annually. Pay within this range varies by work location and may also depend on job-related knowledge, skills, and experience. Your recruiter can share more about the specific salary range for the job location during the hiring process.  At Adobe, for sales roles starting salaries are expressed as total target compensation (TTC = base + commission), and short-term incentives are in the form of sales commission plans. Non-sales roles starting salaries are expressed as base salary and short-term incentives are in the form of the Annual Incentive Plan (AIP).  In addition, certain roles may be eligible for long-term incentives in the form of a new hire equity award.  Adobe will consider qualified applicants with arrest or conviction records for employment in accordance with state and local laws and “fair chance” ordinances.  Adobe is proud to be an Equal Employment Opportunity and affirmative action employer. We do not discriminate based on gender, race or color, ethnicity or national origin, age, disability, religion, sexual orientation, gender identity or expression, veteran status, or any other applicable characteristics protected by law. Learn more.  Adobe aims to make Adobe.com accessible to any and all users. If you have a disability or special need that requires accommodation to navigate our website or complete the application process, email accommodations@adobe.com or call (408) 536-3015.  Adobe values a free and open marketplace for all employees and has policies in place to ensure that we do not enter into illegal agreements with other companies to not recruit or hire each other’s employees.&nbsp;",https://www.indeed.com/rc/clk?jk=0f04aa032fb02e3b&bb=3e_zvghnXMq92W2PzZN2aX7iLTGT9N9ujMDNty-oKRZeLHCoxHCLyAAJfOnAGLzgt7f2eJRzKvtyHSCVrn_M9jbA7atVlWDJwYlLgZ3Ifr9bU6rdpDhdOw%3D%3D&xkcb=SoDm67M360FYM4ybaB0GbzkdCdPP&fccid=f89deb5a97c7738a&vjs=3
"Engineering Program Manager, Machine Learning and Data - SIML",Apple,"Cupertino, CA","$165,500 - $248,700 a year -  Full-time","Profile insightsFind out how your skills align with the job descriptionSkillsDo you have experience in Tableau?YesNo&nbsp;Job detailsHere’s how the job details align with your profile.Pay$165,500 - $248,700 a yearJob typeFull-time&nbsp;BenefitsPulled from the full job descriptionDental insuranceEmployee stock purchase planHealth insuranceRSURetirement plan&nbsp;Full job description
Summary  Posted: Aug 2, 2024  Weekly Hours: 40  Role Number:200557439  Would you like to contribute to generative AI and transform how people interact with AI technologies? Do you believe Machine Learning and AI can change the world? We truly believe it can! We are the Data Team of the System Intelligence and Machine Learning (SIML) group within the software engineering organization at Apple. We are responsible for building high-quality ML datasets at scale used to train ML models that power AI-centric features for many Apple products (iPhone, iPad, Mac, Apple Watch, and even AirPods). Our work is behind essential features such as Camera, Text & Handwriting recognition, and Apple Intelligence experiences (Image Playground, Writing Tools, Smart Script, Math Notes..). AI-centric products are the future of software. At their core, data is the source code of AI, a key component of innovation and inclusive and fair ML products. We invite you to join us at this exciting time. Grow fast and positively impact multiple critical features on your first day at Apple!  Description  Our Data Engineering (DE) team is the critical backbone of our operations, designing and building ML & Data pipelines to support day-to-day operations and automating data flows. The team constantly deals with orchestrating large datasets, some in the scale of petabytes, in addition to making sure we meet regulatory/governance needs and the high data privacy standards of Apple. As the Engineering Program Manager for the Data Engineering group, you will help bring planning and program management excellence for our largest efforts. You will be a champion to scale the team's impact by enabling efficiency, scalability, and streamlined execution. In addition, you will also help accelerate progress on the various tools and technologies used by the team by influencing the roadmap of other engineering teams across Apple. IN THIS ROLE YOU WILL: - Own project planning and coordination for large Data Engineering initiatives, including requirements gathering, scoping effort, prioritizing, resource allocation, and schedule of deliverables. - Represent the DE team in conversations with R&D teams, Data Ops teams, and external vendors that we partner with to ensure data engineering topics are raised, discussed, tracked, and resolved appropriately. - Facilitate communication cross-functionally with other teams, ensuring that requirements are well understood, and that priorities and delivery schedules expectations are managed. - Drive data governance and other regulatory/privacy initiatives and make sure that processes are well documented and maintained to the high standards of Apple. - Partner with our engineering manager to help execute on the long term engineering initiatives by building a roadmap that balances short term requests and long term initiatives. - Identify problems/opportunities and pitch solutions (both technical & process oriented) in how Data Engineering can scale its impact and increase velocity. 
 
5+ years of experience in driving the design and development of data infrastructure and machine learning pipelines as a Technical Program Manager and/or Software Engineer.
Proven experience in driving the design and development of data tools and infrastructure as a Technical Program Manager and/or as a Software Engineer.
Familiarity with Machine learning (ML development lifecycle, typical data workflows, and model metrics) an understanding of how data fits into ML.
Experience working with Python, AWS, Airflow, Spark, Snowflake/Databricks, (No)SQL, Distributed Computing, Dashboards (Tableau, Grafana).
Experience in understanding and managing Engineering tools & infrastructure and influencing cross-team roadmaps to align with team/project needs.
High quality program management skills including program structuring and managing multiple work streams interdependently.
Demonstrated talent for effecting change and driving results through influence, and an ability to navigate complex organizational structures to foster collaboration across functions.
  Preferred Qualifications

Understanding of generative technologies (LLMs, diffusion models).
Proven experience working directly or adjacent to ML data operations (synthetic data creation, human data collection/annotation, data quality management) in support of machine learning features.
Experience with state-of-the-art ML techniques (transformer architecture, CLIP & other visual and text embedding models etc).
  Pay & Benefits

  At Apple, base pay is one part of our total compensation package and is determined within a range. This provides the opportunity to progress as you grow and develop within a role. The base pay range for this role is between $165,500 and $248,700, and your base pay will depend on your skills, qualifications, experience, and location.  Apple employees also have the opportunity to become an Apple shareholder through participation in Apple’s discretionary employee stock programs. Apple employees are eligible for discretionary restricted stock unit awards, and can purchase Apple stock at a discount if voluntarily participating in Apple’s Employee Stock Purchase Plan. You’ll also receive benefits including: Comprehensive medical and dental coverage, retirement benefits, a range of discounted products and free services, and for formal education related to advancing your career at Apple, reimbursement for certain educational expenses - including tuition. Additionally, this role might be eligible for discretionary bonuses or commission payments as well as relocation. Learn more about Apple Benefits.  Note: Apple benefit, compensation and employee stock programs are subject to eligibility requirements and other terms of the applicable plan or program.
  More

Apple is an equal opportunity employer that is committed to inclusion and diversity. We take affirmative action to ensure equal opportunity for all applicants without regard to race, color, religion, sex, sexual orientation, gender identity, national origin, disability, Veteran status, or other legally protected characteristics. Learn more about your EEO rights as an applicant.

&nbsp;",https://www.indeed.com/rc/clk?jk=9999d063b149915c&bb=3e_zvghnXMq92W2PzZN2aa7AcFS1Db4VwL0ZHMezTNNdBiD6FYSPjAmZFbSjor5-_c1Wy4Mz7b4dcFVu8awYcfls4kDRykJG4Zf0WVj6STsHp5Q6fHSrLA%3D%3D&xkcb=SoB767M360FYM4ybaB0FbzkdCdPP&fccid=c1099851e9794854&vjs=3
AI Clinical Specialist,Covera Health,"New York, NY","$90,000 - $115,000 a year -  Full-time","Profile insightsFind out how your skills align with the job descriptionSkillsDo you have experience in Time management?YesNo&nbsp;Job detailsHere’s how the job details align with your profile.Pay$90,000 - $115,000 a yearJob typeFull-time&nbsp;LocationNew York, NY&nbsp;BenefitsPulled from the full job descriptionCommuter assistanceDental insuranceHealth insurancePaid time offStock optionsVision insurance&nbsp;Full job description

About the company
At Covera, we're committed to ensuring high-quality healthcare is more than just a promise. That's why we're leading the way in the emerging science of quality, and connecting providers and payers in their shared quest to improve patient outcomes and care quality. By tackling this challenge, we have the ability to impact millions of lives by raising the standard of care nationwide.
Our initial focus is radiology, where an early and accurate diagnosis has a profound impact on the rest of a patient's care journey. Through our work, which uses clinically-validated science-based tools, we're helping doctors enhance their care, ensuring patients get the right diagnosis, and enabling the healthcare system to support quality improvement at scale.
Through our clinical intelligence platform, we have launched programs that help people access the most effective care and provide doctors with AI-powered quality insights and tools to enhance their care. Today, Covera is partnered with leading employers, payers and healthcare organizations across the US, including Walmart and Microsoft. And, with a pipeline representing over 25% of insured Americans, we are in the early stages of improving care quality for all patients across the globe.
In November 2023, Covera secured up to $50 million in a Series C extension led by Insight Partners. This capital fuels our mission to partner with healthcare providers, payers and employers to improve diagnostic care for patients everywhere.

 About the role
We are looking for a skilled AI Clinical Specialist to help structure our diverse radiology dataset across various modalities and subspecialties. You'll work with a dynamic team of data scientists, statisticians, engineers, and researchers to harness unique healthcare data, including MRI, CT, X-ray, and ultrasound images, along with clinical reports and claims data. Your work will contribute to developing methods for assessing and predicting healthcare quality, ultimately impacting patient outcomes and costs across all phases of care.
 In this role, you will be expected to:

Conduct radiology report annotations for various pathologies to support Product needs, including AI model training and validation
Run NLP Scripts: Although no prior experience or particular expertise with this is necessary, part of the onboarding process will focus on getting the hire comfortable with the established processes. These tasks will be supported and maintained by a scientist or engineer
Optimize logic of annotation and annotation workflows in collaboration with the AI team
Help to define and document the required annotation tasks for new AI projects
Build and maintain a codified clinical guidelines database with version control
Ensure accurate documentation of clinical guidelines and tailor the documentation for clients/end-users
Study task-related anatomy and terminology, becoming the team's internal subject matter expert
Work with the Translational AI team to coordinate clinical and analytic priorities
Develop areas of clinical research adjacent to Covera's core competencies, including the quality of radiology care, image quality, and report quality, among others
Performing other duties and contributing to additional initiatives/projects, as deemed appropriate by the Company's management team

Your profile:

1 to 3 years experience with basic interpretation of medical imaging (CT/MRI)
Strong problem-solving skills and attention to detail
Strong written and oral communication with excellent ability to work in a team environment
Ability to read and comprehend medical documents quickly and accurately, identifying the meaning of specific text and phrases
Ability to effectively communicate detailed information to healthcare providers
Strong personal time management skills, including the ability to manage multiple projects and meet deadlines
Passionate about technology, data science, and healthcare
Strong communicator with excellent interpersonal skills and a can-do attitude to work and thrive in a fast-paced team environment
Prior experience with radiology, radiology reports, and radiology nomenclature/naming conventions associated with radiology is heavily preferred

Benefits
You will be a full-time employee with a competitive salary, stock options, and great benefits. These benefits include medical, dental, and vision insurance, HRA, 401k, pre-tax commuter benefits, flexible paid time off, and a comfortable office space filled with various quality snacks and beverages. Most importantly, you'll get to know each of us and we love to work together to find solutions. We are a talented, fun, focused, and unique team of people who are truly passionate about changing healthcare for the better! Even while remote, you'll experience the Covera culture as we offer a host of virtual experiences including a book club, fitness club, guest speakers, dynamic Slack channels, and more!
The minimum and maximum salary for this position ranges from $90,000 to $115,000, in addition to a discretionary bonus and comprehensive benefits package. Final salary will be based on a number of factors including but not limited to, a candidate's qualifications, skills, competencies, experience, expertise and location.
At Covera Health, we strive to build diverse teams that reflect the people we want to empower through our technology. We are committed to equal employment opportunity regardless of race, color, ancestry, religion, sex, national origin, sexual orientation, age, citizenship, marital status, disability, gender identity, or Veteran status. Equal Opportunity is the Law, and Covera Health is proud to be an equal-opportunity workplace and affirmative action employer. If you have a specific need that requires accommodation, please let a member of the People Team know.

&nbsp;",https://www.indeed.com/rc/clk?jk=99be0e8870103e0f&bb=3e_zvghnXMq92W2PzZN2aW85qnpuWEdlWvyfswak0uxU-ykWJTg3RyxlqSmHzqQwdsI10dZ8gcNin9oiYxXGIUim4O6Q2GNeuekITRhiOVueZhgHVTYZxMeP37Y5VMeJ&xkcb=SoDP67M360FYM4ybaB0EbzkdCdPP&fccid=0da34673cfff5985&vjs=3
Senior Artificial Intelligence and Machine Learning Research Scientist,Oak Ridge National Laboratory,"Oak Ridge, TN 37830",Full-time,"Profile insightsFind out how your skills align with the job descriptionSkillsDo you have experience in Signal processing?YesNoEducationDo you have a Doctoral degree?YesNo&nbsp;Job detailsHere’s how the job details align with your profile.Job typeFull-time&nbsp;BenefitsPulled from the full job description401(k)Dental insuranceEmployee assistance programEmployee discountFlexible scheduleFlexible spending accountHealth insuranceShow morechevron down&nbsp;Full job description
Requisition Id 12989

 Overview:
As a U.S. Department of Energy (DOE) Office of Science national laboratory, Oak Ridge National Laboratory (ORNL) has an extraordinary 80-year history of solving the nation’s biggest problems. We have a dedicated and creative staff of over 6,000 people! Our vision for diversity, equity, inclusion, and accessibility (DEIA) is to cultivate an environment and practices that foster diversity in ideas and in the people across the organization, as well as to ensure ORNL is recognized as a workplace of choice. These elements are critical for enabling the execution of ORNL’s broader mission to accelerate scientific discoveries and their translation into energy, environment, and security solutions for the nation.

 We are seeking a full-time Artificial Intelligence and Machine Learning Research Scientist who will support the Cyber Resilience and Intelligence Division (CRID) in the National Security Sciences Directorate at ORNL. CRID provides new methods, tools, and strategies to detect and mitigate adversarial attacks on critical infrastructure and protections and informs national agencies about the nature, extent, and severity of adversarial actions with the goal of improving the US cyber and physical security posture.

 Major Duties/Responsibilities:

Provide technical insights for program and project developments.
Lead teams to define and implement sponsor requirements.
Interact with sponsors and funding agencies from project conception, proposal writing, and project execution.
Mentor early career staff through both formal project, task, and technical leadership.
Perform research & development at levels ranging from proof-of-concept development to software / system architecture.
All team members deliver ORNL’s mission by aligning behaviors, priorities, and interactions with our core values of Impact, Integrity, Teamwork, Safety, and Service. Promote diversity, equity, inclusion, and accessibility by fostering a respectful workplace – in how we treat one another, work together, and measure success.


 Basic Qualifications:

A Ph.D. in computer science, electrical engineering, or a related field and 6 years’ experience in government service or private industry. A combination of education and relevant experience may also be considered.


 Preferred Qualifications:

Experience leading teams and performing research in artificial intelligence / machine learning, specifically for cybersecurity, signal processing, biometrics, digital forensics, and/or computer vision for national security applications.
Proven track record managing and executing funding at both relatively low levels (<1 full time equivalent) to larger efforts (10+ full time equivalence).
Excellent written and oral communication skills.
Motivated self-starter with the ability to work independently and to participate creatively in collaborative teams across the laboratory.
Ability to function well in a fast-paced research environment, set priorities to accomplish multiple tasks within given timeframes and adapt to ever changing needs.


 Visa Sponsorship:
Visa sponsorship is not available for this position.

 Benefits at ORNL:
ORNL offers competitive pay and benefits programs to attract and retain talented people. The laboratory offers many employee benefits, including medical and retirement plans and flexible work hours, to help you and your family live happy and healthy. Employee amenities such as on-site fitness, banking, and cafeteria facilities are also provided for convenience.

 Other benefits include the following: Prescription Drug Plan, Dental Plan, Vision Plan, 401(k) Retirement Plan, Contributory Pension Plan, Life Insurance, Disability Benefits, Generous Vacation and Holidays, Parental Leave, Legal Insurance with Identity Theft Protection, Employee Assistance Plan, Flexible Spending Accounts, Health Savings Accounts, Wellness Programs, Educational Assistance, Relocation Assistance, and Employee Discounts.

 If you have difficulty using the online application system or need an accommodation to apply due to a disability, please email: ORNLRecruiting@ornl.gov or call 1.866.963.9545.

 #LI-DC1

 This position will remain open for a minimum of 5 days after which it will close when a qualified candidate is identified and/or hired.
We accept Word (.doc, .docx), Adobe (unsecured .pdf), Rich Text Format (.rtf), and HTML (.htm, .html) up to 5MB in size. Resumes from third party vendors will not be accepted; these resumes will be deleted and the candidates submitted will not be considered for employment.
 If you have trouble applying for a position, please email ORNLRecruiting@ornl.gov.
 ORNL is an equal opportunity employer. All qualified applicants, including individuals with disabilities and protected veterans, are encouraged to apply. UT-Battelle is an E-Verify employer.
&nbsp;",https://www.indeed.com/rc/clk?jk=528b9121d2aa2c7f&bb=81H1c1CfF0ZI0Ai_Oa_3jYNEpTFeWRq0WF9NMCVLLzlV2wxjoTMypoS_QbM_FRmcPFMEDL7E0EQCmqMOFHYMcalBbjEIqceh93-JZ1SPXz9HO26R4OUYJQ%3D%3D&xkcb=SoBW67M360F7-HySgB0LbzkdCdPP&fccid=64e028df9b3fd2c4&vjs=3
